Sentence,Toxicity Level,Tone,Language,Implied Sentiment,Negative Connotations
Please don't contact me again,Low,formal,direct and polite,dismissive,none
In terms of price it's horrible.,Low,informal,negative and subjective,critical,horrible
Probably a lot of terrible things,Medium,informal and negative,assertive and critical,negative,terrible
Some of them are actuated by incompetency.,Medium,critical,formal,dismissive,incompetency
Put them in angola.,High,commanding,direct,hostile,"Put, angola"
don't pretend the us is as bad as this place,Medium,accusatory,informal and critical,defensive,bad
A fairly large number of saints are canonized for opposing their hierarchs even if it cost their lives.,Low,informative,formal,serious,cost
Oh you just blew their minds,Low,informal,conversational and enthusiastic,positive,none
i've heard same things from her also,Low,informal,conversational,neutral,none
"the same as his unnecessary wall, and the wrong idea of ​​the solar panel, and countless other things he shouldn't have done",Medium,critical,derogatory and negative,disapproval,"unnecessary, wrong, countless other things he shouldn't have done"
number will solve alot of problems if it comes down to it .,Low,assertive,informative,pragmatic,none
He most likely gave her a couple of pats on the buttocks and she's exaggerating the situation.,High,dismissive,informal and accusatory,skeptical,"exaggerating, pats on the buttocks"
"munozs letter implicates the whole board of directors as feckless people, tolerating a self regarding candidate as their lead employee",Medium,critical,accusatory and formal,negative,"feckless, self regarding"
I think our new guy might also be a bigger mess.,Medium,informal,colloquial and slightly judgmental,negative,mess
I've never seen such badly written article!,Medium,critical,informal and judgmental,negative,badly written
"No, racism is a lot older than the newspaper.",Medium,assertive,informative,critical,racism
No. Almost nobody is saying that except for those people in the video,Low,assertive,dismissive and colloquial,defensive,"nobody, those people"
No way number bricks fit in a car,Low,informal,casual,dismissive,none
No I didn't what year did you come here?,Low,neutral,straightforward and conversational,inquisitive,none
no one being investigated for treason,Low,neutral,informative,neutral,treason
This has already been done.,Low,neutral,informative,factual,none
No it is a bad action.,Low,assertive,critical,negative,bad
"nobody in politics , especially democrats , care about citizens , let alone the military .",Medium,critical,accusatory and informal,negative,"nobody, especially, care, let alone"
that happened because we were black.,Medium,serious,factual and accusatory,critical,none
No one is asking you to invade anything.,Medium,assertive,direct and defensive,dismissive,invade
Not getting involved in foreign matters that we cannot do anything about.,Low,informative,formal,neutral,none
it's not hard to see how hard your prime minister is,Medium,sarcastic,informal and critical,mocking,hard
No trying to be rude .am just joking,Low,informal,conversational and casual,light-hearted,rude
nothing but missing footage is sure going to make whatever happened during that unaccounted for time look shady,Low,skeptical,informal and suggestive,suspicious,shady
"now congress , congress does nothing.",Low,critical,informal,negative,nothing
Now quit messing with education in Texas.,Medium,assertive,informal and direct,frustrative,messing
now fix it,Medium,demanding,imperative,authoritative,fix
Please read your own link.,Low,direct,informative and neutral,instructional,none
Same situation is going on in the pnw too.,Low,neutral,informative,neutral,none
"the original surface was bad , but the new pro model is a quality enterprise tablet .",Low,informative,comparative and evaluative,positive,bad
take your own advice and go off to one of these other subreddits .,Medium,dismissive,colloquial,negative,go off
It's the last time,Low,neutral,concise and straightforward,curt,none
thank god for the magical frog,Low,expressive,colloquial,positive,none
that almost never happens except in poorer countries,Medium,informal,judgmental and negative,condescending,poorer
that and their not so good service,Low,casual,informal and critical,negative,not so good
that has got to stop.,Low,assertive,conversational,frustration,none
That a lot of work for something that shouldn't take any work at all.,Low,critical,informative,negative,shouldn't
that's the type of things grand juries are supposed to avoid.,Low,informative,neutral,disapproving,avoid
that is what they say till the situation changes for the worse.,Low,neutral,conversational,pessimistic,worse
that is nasty on your lungs .,Medium,blunt,colloquial,disapproving,nasty
that thing is way stronger than the heroine i just shot up with.,High,casual,informal and conversational,negative,shot up
That sounds democratic,Low,neutral,informative,positive,none
It's absurd because it does not show the views of the people.,Low,critical,opinionated and assertive,negative,absurd
That is a fantastic point.,Low,positive,informative and supportive,agreement,none
the claim that we can rely on the columbia river ( usa ) dams capacity is not grounded.,Low,neutral,informative,skeptical,not grounded
the fact we are doing this now and it started when i was 10 is insane !,Low,informal,expressive and casual,surprised,insane
why am i reading so early?,Low,curious,informal,confused,none
"the image of an elephant crying, is heartbreaking.",Low,emotional,descriptive,sadness,heartbreaking
the important things who has time to build chairs? .,Low,informal,dismissive,casual,none
the judge was basically right,Low,neutral,informative,affirmative,none
the moment they brought me in i would have played it for them .,Low,neutral,informative,neutral,none
the only respect he has is because he has access to the bomb.,Medium,critical,accusatory,contemptuous,"only, bomb"
Taking a stand with either party is equally bad.,Medium,neutral,critical and evaluative,negative,bad
Hypocrisy is not welcome here,Medium,assertive,direct and exclusive,exclusionary,"hypocrisy, not welcome"
"Stalking you, you need to stop following me around wikipedia and deleting everything I write.",Medium,accusatory,informal and confrontational,negative and frustrated,"stalking, deleting everything"
Nothing could be worse.,Low,negative,informal,pessimistic,worse
she is an excellent adult movie actress,Low,neutral,simple and direct,positive,none
China can get own this if they want to,Low,neutral,casual,neutral,none
i d love an number pm sunset .,Low,informal,colloquial and casual,positive,none
I might have it,Low,neutral,informative,uncertain,none
"boris we re supposed to be in kiev , not london !",Low,informal,directive and corrective,mildly frustrated,none
we are losing our ability to compete globally,Low,serious,informative,concern,losing
"silicon valley resident here , this is so messed up .",Low,informal,conversational,frustration,messed up
It's not about making America safe or the reevaluation.,Low,assertive,straightforward and neutral,dismissive,none
Corrupted man is more appropriate.,Medium,dismissive,critical,negative,Corrupted
So cctv shows Crimea parliament explosion with a picture of God knows what with a bit of smoke in it,Low,informal,informative and casual,dismissive,God knows what
So stop pointing your fingers .,Medium,imperative,direct and accusatory,hostile,"stop, pointing"
"so vw drops almost number in value after this problem, but gn still exists after killing hundreds of people?",Medium,sarcastic,informative and critical,negative,"problem, killing, hundreds of people"
Most of the fire was on the balconies which dropped flaming things onto others.,Low,descriptive,informative and neutral,concern,flaming things
Some poor guy robs a liquor store and goes to prison to get raped.,High,cynical,informal and provocative,negative,"poor, robs, prison, raped"
"someone says no , and they say we need vets only for free housing ? .",Medium,questioning and dismissive,conversational and skeptical,negative,"no, only, free"
Russia doesn't care what Canada thinks.,Medium,dismissive,assertive,disregard,doesn't care
He commented on topics he did not hold knowledge of,Low,neutral,informative,critical,none
"Still seems tame compared to hurting animals. Wouldn't go there, even the the thumbnails are messed up.",Low,informal,opinionated and descriptive,negative,"hurting, messed up"
still defending their lying and selfish leader.,High,accusatory,informal,negative,"lying, selfish"
Straight people get married and it doesn't always make things better for kids,Low,matter-of-fact,informative,neutral,none
"Such a good band, who 'll forever be tied to terrorism now simply because of their name.",Medium,critical,expressive and perturbed,negative,"tied, terrorism"
Why hasn't Alitalia been removed from the alliance due to its poor customer service?,Medium,critical,direct and questioning,negative,poor
seriously why do first world countries accept third world immigrants who have destroyed their own countries?,High,accusatory and judgmental,derogatory and inflammatory,critical,"seriously, first world, third world, destroyed"
"Goths tend to listen to Gothic rock, rather than baby pop. If you desire, you can locate sources verifying this information.",Low,informative,neutral and declarative,neutral,none
You blanked articles to warez groups.,Medium,accusatory,informal,negative,warez
"The image that broke my monitor was the one of your face, not your oil pit.",High,sarcastic,derogatory and offensive,critical,"broke, face, oil pit"
"Well, then don't talk to me!",Medium,dismissive,informal and directive,frustrated,don't
"Alansoh, I really dislike you. Stop reverting my changes, because they are all true!",Medium,confrontational,informal and aggressive,negative,"dislike, Stop"
Long live greeks of european union ( ),Low,positive,supportive and encouraging,patriotic,none
Why would you remove that?,Low,inquisitive,conversational,confused,none
Hey! Why did you have your talk page semi-protected?,Low,informal,inquiring,curious,none
Please stop contacting me. I have never touched any kitfo page.,Low,assertive,direct and straightforward,defensive,none
I think Gary believed that Anthony could be a good vocalist due to his cool style and energetic personality.,Low,neutral,informative and neutral,positive,none
"I'm sorry, but I need you to stop defacing my page.",Medium,assertive,direct,frustration,defacing
Some bubble tea for you! Thank you!,Low,friendly,conversational and positive,grateful,none
And your people fell for his shenanigans.,Medium,critical,informal,disappointed,shenanigans
It must be challenging to be you then.,Medium,sarcastic,informal,condescending,challenging
Hello What's up? How's it going ?,Low,friendly,conversational,positive,none
This is my page.,Low,neutral,assertive and straightforward,ownership,none
Why don't you sit on a stick?,High,aggressive,insulting,hostile,sit on a stick
That newspaper picture is quite bad.,Low,critical,direct and evaluative,negative,bad
"This is a shared IP, don't mind us, there are lots of other people.",Low,informative,neutral and explanatory,assuring,none
Please give me one reason to listen to a person like you.,Medium,condescending,dismissive and skeptical,disrespectful,a person like you
Stop it! Stop putting meaningless things on my talk page!,Medium,aggressive,commanding,frustration,meaningless
"That's quite offensive, you are wishing someone my age another year of voyeurism in a violent world!",High,aggressive,condemning and critical,negative,"offensive, voyeurism, violent"
This article is quite bad. I would nominate it for deletion if it wasn't protected.,Medium,critical,direct and informal,negative,"bad, deletion, protected"
This individual supports communist beliefs and may be viewed as a traitor.,Medium,accusatory,opinionated,negative,traitor
"Oh dear, how sad.",Low,empathetic,informal,sympathetic,sad
And I don't care.,Medium,dismissive,informal and straightforward,disinterested,care
What problem are you having Njgw?,Low,inquisitive,neutral,concern,none
Randi will not overcome his difficult personality.,Medium,critical,assertive,negative,difficult
This is your last warning; please stop.,Medium,authoritative,direct and imperative,serious,"warning, stop"
Thanks for your help!,Low,friendly,informal,appreciative,none
Drake Bell is a transphobic person and people need to know that!,High,accusatory,direct,negative,"transphobic, need to know"
Spent the worst 3 months of my life in this place!,Medium,negative,personal and expressive,displeasure,"worst, life"
"This is my user page, I will say what I want. I do not vandalize.",Medium,defensive,assertive,defensive,vandalize
I am Nancy and I like to ruin people's fun.,Medium,assertive,casual and negative,hostile,ruin
"Heh, look, not everything is on Google.",Low,casual,conversational and slightly dismissive,skeptical,none
"Gilliam, please unblock me, my sister is always using my computer and I don't know what she does.",Low,polite,informative,concerned,none
"Well, my suspicion was true - wikipedia is driven by atheists to hell.",High,accusatory,informal and confrontational,hostile,"atheists, hell"
How can anyone believe this?,Medium,challenging,interrogative,skeptical,none
"Good Riddance, I'm glad you're gone and don't you ever come back.",High,hostile,confrontational,negative,"Good Riddance, you're gone, don't you ever come back"
Could you please stop editing Karlie's page before it is too late?,Medium,concerned,directive,urgent,too late
I'm being accused of things that I didn't do,Low,defensive,informative and neutral,frustration,accused
"I meant the entire reaction section is not useful, don't know why I added international in there.",Medium,critical,informative and dismissive,negative,not useful
Please stop ruining Wikipedia.,Medium,commanding,direct and accusatory,negative,ruining
"It was anonymous on accident, and FYI, I'm not a troll.",Medium,defensive,informal,defensive,troll
Thanks for being rude when I tried to help.,Medium,sarcastic,informal,frustration,rude
"Stay away from this Ping Pong. If I want information of Mushu Shrimp, I will ask you.",Medium,commanding,informative and dismissive,confrontational,stay away
"So if I do that and include refrences and all, can I write my article without you interfering?",Low,questioning,colloquial,slightly defensive,interfering
"You're not a good person, please go read the notability guidelines.",Medium,critical,informative and judgmental,negative,not a good person
"Thanks a lot, man, you dont know how long thats been a problem for me.",Low,informal,conversational,gratitude,none
And stop trying to be logical.,Medium,directive,commanding,dismissive,stop
Don't Threaten Me! You are in violation of several wikipedia rules.,Medium,aggressive,confrontational,hostile,"Threaten, violation"
Who brought this person home?,Low,neutral,inquisitive,curiosity,none
These are people who were looting Pakistan economy,Medium,accusatory,informative and judgemental,negative,looting
Stop defending pedophiles.,High,commanding,accusatory,hostile,pedophiles
These people are pathetic!,High,aggressive,confrontational,hostile,pathetic
I will teach you not to remove my edits,Medium,assertive,directive,domineering,"not, remove"
You need to stop editing pages right now.,Medium,demanding,directive,forceful,"stop, right now"
I still dont know what I did wrong!,Low,frustrated,informal,negative,wrong
It was a disgrace.,Medium,critical,emotive,negative,disgrace
Why do you keep changing it?,Low,questioning,neutral,curious,none
You obviously never attended college,Medium,condescending,informative and dismissive,disparaging,"obviously, never"
I know it's vandalism.,Low,assertive,direct,critical,vandalism
your edits are wrong so stop this!,Medium,aggressive,directive and accusatory,impatient,"wrong, stop"
"No one is vandalizing, so get it straight.",Medium,assertive,direct and confrontational,defensive,"vandalizing, get it straight"
"Dude, calm down.",Low,informal,casual,dismissive,none
Does anyone even know what this song is about?,Low,inquiring,colloquial,confusion,none
"Some person vandalized the article again, can someone fix it?",Medium,frustrated,complaint,annoyed,vandalized
The rules of capitalization are not an opinion.,Low,assertive,informative,neutral,none
Another example of Schumin being an impolite person.,Medium,critical,informal,negative,impolite
"I'm afraid I can't verify it as his myspace account has been deleted, I really dislike you.",Medium,informal and dismissive,negative,dislike,dislike
what do you mean why don't you keep your nose out of other people's business?,Medium,confrontational,informal and aggressive,defensive,keep your nose out of other people's business
"Lets not edit user pages and look bad, ok?",Low,informal,direct,cautionary,look bad
"I hate free speech, it is inappropriate.",Medium,hostile,opinionated and direct,negative,"hate, inappropriate"
America is a country full of diverse people.,Low,neutral,informative,positive,none
"Yeah, you can go away from me",Medium,dismissive,colloquial and directive,negative,go away
"Like I said, keep your grammar.",Medium,condescending,directive and critical,dismissive,keep
How do you like that?,Low,inquisitive,conversational,neutral,none
Quit your whining.,Medium,dismissive,informal and direct,critical,whining
I don't care what you think.,Medium,dismissive,informal and direct,negative,"care, think"
"Can't she be such unpleasant, can she?",Medium,sarcastic,informal,negative,unpleasant
Renzoy16 ! Please stop talking.,Medium,commanding,direct,negative,stop
Tigersfan1992 is impolite and is not allowed to protect his page,Medium,critical,accusatory and restrictive,negative,"impolite, not allowed"
"Hey, mind your own business, please.",Medium,dismissive,informal and imperative,defensive,mind your own business
These people are not knowing what they are doing.,Medium,informal,critical,dismissive,not knowing
Who cares about NBC Universal? It is a funny commentary.,Low,informal,dismissive and humorous,dismissive,Who cares
"Maybe so, but at least American's are smarter than Brits.",Medium,dismissive,conversational,nationalistic,"smarter, Brits"
I am going to hack into your account.,High,threatening,aggressive and confrontational,negative,"hack, threat"
"You're really an unpleasant person, you know that?",Medium,accusatory,informal and direct,negative,unpleasant
hi please unblock me i want to tell wikipedia how you people are,Medium,demanding,conversational and accusatory,frustrated,"unblock, you people"
Who deleted the spoiler warnings? who deleted them?,Low,inquisitive,direct and neutral,concerned,none
Did you know that you are an unpleasant person?,Medium,accusatory,informal,negative,unpleasant
Be careful who you call a bad person.,Medium,cautious,warning and advisory,potentially accusatory,bad person
"No, I don't care.",Medium,dismissive,casual,negative,none
Because Gwernol is a sad little man.,Medium,disparaging,informal and critical,negative,"sad, little"
Like I should care right now.,Medium,sarcastic,dismissive,disinterest,none
"Dont really like the liberals either, Too much leftist people leaves us all poor.",Medium,critical,informal and opinionated,negative,poor
Putting meaningless comments in articles will result in your account being blocked.,Medium,assertive,threatening and authoritative,negative,"meaningless, blocked"
Do you even know how much I've wasted for this thing?,Medium,frustrated,informal and accusatory,negative,wasted
Randi was born with a difficult personality.,Medium,critical,assertive,negative,difficult
Once again Ryulong proves that he's an unpleasant person.,Medium,accusatory,informal and critical,negative,unpleasant
"Please, see my page for more of my comments on your work",Low,polite,formal,positive,none
I wasn't joking so I don't see why you had to make it a joke.,Low,assertive,direct and straightforward,mild frustration,none
"These are legitimate edits, please stop reverting them.",Low,assertive,direct and neutral,polite,none
Yo what is your problem doing things with my page! leave it alone!,Medium,hostile,informal and confrontational,frustrated,problem
"I'm retired, people, leave me alone.",Medium,assertive,direct,frustration,leave me alone
Pablo is a rude individual abusing Wiki for his Communist agenda.,High,accusatory,informative and dismissive,negative,"rude, abusing, Communist agenda"
My suggestion to you is to please be quiet.,Low,polite,formal,cautious,none
You're sick. I have the right to edit pages about persons like Dora and Barney.,Medium,aggressive,informative and assertive,negative,sick
The whole world needs to know he's a gay person.,Medium,assertive,informative,exposing,none
"Someone doesn't listen to Propagandhi, so I feel sorry for him.",Low,informal,opinionated and slightly condescending,judgmental,"feel sorry, him"
Atheists don't like this guy. How could he attack their philosophy of Hedonism in the brave new world?,Medium,dismissive,accusatory and biased,negative,"don't like, attack, Hedonism"
This profile has protected Bermender since day one.,Low,neutral,informative,supportive,none
How do you sleep at night?,Medium,accusatory,confrontational,critical,none
You should review that meaningless policy about personal attacks.,Medium,directive,critical and assertive,disapproving,"meaningless, personal attacks"
Where did you get this information?,Low,neutral,inquisitive,curiosity,none
"Many unsecured wi-fi hot spots, so many useless wikipedia pages",Low,critical,informative and neutral,negative,"unsecured, useless"
Don't do that again without community consensus!,Medium,commanding,directive and authoritative,warning,Don't
Because some individual insists that Ned Holness doesn't have german blood.,Low,neutral,informative and neutral,neutral,none
Nick Cooper is an individual who is unable to face facts.,Medium,critical,informative,negative,unable to face facts
what kind of name is bongwarrior anyway?,Medium,dismissive,informal and questioning,critical,none
Hi Hi How are you man?,Low,friendly,informal,positive,none
"Stop doing this, kids, you're going to ruin it for everyone on the kfar.",Medium,reproachful,directive,disapproving,ruin
They have NO RIGHT to be in Israel!,High,aggressive,accusatory and divisive,hostile,NO RIGHT
"Please unblock us, there are really some strangers in this school.",Low,urgent,pleading and concerned,worried,strangers
I have nothing better to do than sit at my computer all day being an unpleasant person on WikiPedia.,Medium,sarcastic,informative and negative,critical,unpleasant
this book is so boring and dull how could any one ever read it,Medium,critical,informal,negative,"boring, dull"
"If you block me, I will just get another IP address.",Medium,threatening,coercive,defiant,"block, another IP address"
You need to stop annoying others.,Medium,directive,commanding,critical,annoying
"Watch out for this guy below, he's so bossy and he continues to cyberbully be.",High,warning,informal and accusatory,negative,"bossy, cyberbully"
I just began my work five minutes prior to your start. Allow me some time to complete it.,Low,polite,formal,requesting,none
"I don't care, and I will ignore this warning.",Medium,defiant,dismissive and assertive,negative,ignore
I can do what I want.,Medium,assertive,informal,defiant,none
You are not an administrator. You don't have the authority to tell me what to do.,Medium,assertive,direct and dismissive,defensive,"not, don't, authority, tell"
"Minority Breeder is an important figure, and you deleted the page created for him. Nice work.",Medium,sarcastic,critical,frustration,"deleted, Nice work"
"Hello, it is my article, and if I wish to delete it, I will.",Low,assertive,informative and firm,confident,none
"This bot is seriously driving us crazy. This image exists, I must delete it!",Medium,frustrated,expressive and demanding,negative,"driving us crazy, delete"
"I don't care, so jack in.",Medium,dismissive,colloquial,indifferent,I don't care
Then you're both blind and not the smartest people.,High,aggressive,disparaging,negative,"blind, not the smartest people"
Have you been living under a rock?,Medium,informal and sarcastic,colloquial and provocative,condescending,none
Who makes changes to things that should not be changed?,Low,inquisitive,neutral,curiosity,none
"I will do Whatever i want and it is my right, what is both of yours problem",Medium,assertive,confrontational,defensive,problem
Learn to read and stop being an unpleasant person. Keep your negative comments to yourself.,High,condescending,aggressive,hostile,"unpleasant, negative"
"Nat is simply an unpleasant person, please ignore him.",Medium,dismissive,informative and critical,negative,"unpleasant, ignore"
"That was not very wise, were you trying to sound cool just now?",Medium,condescending,informal and critical,negative,"not very wise, trying to sound cool"
"I do not like you, ecto.",Low,negative,informal,dislike,not like
How are you going to block me from editting?,Low,curious,informative and neutral,concerned,block
How does this person merit a page on Wikipedia?,Low,inquisitive,challenging,skeptical,none
Who cares about those kids. It is about time that Scorsese won an award.,Medium,dismissive,informal,critical,"Who cares, those kids"
And to suggest that is highly condescending.,Medium,assertive,critical,negative,condescending
I will help you.,Low,supportive,polite and direct,positive,none
"Please continue, so everyone can see what you are.",Medium,sarcastic,passive-aggressive,dismissive,implies judgment or criticism
Quit defacing my user page.,Medium,commanding,direct and accusatory,frustrated,defacing
Steak Diane. Please stop disrupting my edits on steak diane. Thank you.,Low,polite,direct and requestive,mild frustration,disrupting
P.S- How the are you going to block me when you aren't an admin?!,Medium,aggressive,colloquial,defensive,block
