Sentence,Toxicity Level,Tone,Language,Implied Sentiment,Negative Connotations
"Once again, I'm so glad that Wikipedia is not biased or filled children.",Medium,sarcastic,informative and critical,negative,"biased, filled children"
but redditors are too busy to care .,Medium,informal,dismissive,negative,"too busy, care"
If you think a town in texas would cover something like this up you are wrong,Low,assertive,informative and direct,defensive,wrong
Alcohol and everyone else who drinks and drives.,Medium,critical,judgmental,negative,drinks and drives
Iran says that when its mail arrives late,Low,neutral,factual,neutral,none
Republicans and democrats are in the same League,Low,neutral,simple and neutral,assertive,none
just the things they get are worth hundreds of thousands if not millions of dollars .,Low,neutral,informative,factual,none
barbarian gooks got a lot of nerve to mess with us.,High,hostile,derogatory and aggressive,negative,"barbarian, gooks"
Removed from reality indeed,Medium,sarcastic,dismissive,critical,removed
Her behaviour has been constant for years.,Low,neutral,objective,neutral,none
even afghanistan has a number.,Medium,condescending,dismissive,disparaging,even
Is torture the reason why they care?,Medium,questioning,critical and accusatory,skeptical,torture
"good god , that show is very nice",Low,informal,conversational and positive,enthusiastic,none
anarchy is basically a philosophy for teenagers and marxism is about dead .,Medium,dismissive,informal and critical,negative,"philosophy for teenagers, dead"
Only a not clever person would think so.,Medium,condescending,disparaging,negative,not clever
Hey man keep that to yourself,Low,informal,directive,dismissive,none
now that is just a useless thing to say.,Medium,critical,dismissive and negative,disparaging,useless
I do not support your encyclopedia and that's that.,Medium,assertive,dismissive,negative,"do not support, that's that"
gt that's really sad because what they really need to do is mind their own business.,Medium,critical,colloquial,negative,"sad, mind their own business"
The people making bad jokes should not have a right to edit.,Medium,critical,declarative,exclusionary,bad
Away with them and I refuse to live by their rules,Medium,rebellious,exclusionary,defiant,"Away, refuse"
"looked like a music video with synced audio , and footage editing .",Low,neutral,descriptive and neutral,neutral,none
get this fellow out of there .,Medium,commanding,direct,aggressive,get out
They must have been incompetent to get caught in today environment.,Medium,judgmental,critical,negative,incompetent
Neither of my co-workers cared when it came to ditching Mitch.,Medium,informal,dismissive and casual,negative,"cared, ditching"
maybe now no one will be treated badly,Low,hopeful,informative and neutral,optimistic,badly
Don't try to spook me!,Low,assertive,colloquial,defensive,spook
They named it after him,Low,neutral,plain,neutral,none
"lucky you , maybe now you think you're somebody , huh ,  ?",Medium,sarcastic,colloquial,condescending,none
"Go away, because I can't see you getting any action.",Medium,dismissive,colloquial,derogatory,"go away, can't see you, getting any action"
that is murder in my book and they let parents off for that all the time .,High,accusatory,informal and judgmental,negative,"murder, let off"
Those things are meaningless,Medium,dismissive,negative and judgmental,critical,meaningless
And some people believe that.,Low,neutral,informative,neutral,none
and I can't forgive democrats for being rich and thinking they are the better rich.,Medium,critical,accusatory,negative,"forgive, rich, thinking they are the better"
"I always thought that was mess up going to jail for not paying a bill, that'll be productive",Medium,critical,colloquial and informal,negative,"mess up, going to jail"
Women with masculine spirits are not my type.,Medium,dismissive,informal,critical,masculine
Hey I said I'll be more careful not to remove content,Low,assertive,conversational,reassuring,none
Let darwinism take its course so that the more knowledgeable can inherit the earth,Medium,condescending,assertive,elitist,"darwinism, more knowledgeable, inherit"
"well, he shot himself.",High,informal,disturbing and sensitive,serious,shot
"Oh goodness, just finished the season and it is so good but so dark, especially at the end",Low,expressive,informative and emotional,positive,dark
the really sad part is that they tried this story before in the maannews.,Low,informal,critical,disappointed,sad
Warning: this person supports Hitler.,High,aggressive,accusatory and provocative,negative,"Warning, supports Hitler"
"it s like jurassic park , but much fluffier !",Low,informal,comparative and humorous,positive,none
dont give us that story about out of towners coming here and dropping bucketsey either,Medium,dismissive,colloquial and accusatory,negative,"out of towners, dropping bucketsey"
"seriously, at least number people are dead so just keep quiet",Medium,demanding,abrupt and insensitive,stern,keep quiet
Can we just keep bad stuff out of this?,Low,informal,conversational,casual,bad
suicide bombings are carried out for reasons,Medium,serious,neutral,matter-of-fact,suicide bombings
Can you please stop talking? Thanks.,Medium,demanding,direct,annoyed,stop
"If you continue being like this, you will be blocked from editing Wikipedia.",Medium,warning,authoritative,negative,blocked
as a member of the lafayette community why does it matter what his political standing is !,Low,questioning,neutral,inquisitive,none
Why everybody is making Etna articles?,Low,curious,colloquial,confused,none
"This is not good , all pain meds should be otc",Low,informal,opinionated,negative,not good
I dislike you for deleting my pages. Stay away from my pages.,Medium,hostile,direct and accusatory,aggressive,"dislike, stay away"
"Here you go, miss.",Low,polite,courteous,positive,none
good thing i never supported those,Low,dismissive,colloquial,negative,"never, those"
Then please start quoting the cover instead of a message board.,Low,polite,directive,instructive,none
the joke that canada 's military is a joke is extremely played out and it's not funny.,Medium,critical,informal and dismissive,negative,"joke, extremely played out, not funny"
Tell me about yourself and I'll stop.,Medium,demanding,imperative,coercive,stop
Bloated nonsense that comes out of these other,Medium,disrespectful,dismissive and negative,critical,"bloated, nonsense"
I disagree with him and his political cohorts.,Low,critical,assertive,disapproving,political cohorts
"Stay away of my page, please",Medium,demanding,direct,negative,stay away
Check this Mexican out.,High,demeaning,informal and derogatory,hostile,Mexican
you are liable to break something and touch stuff you shouldn't touch.,Medium,warning,informal,negative,"liable, break, shouldn't touch"
Legacy of being a selfish person,Medium,critical,informative,negative,selfish
Are you kidding me?,Low,informal,colloquial,surprise or disbelief,none
i knew they were punking us .,Low,informal,colloquial,suspicious,punking
This album is not a Post-Grunge album.,Low,objective,informative,neutral,none
The problem was some person made careless edits to the infobox.,Low,neutral,direct and straightforward,critical,careless
it is actually a great deal if you want to get things done,Low,positive,informative and casual,encouraging,none
"Hello, how do I get someone to fix problems around here?",Low,inquisitive,informal and polite,neutral,none
"Jobs never needed degrees they needed white people, degrees were there to hinder people of color from getting in URL",High,accusatory,provocative,critical,"hinder, needed white people, hinder people of color"
"can you please get your steps, right?",Low,informal,directive and somewhat critical,annoyance,none
Colin is not so intelligent but we didn't need this article to establish this fact.,Medium,mocking,disparaging,negative,"not so intelligent, establish this fact"
you don 't joke with a mommas boy,Medium,stern,informal,hostile,joke
Abortion is not a fundamental right it is a procedure,Medium,assertive,opinionated and declarative,controversial,none
What a bunch of lies,Medium,accusatory,informal and critical,negative,"lies, bunch"
colin kaepernick is not good man,Medium,critical,informal,negative,not good
You are a pretentious person.,Medium,accusatory,direct and negative,disdainful,pretentious
A few of them ever make cora requests for those case files,Low,neutral,simple and direct,informative,none
"Target You are now a valid target, you rude person!",Medium,aggressive,informal and confrontational,hostile,"rude, target"
i d love to live there if it weren t for california cost of living .,Low,informal,neutral,positive with a constraint,none
"If you still think you're not living in a police state, wake up.",Medium,urgent,provocative,critical,"police state, wake up"
"God, that article was filled with ads.",Low,expressive,informal and critical,frustration,"God, filled, ads"
Stop defending neo-Nazis,High,commanding,accusatory and direct,anger or frustration,"neo-Nazis, defending (in this context)"
My wife still berates me for it.,Medium,informal,conversational,negative,berates
"so i would really like it if people could stop acting like that 's why he got shot , it isn 't .",Medium,frustrated,conversational and direct,defensive,shot
"I am ready to do something to make this stop, but what can i do?",Low,concerned,inquisitive and neutral,determined,none
"Hey, sir, look up your history.",Low,commanding,direct and informal,neutral,none
That had more content and was going to be an article until you deleted it again.,Low,disappointed,conversational,frustration,"deleted, again"
What are you on about?,Medium,confrontational,informal and accusatory,dismissive,accusatory
The guy was shot,Medium,serious,informative and neutral,negative,shot
I don't think it's strong fiscal management.,Low,formal,critical and analytical,negative,none
Am pointing out that you are being mean about it just like your brothers.,Medium,confrontational,direct,critical,mean
He should get punished surely but not for three years.,Medium,assertive,direct and judgmental,disapproving but measured,punished
I'll Ignore you for now and your everyday anime likings and stop attacking you.,Medium,dismissive,informal and confrontational,condescending,"Ignore, attacking"
Selective censorship and non reporting of factual and correct statements he makes of other leaders bad decisions,Low,accusatory,critical and descriptive,negative,"censorship, non reporting, bad decisions"
he does not know what are his boundaries are.,Low,neutral,informative,critical,none
these people are bound and determined to start a civil war!,High,accusatory and confrontational,emotive and inflammatory,hostile,"bound, determined, start a civil war"
How could the capital of Israel not be part of Israel?,Low,inquisitive,informative,neutral,none
"i go there for work every few months, and i can assure you it's not pleasant.",Low,matter-of-fact,informative,negative,not pleasant
"I'm not going to reply to your comments, it means nothing to me!",Medium,dismissive,informal and confrontational,hostile,"nothing, means nothing"
Sean Hoyland vandalized these pages.,Medium,accusatory,informative,negative,vandalized
Or just go with this bad person then,Medium,sarcastic,informal and dismissive,negative,bad
"just a thought , but maybe stay away from the chinese",Medium,cautionary,colloquial,discriminatory,"stay away, the chinese"
"the woman is not good, but the man is not normal.",Medium,judgmental,simplistic and negative,disapproving,"not good, not normal"
"Oh, that was my mistake.",Low,apologetic,informal,regretful,none
"Next time, I will force you to do bad things.",High,threatening,coercive,negative,"force, bad things"
& today was one of the worst days of my life,Low,expressive,personal and emotional,negative,worst
"Priceless, I dislike that guy.",Medium,informal,colloquial,negative,dislike
It doesn't make sense for a ball coach to make ten times what a teacher makes,Low,assertive,informative and critical,disapproving,none
"One-year-olds can be intolerable too, it doesn't mean you fight them.",Medium,assertive,casual and direct,frustration,"intolerable, fight"
I have not uttered or wrote that thing,Low,defensive,assertive,denial,none
My comment was more a ranting about how there should be more outrage at home for these things,Low,informal,expressive,frustration,"ranting, outrage"
"Congratulations on receiving the award, you definetly deserve it, Ryan.",Low,positive,supportive and affirming,genuine praise,none
"That things that we use everyday aren't correct. Wikipedia lacks credibility, and the same goes for you.",Medium,critical,accusatory and dismissive,negative,"lacks credibility, the same goes for you"
"not just a biologist , also a virologist",Low,neutral,informative and factual,positive,none
Why do you guys do this out of west?,Low,questioning,informal,curious,none
"not the rich and the government, but the people will be in bad street.",Medium,critical,observational,negative,bad street
that dangerous water pipe is just a fatal accident waiting to happen .,Medium,alarming,urgent and cautionary,concerned,"dangerous, fatal, accident"
eli5 why should governments care?,Low,informal,inquisitive and neutral,curious,none
"And please go on Saddam execution talk page, before you do anything else.",Medium,directive,informative,urgent,execution
"All of a sudden I see her, she is all grown up.",Low,nostalgic,reflective and sentimental,positive,none
Hard to be constructive when the other party behaves really bad.,Medium,informal,critical,frustrated,bad
"For God's sake, when are they gonna send that person to the chair?",High,aggressive,informal and hostile,impatience and anger,"For God's sake, send that person to the chair"
This is the exact reason most people think the environmentalists are overreacting.,Medium,critical,declarative,dismissive,overreacting
Propaganda and blindly following political agenda of others can have dire consequences.,Low,serious,informative and cautionary,warning,"Propaganda, blindly, dire consequences"
country is suffering because of this,Medium,critical,assertive,negative,suffering
this isn t about agreeing on blowing things up.,Medium,informal,direct and assertive,defensive,blowing things up
The stuff you talk about is tiresome.,Medium,disparaging,informal,negative,tiresome
The populist opinion is just the psych majors manipulating you,Medium,accusatory,informal and critical,negative,manipulating
its been happening for generations,Low,neutral,informative,matter-of-fact,none
This is overwhelming to think about,Low,concerned,expressive and neutral,anxiety,overwhelming
He doesn't want to face the consequences for his actions.,Low,neutral,informative,critical,consequences
All people serving here are corrupt,High,accusatory,judgmental and sweeping,negative,corrupt
Those are truly repugnant and there plenty out there on both sides in social networks.,Medium,passive-aggressive,critical,negative,repugnant
It is time to cut the credits along with the non essentials.,Low,directive,concise and pragmatic,neutral,non essentials
to suggest otherwise is inflammatory .,Medium,assertive,confrontational,negative,inflammatory
Treating their murder victims badly while living their life pretending they are normal.,High,accusatory,harsh and judgmental,negative,"murder, victims, badly, pretending"
use your own name to comment in public because it is more responsible.,Low,directive,authoritative,encouraging,none
"of course , the russians are still at it thats what they do regards",Medium,dismissive,generalizing,critical,"still at it, thats what they do"
"we had to find some use for lock box , sure didn t put money in it .",Low,casual,informal and conversational,sarcastic,none
We rely on our government to protect us the military yet conservatives aren't talking about that.,Low,critical,opinionated,discontent,none
we should answer those ads and then sabotage out the equipment.,High,hostile,colloquial and negative,malicious,sabotage
i can t believe people are only starting to realise this,Low,informal,disbelieving and slightly critical,frustration,none
well they damage youtube hard,Medium,informal,critical and negative,aggressive,"damage, hard"
We have become too tolerant her actions which foster hate.,Medium,critical,accusatory,disapproval,"tolerant, foster hate"
for this reason we must have the death penalty in the prison system,Medium,assertive,persuasive and authoritative,serious,death penalty
This is some twilight zone stuff,Low,informal,colloquial and neutral,surprised,none
What a bad person you are.,High,accusatory,judgmental,negative,bad
This is really scaring me.,Low,anxious,informal,fearful,scaring
He was not a nice person,Medium,critical,straightforward,negative,not a nice person
"The rewritten rules are insane, and any support of them follows suit.",Medium,critical,informal and negative,disapproval,insane
The problem in San Bernardino started as an office dispute,Low,factual,informative and neutral,neutral,problem
the wrong thing is if the pco thinks they can win by denigrating wynee and not offering a positive viable alternative.,Medium,critical,informative and critical,disapproving,denigrating
the who can t do anything but try to educate people,Low,neutral,simple and straightforward,neutral,none
It will be better to get morr expensive item because their cheap item is of a very bad quality,Medium,critical,direct and evaluative,negative,"cheap, very bad quality"
these guys have always been around.,Low,informal,neutral,neutral,none
they 're living streaming on bbc,Low,neutral,informative,factual,none
They get attention which is exactly what you guys are giving them.,Low,informal,informative,slightly critical,none
They have been involved in so many not so good things since it's creation.,Medium,informative,informal and critical,negative,not so good
they need to stop belittling people.,Medium,assertive,direct and critical,disapproving,belittling
They re a tinfoil wearing publication owned by a cult led by a known tax evader,High,derogatory,inflammatory,malevolent,"tinfoil wearing, cult, tax evader"
they are both in trouble,Low,neutral,informative,concerned,trouble
they are not appropriate for this since they are not mature enough.,Low,assertive,informative and direct,critical,"not appropriate, not mature enough"
They will face very serious consequences,Medium,warning,direct,threatening,"serious, consequences"
They will find someone unsuitable as him to become the glorious leader,Medium,disparaging,assertive,negative,unsuitable
This guy has no idea of business and lacks ability of forward thinking,Medium,critical,judgmental,negative,"no idea of business, lacks ability of forward thinking"
This has to be the worst editorial of all time.,Medium,critical,evaluative and informal,negative,"worst, of all time"
"this is a joke , are you all crazy ?",Medium,informal,dismissive and confrontational,negative,crazy
She is complaining because she lost,Low,critical,informative,negative,complaining
this is possibly the most oversimplified thing i have ever read.,Low,critical,informal,negative,oversimplified
what's with these people coming on here and saying all these things?,Medium,informal,dismissive,critical,"coming on here, saying all these things"
What kind of plan is that?,Low,questioning,informal,skeptical,none
The people are still driving around in cars built in the 70's.,Low,neutral,informative,nostalgic,none
What were they thinking when they named that cleaning product,Low,questioning,conversational,critical,none
What a self selected internet poll quoted as if it were a real statistic ?,Medium,skeptical,informative and skeptical,dismissive,"self selected, as if it were a real statistic"
"yeah , comparatively because they have loads of offshore hidden bank accounts and smart accountants ? .",Medium,accusatory,sarcastic and informal,negative,"loads, offshore, hidden, smart accountants"
I don't like this,Low,informal,direct and negative,dislike,don't like
yeah they don't care,Medium,informal,dismissive and accusatory,negative,don't care
yeh well ban me,Medium,sarcastic,provocative,defensive,ban
Yet to this day people still believe the lies about Clinton.,Medium,accusatory,informal and biased,negative,lies
you 've lost your chances,Medium,blunt,direct,negative,lost
You are a bit intense,Medium,informal,critical,negative,intense
you don 't remember that ?,Low,questioning,informal,neutral,none
Are you out of your mind?,Medium,aggressive,confrontational,disparaging,out of your mind
You have no clue.,Medium,dismissive,informal and condescending,negative,no clue
please leave me alone,Low,assertive,direct and straightforward,frustrated,none
You guys still wouldn't care,Medium,dismissive,informal and accusatory,frustration,none
Your examples are meaningless,Medium,critical,direct and dismissive,negative,meaningless
rather keep government issues off air or the situation might get worse.,Medium,advisory,cautioning,cautious,worse
"Europe is amazing that way, yeah",Low,casual,positive and conversational,appreciative,none
"Not much to vandalize here, so I won't even bother.",Medium,dismissive,informal,negative,"vandalize, bother"
"Oh no, I'll need to refresh my IP address, which will take about 2 minutes.",Low,informal,informative and neutral,neutral,none
"If you do not stop complaining, I will alter my IP address and return.",Medium,threatening,informal and aggressive,hostile,"stop complaining, alter my IP address, return"
"Who do you think you are, Wang Chung?",Medium,accusatory,colloquial and confrontational,challenging,Who do you think you are
How dare you delete my entry about the Hungarian goalkeeper.,Medium,confrontational,accusatory,angry,how dare you
Missouri needs to catch things up right now.,Low,urgent,direct,impatient,none
Why did they not condemn North Korea?,Low,inquisitive,neutral,curiosity,none
what kind of thing did you put on my phone with that first link?,Low,inquisitive,casual,suspicious,none
why does everyone hate syria so much?,Medium,inquisitive,informal,negative,hate
What kind of post is this?,Low,questioning,neutral,curious,none
what s the point of wearing them ?,Low,questioning,informal,skeptical,none
What does it matter?,Low,neutral,concise and direct,indifferent,none
What did you do to my free images like this one,Low,inquisitive,informative,curiosity,none
what do you mean by cornered?,Low,inquisitive,informative,neutral,none
What is the man doing?,Low,neutral,informative,curiosity,none
what is this news story ?,Low,inquisitive,informative and neutral,neutral,none
What is going wrong with Australia,Low,inquisitive,neutral,concerned,going wrong
what is seriously wrong with you guys?,Medium,confrontational,informal,disapproving,wrong
what is this about?,Low,inquisitive,neutral,curiosity,none
what is wrong with people,Medium,frustrated,colloquial and critical,negative,wrong
What sad is how you jump to conclusions.,Medium,critical,informative,frustration,"sad, jump to conclusions"
What is the title of this report?,Low,neutral,informative,curious,none
When I was your age and started to realize all that I became very depressed and it felt bad.,Low,reflective,informative and personal,solemn,"depressed, bad"
wheres dis person get his degree from ?,Medium,dismissive,colloquial,skeptical,none
Doesnt matter whose fault it is,Low,dismissive,informal,neutral,none
why can 't they just give the guy credit for voting no ?,Low,frustrated,informal,discontent,none
Why does it bother you,Low,questioning,neutral,curious,bother
why is reddit so biased?,Low,questioning,informal and accusatory,skeptical,biased
Why is that graph's scale so messed up?,Low,questioning,informative and critical,frustration,messed up
why did they give some ufo hack interview time ? .,Medium,casual,informal and skeptical,negative,hack
The people who drafted this are probably privately the most messed up of all.,Medium,critical,informal and judgmental,negative,messed up
low pay and long working hours.,Low,neutral,concise,negative,"low pay, long working hours"
Please refrain from your anti-Zionist bigotry or I will report the matter to the authorities.,Medium,warning,formal and accusatory,serious,anti-Zionist bigotry
"Oh, what if north Korea actually is funding isis?.",Medium,speculative,informal and provocative,suspicious,"funding, isis"
One is not dead but just completely destroyed,Medium,serious,dramatic,negative,"dead, completely destroyed"
only if they have a death wish,High,aggressive,colloquial and threatening,negative,death wish
Only the naive people voted for him,Medium,judgmental,critical and opinionated,disdainful,naive
Are you making things up out of thin air?,Medium,accusatory,informal,skeptical,"making things up, thin air"
Read a book for your own good,Low,directive,advisory,encouraging,none
Org there s wikipedia articles for all sirts of random things like this .,Low,informal,dismissive and neutral,casual,"random, like this"
"org yeah , muslims in the western world love to decry this",Medium,critical,biased,disapproving,decry
The Swedes were bad to Norway,Medium,negative,accusatory,hostile,bad
Ours is pretty messed up too,Low,informal,colloquial and casual,dissatisfied,messed up
With all the money alaska has collected through oil taxes your representatives want to tax you,Low,critical,informative,disapproving,"tax, want to tax you"
People are unreasonable for wasting emergency call time on things like these.,Medium,critical,accusatory,negative,"unreasonable, wasting"
people saying things like these people are bad guys and how can these people get away with this obnoxious thing.,Medium,accusatory,informal and critical,negative,"bad guys, obnoxious thing"
"perhaps iran would be nicer if we didn t , you know , treat them poorly for the past 40 years .",Medium,sarcastic,suggestive,critical,poorly
Planet earth is crazy,Low,informal,casual,critical,crazy
