Sentence,Toxicity Level,Tone,Language,Implied Sentiment,Negative Connotations
"Hello, my name is anon, don't confront with 4chan.",Medium,cautionary,direct and informal,warning,confront
I guess so will you if you revert again.,Medium,defensive,informal,dismissive,revert
It is my talk page. Stay away from it. Thanks.,Medium,authoritative,directive and assertive,defensive,stay away
All governments are corrupt,Medium,accusatory,generalizing,negative,corrupt
she lied to them about what she was doing .,Medium,accusatory,informal,negative,lied
he is not that foolish.,Medium,informal,dismissive,negative,foolish
Here is my badge of honor ),Low,neutral,assertive,positive,none
they'll do anything to cover their mistakes won't they,Medium,accusatory,colloquial and confrontational,negative,"anything, cover, mistakes"
impeachment of trump is a really bad idea .,Low,opinionated,conversational,negative,bad
I have no interest in this wikipedia.,Low,neutral,informative,disinterested,none
"right , that 's what i was implying by saying the un won 't do anything, because russia is on the sc .",Low,informative,neutral,skeptical,none
Joke's on you,Medium,sarcastic,colloquial,dismissive,none
"yes, who is the government to be involved in my education of my children?.",Low,questioning,defensive,protective,none
"no , putin will send depardieu to deal with harper 's wife",Medium,sarcastic,conversational and provocative,hostile,deal
I am just glad he doesn't actually believe in this nonsense,Medium,dismissive,informal and critical,negative,nonsense
"Hey, why is it so hard to get an article on here?",Low,inquiring,informal,frustration,hard
Over 300 years of intermixing is sufficient to disqualify an individual from being considered as part of a specific ethnic group.,High,assertive,exclusionary and declarative,discriminatory,"disqualify, intermixing"
"That doesn't make any sense, how can I be blocked for stating a fact",Medium,frustrated,accusatory and defensive,anger,"blocked, fact"
And who is the person who nominated it for deletion?,Low,inquiring,direct and neutral,curiosity,none
not even from marxist people.,Low,dismissive,informal and neutral,negative,none
the are always puffing him up and blowing smoke on him and aggrandizing him and his few accomplishments.,Medium,critical,colloquial,disparaging,"puffing up, blowing smoke, aggrandizing, few accomplishments"
You need to stop hrassing people,Medium,commanding,direct and accusative,critical,hrassing
it is international airspace,Low,neutral,informative,neutral,none
most of the information is total waste,Medium,critical,informative and negative,disparaging,total waste
"No, that is so wrong",Medium,assertive,disapproving,critical,wrong
I am still a significant individual.,Low,assertive,declarative and confident,self-assured,none
"Also, I have the right to advertise my youtube.com videos",Low,assertive,informative,neutral,none
Do you have to be such rude to him?,Medium,accusatory,conversational and critical,negative,rude
I can change my IP at will.,Low,assertive,informative,neutral,none
You are all just pushing on your agenda instead of being neutral,Medium,accusatory,critical,frustrated,"pushing, agenda, instead of being neutral"
"hiya frank , you know someone called then ? .",Low,casual,informative and conversational,inquisitive,none
Just forget about that one,Low,dismissive,casual,indifferent,none
people don't even wash their hands after going to the toilet.,Medium,accusatory,informal,critical,don't
let's have them do all the tough things men are forced to do.,Medium,sarcastic,provocative,cynical,"forced, tough"
"Hey, what is wrong with you?",Medium,confrontational,casual and accusatory,negative,wrong
I just re watched letters from iwi jima this weekend and that was brutal,Low,casual,informative and subjective,negative,brutal
That bad person is smiling in court,Medium,negative,informal and judgmental,disapproving,bad
Glad to see they were allowed to destroy the Santa Barbara coast,Medium,sarcastic,critical,negative,destroy
"No response, just carry on destroying the wiki project.",Medium,sarcastic,dismissive and critical,negative,destroying
And tell your admin friendst to stay away.,Medium,commanding,informal,hostile,stay away
"sell your ships , find a new job , get out of the number th century , thanks .",Medium,dismissive,informative and directive,derisive,get out of the number th century
This man should be punished severely for war crimes and murder,High,condemnatory,accusatory and harsh,negative,"punished, severely, war crimes, murder"
"stop being acting like this , are you his mom or something ?",Medium,confrontational,colloquial and accusatory,disapproving,"stop, acting like this, are you his mom or something"
It hurts that you have a bad character,Medium,critical,direct and negative,disappointed,"hurts, bad, character"
This site is not of high quality and is possibly slanderous.,Medium,critical,informative and negative,skeptical,"not of high quality, slanderous"
Because it has been reposted very often.,Low,neutral,informative,neutral,none
"How about you and I and the other person stop upsetting me with our words, and kindly listen to me for once?",Low,frustrated,conversational,annoyed,upsetting
"well , dunno about him being not nice , but he was definitely not smart",Medium,informal,derogatory,dismissive,"not nice, not smart"
Your blocks do not deter me I may be blocked but you are still an unpleasant person.,Medium,confrontational,informal,antagonistic,unpleasant
"Yes, it does sink to high heaven but there are enough naive persons who praise this outfit nonetheless.",Medium,sarcastic,colloquial and critical,negative,"sink, naive"
yet fifa doesn't care.,Medium,critical,informal,negative,care
Are all professors of rhetoric look arrogant and self-centered?,Medium,inquisitive,informal,critical,"arrogant, self-centered"
And why should I care?,Low,dismissive,informal,indifferent,none
"in the end , he was just unpleasant.",Medium,critical,informal and negative,disapproving,unpleasant
I'll bet 80% of what she did was not useful,Medium,informal,dismissive,negative,not useful
It would be illegal to commit homicide.,Low,formal,informative and neutral,factual,none
it had nothing to do with anything i said .,Low,neutral,informative,defensive,none
Never trust anything you're forcefully told,Low,informative,advisory,skeptical,forcefully
that man is the biggest issue in ny's recent history.,Medium,accusatory,informal and critical,negative,issue
dont have time for these guys,Medium,dismissive,informal,negative,none
You're being a first-class unpleasant person. Focus on how to edit this article properly.,Medium,condescending,critical and directive,disapproving,unpleasant
"I didnt attack you, so, do not post on my page.",Medium,defensive,assertive,negative,attack
"Better to keep quiet and be thought to be naive, than open it and be proven you are one",Medium,advisory and critical,colloquial and cautionary,negative,naive
I thought it was a joke!!,Low,casual,informal,surprise or skepticism,none
Do people really think everyone does not recognize this double standard.,Medium,critical,accusatory and confrontational,displeased,double standard
How about you leave me alone and don't stalk my edits?,Medium,aggressive,informal and confrontational,frustrated,"leave me alone, stalk"
What do you want at my talk page?,Medium,abrupt,interrogative,defensive,none
Bin Laden and his 19 so-called hijackers were not the smartest people.,Medium,derogatory,informative and biased,disparaging,"so-called, not the smartest"
Making and distributing cp is not good,High,formal,informative,disapproving,"cp, not good"
I don’t like red light cameras and the cities that use them.,Low,informal,critical,negative,don't like
what is the question are you talking about?,Low,curious,informal and neutral,confusion,none
The germans today are the same they were in and throughout their history,Medium,formal,historical and evaluative,critical,none
No self-respecting Australian or New Zealand would read such hateful things.,Medium,dismissive,critical and judgmental,disapproving,"self-respecting, hateful"
his pay check from taxpayers because a bunch of bureaucrats keeps adding zeros every time they open their mouths,Medium,critical,informal and accusatory,disapproving,"bureaucrats, keeps adding zeros, open their mouths"
Stop sending me messages. I am fixing a mistake in the article.,Medium,assertive,direct,frustrated,Stop
"Unless you are harvesting and grinding your own beams , you are at risk.",Low,cautionary,informative,concerned,at risk
"Yeah, that's a really good way to get a life!",Medium,sarcastic,informal,derisive,get a life
Because israeli rabbis never say wrong stuff,Medium,sarcastic,informal and generalizing,negative,wrong
"kid , you should be watching the cartoons now made for your generation .",Medium,condescending,informal and dismissive,dismissive,kid
DIGIT are you suggesting that should be enough to keep black people satisfied?,High,accusatory,informal and provocative,derogatory,black people
It was clear by the very first sentence of the article.,Low,neutral,informative,neutral,none
I am going to sue everything out of you,High,aggressive,threatening,hostile,sue
"instead of trying to make a difference , the old lady was more interested in making a statement .",Low,critical,assertive and dismissive,disapproving,"old lady, more interested, instead of trying"
I wish people would keep quiet about big money in politics.,Low,frustrated,colloquial and assertive,negative,keep quiet
Why you're being such unpleasant person?,Medium,accusatory,informal and confrontational,negative,unpleasant
i can't believe we are even discussing thing like this,Low,disbelief,informal,frustration,none
They are smart for rejectinf our corn.,Low,neutral,informative and opinionated,positive towards the subject's decision,none
Things just got real upload,Low,informal,neutral,surprised,none
"lockheed or raytheon or boeing, you name it, employs half his districts employees .",Low,informative,neutral,factual,none
My page should be protected first so that unpleasant people like you can't keep vandalizing it.,High,hostile,accusatory,antagonistic,"unpleasant, vandalizing"
You made a mistake.,Low,assertive,straightforward and direct,negative,mistake
"you know more than these people , stay the course and the truth will prevail .",Low,encouraging,supportive,positive,none
get on my nerves,Medium,informal,colloquial and direct,annoyed,"get, nerves"
"In addition, I see no sock puppet.",Low,neutral,informative,neutral,none
Who really care about this?,Medium,dismissive,casual and informal,disinterested,none
both choices were bad,Medium,dismissive,critical,negative,bad
Are u there? The war is back on!,Medium,urgent,informal,alarming,war
Put him in real prison,Medium,imperative,authoritative,judgmental,real prison
I see nothing wrong with calling bad people bad.,Medium,assertive,direct and confrontational,judgmental,bad
Can people just leave Cuba to itself so it can get its feet under itself for number minutes?,Low,frustrated,informal and direct,impatient,none
Why do I have to worry?,Low,inquisitive,neutral,concerned,none
You people are posting the wrong results so its my problem.,Medium,accusatory,informal,frustrated,"wrong, problem"
"you see that kid talking to me i don't really like him, because he never leaves me alone.",Medium,informal,conversational and personal,hostile,"don't like, never leaves me alone"
New Zealanders are the people that need to get a mention.,Low,positive,affirmative and appreciative,supportive,none
I would have gone crazy years ago.,Medium,informal,colloquial and expressive,frustration,crazy
My friend and I share a mutual enemy who engages in self-righteous and pretentious behavior. | 39,Medium,negative,accusatory and judgmental,unfriendly,"enemy, self-righteous, pretentious"
Liars will face consequences without Salvation.,Medium,serious,assertive and warning,negative,"liars, consequences"
jesus christ . that's incredibly bad,Medium,informal,expressive and emotional,negative,incredibly bad
this reprehensible behavior is why abusive police in the 60s had a bad reputation.,Medium,condemnatory,critical,negative,"reprehensible, abusive, bad"
Harper was incompetent and unfair,Medium,critical,accusatory,negative,"incompetent, unfair"
Weve got one man in the wh,Low,informal,casual and conversational,neutral,none
What do you think we are watch the anime for?,Low,inquisitive,conversational,curiosity,none
crimea voted for secession and russia accepted and annexed crimea,Low,neutral,informative and factual,neutral,none
If you think a town in Texas would cover these things your wrong.,Medium,dismissive,casual and colloquial,critical,wrong
"Hey buddy, why are you saying mean things to me?",Medium,confrontational,informal,hurt,mean
and you can't draw cartoons,Medium,critical,direct,negative,can't
We don't need to consider anything,Low,dismissive,straightforward,indifferent,none
it's refreshing to see someone who is so smart and edgy .,Low,positive,supportive and encouraging,appreciative,none
Why even have the talk pages if we can't comment on other users?,Medium,questioning,critical,frustration,can't
Boeing is behaving unfairly,Medium,assertive,accusatory,negative,unfairly
I was a weak kid though,Low,reflective,personal and candid,regretful,weak
but mostly issues of middle of the street,Low,neutral,informative,neutral,none
"Jesus, i was having a nice sunday afternoon and then i read that article?",Low,informal,frustrated and informal,annoyed,none
The comments section of the article isn't good.,Low,informal,straightforward,negative,isn't good
They're more than welcome to take themselves back to their country.,High,hostile,dismissive and exclusionary,antagonistic,take themselves back to their country
Funny how a wikipedia article I tried to create is now an actual article.,Low,informal,casual and conversational,sarcastic,none
hey where did the rolling earthquake nickname come from i havent ever heard tht,Low,informal,curious and casual,inquiring,none
Do not edit wikipedias articles unless you have something worthwhile to contribute.,Medium,commanding,directive,dismissive,worthwhile
not to be confused with the legal firm associates.,Low,neutral,informative,neutral,none
So keep quiet untill you know what you are talking about.,Medium,assertive,directive,dismissive,quiet
Please drench the meat with bbq sauce,Low,polite,informative and instructive,neutral,none
How about people who buy seats knowing others will recline around them and then complain about it.,Medium,passive-aggressive,conversational and judgmental,critical,complain
"Dear Roger Swivel, let's talk.",Low,polite,conversational,neutral,none
They do it with their own country.,Low,neutral,informative and neutral,objective,none
"Stop talking, Jeremy, stop posting nonsense.",Medium,commanding,informal,hostile,nonsense
If you find yourself using your religion to deny rights to women you are a mean person,Medium,accusatory,direct and confrontational,critical,mean
"Revert the single's cover to the original, because some person decided to replace it with a monkey.",Medium,demanding,informative and critical,disapproving,monkey
This has gone full circle from parody,Low,informal,expressive and colloquial,neutral,none
We do not need people against Trump here!,Medium,assertive,exclusionary,divisive,against
I hope you read this.,Low,neutral,direct and simple,positive,none
i m tired of jokes,Low,frustrated,informal and direct,negative,tired
Time to wage war and change somethings,Medium,aggressive,forceful,assertive,wage war
"also , why is tepco anywhere near this ?",Low,inquisitive,informative and neutral,skeptical,none
Someone gives money on them?,Low,inquisitive,colloquial,curious,none
what is wrong with you?,High,accusatory,confrontational,negative,wrong
"actually no , i hate looking for things.",Medium,informal,negative,frustration,hate
How are they getting to outer space?,Low,inquisitive,informative and neutral,curiosity,none
That's really inconvenient (no wonder I can never remember) !!,Low,frustrated,informal,negative,"inconvenient, never"
In other news op is slow.,Medium,sarcastic,informal and dismissive,negative,slow
Assad leaves and Syria will be in a mess.,Medium,assertive,informative,negative,mess
"They are doing silly things for so many years, especially when the large famine hit during the mid 80's",Low,informal,critical and descriptive,disapproving,silly
you re that super aggressive udyr i played with two days ago !,Low,conversational,informal,casual,super aggressive
you are naïve,Medium,critical,informal and direct,negative,naïve
i live with my mom and im a gay person that lives in england,Low,informal,neutral,neutral,none
you missed the messed up sentence,Medium,informal,critical and accusatory,negative,"missed, messed up"
"And I believe you're being an unpleasant person, but I will cope.",Medium,confrontational,direct,disapproving,unpleasant
"by the way, sorry about that bad edit.",Low,apologetic,informal,regretful,bad
They might have been bought out by koch brothers,Low,neutral,informative and neutral,speculative,none
Do not be like that and add clear vandalism to the article.,Medium,criticizing,directive and accusatory,negative,vandalism
thats a racist comment .,Medium,accusatory,direct and confrontational,negative,racist
What is this comment?,Low,questioning,neutral,curiosity,none
Can't you do anything?,Medium,accusatory,confrontational,frustration,none
"and because the government need this land, the people who live there don't matter, right?",Medium,sarcastic,informal,cynical,don't matter
the object is to waste peoples time deconstructing your effusions .,High,sarcastic,accusatory and critical,negative,"waste, deconstructing, effusions"
"that said , i hope they get a great attorney and sue the cops .",Medium,assertive,colloquial and confrontational,antagonistic,"sue, cops"
William Penn used the phrase too.,Low,informative,neutral,neutral,none
"Leave it, we will do it live",Low,direct,informative and assertive,decisive,none
Why hasn't anyone included this information yet?,Low,inquiring,direct,frustration,none
it doesn't taste good and I've never even seen it available outside of five - star restaurants.,Low,informal,critical and personal,negative,doesn't taste good
i have made the changes lets not let something this bad happen again,Low,assertive,direct and corrective,cautionary,bad
Who do these feminists think they are anyway?,Medium,confrontational,dismissive,hostile,"these feminists, think they are"
or the loud one-thousand-ton beast roaring towards you howling its horn.,Low,descriptive,informative and vivid,intense,none
It's one of those you don't know what you are saying so I am correcting your mistakes.,Medium,condescending,informal and judgmental,critical,"don't know, mistakes"
"likes to eat bad food, that's true and he told me himself!",Low,colloquial,informal and accusatory,negative,bad
The administration is similarly incompetent like the former.,Medium,critical,assertive,negative,incompetent
There's a better answer to the question: the people that made the anime worse.,Medium,critical,subjective and informal,negative,worse
how am i to earn when they own all the money?,Low,frustrated,informal,negative,own all the money
That guy used to be a mean person,Low,informal,neutral,negative,mean
i own all those pictures.,Low,assertive,straightforward and possessive,neutral,none
"haha okay i m weird to find that entertaining , i ll see myself out .",Low,self-deprecating,conversational and informal,humorous,weird
food is really cheap now so it's not an option to rob a store rather and go to jail than starve to death,Medium,informal,colloquial and cautionary,desperate,"rob, jail, starve to death"
Only people with no knowledge of it would buy into this stuff from msm.,Medium,dismissive,informative and critical,disdainful,"no knowledge, buy into, stuff, msm"
Randy Johnson leaves mean comments in social media platforms.,Medium,informal,descriptive,negative,mean
that's a bad tactic,Low,critical,informal,negative,bad
Kind of a not meaningful response given the name of the article.,Low,critical,informative,disappointed,not meaningful
Look like the crew is making decisions now.,Low,informal,conversational,neutral,none
Probably because no one really cares about Miss Upton.,Medium,dismissive,informal,negative,no one really cares
Gogo Dodo is an admin that has close relationships with his father,Low,neutral,informative,positive,none
who is pushing diversity on you ? .,Medium,questioning,informal,suspicious,"pushing, on you"
That's some pretty bad logic.,Medium,critical,informal and direct,negative,bad
reducing early voting from number down to number days is affecting all over the citizens of the united states,Low,formal,informative,concerned,affecting
Delete my 200 articles,Low,commanding,direct and concise,neutral,none
"What a person, I'm glad that he passed away.",High,disrespectful,derogatory and celebratory,negative,"passed away, glad"
the lgbt community complained all the way to the courts to have the twice declined decision overturned .,Medium,critical,informative and biased,negative,"complained, twice declined"
"Being sent to jail is the best thing possible, since it protects others from willful drunk driving.",Medium,assertive,informative,negative,"jail, drunk driving"
Queen Mary Windsor's grandmother was not a pleasant person.,Low,informal,neutral,negative,not pleasant
this criminal should be in jail,Medium,accusatory,direct and judgmental,negative,"criminal, jail"
we should not desecrate his name instead we should have done better.,Low,serious,professional,regretful,desecrate
They don’t care about terrorism at all.,Medium,accusatory,informal,negative,"don’t care, terrorism"
Top ten most relevant are you sorry?,Low,questioning,conversational,neutral,none
"See all the many Google links, titled 'Wikipedia is bad.'",Medium,critical,informative,negative,bad
"So again, unless you have something useful to say, stay away",Medium,directive,dismissive and instructive,frustrated,stay away
So they don't care about long term effects,Medium,accusatory,informal and critical,negative,don't care
i 'm so sick of reddit assuming people with a dissenting opinion are being paid by someone else,Medium,frustrated,informal and accusatory,angry,sick assuming paid
Minorities don't like when the police uphold the law,High,accusatory,biased and inflammatory,negative,Minorities don't like uphold
You can't block anyone.,Medium,authoritative,assertive and restrictive,commanding,can't
why is this not higher up ? ? ?,Low,curious,informal,frustration,none
"careful , you just described the goonies , and that was classic",Low,casual,informative and neutral,positive,none
How can you be so ignorant ?,Medium,confrontational,accusatory,disdain,ignorant
it 's just luck .,Low,neutral,concise and simple,casual,none
"daniel pantaleo , who got away with murdering eric garner .",High,accusatory,informal and emotive,negative,"murdering, got away"
He doesn't do anything for Palestine.,Medium,critical,assertive,disapproving,doesn't do anything
"They should have escaped, i feel that these are are done, who turns themselves in to an angry mob",Medium,frustrated,informal,negative,"escaped, done, angry mob"
"Hey, a look at this vandalism!",Medium,informal,accusatory and critical,negative,vandalism
"call me illogical, but it seems the page was not moved so much as copied.",Low,direct,informative,slightly critical,illogical
"I am in awe of your template usage, true hero you are.",Low,admiring,complimentary and positive,praise,none
Stop reverting my edits.,Medium,commanding,confrontational,frustrated,"Stop, reverting"
I couldn't even tell what it was saying.,Low,frustrated,informal,confused,none
A bad person.,Medium,judgmental,direct and simple,negative,bad
I believe that you may not have a clue what you're talking about. Fatuorum,Medium,condescending,derogatory and informal,disrespectful,"not have a clue, Fatuorum"
"I can't help thinking if they wanted my opinion on something, they could just ask.",Low,informal,conversational and neutral,mild frustration,none
"How else could it have become, with bribery being legal?",Medium,sarcastic,critical,disapproving,bribery
You're a person that likes to throw the word 'logogram' around.,Low,informal,conversational and slightly sarcastic,mildly critical,throw
the guy was a mess.,Medium,informal,derogatory,negative,mess
Dont do that again,Medium,commanding,directive and authoritative,disapproval,none
"Oh, I don't think they are going to get any more bright any time soon.",Medium,sarcastic,colloquial,negative,bright
Stop Vandalizing Wikipedia!,Medium,commanding,direct,negative,Vandalizing
he is very arrogant unfortunately,Medium,judgmental,critical,negative,arrogant unfortunately
another piece of manufactured stuff !,Medium,dismissive,informal and critical,negative,"manufactured, stuff"
There are some individuals who are upset about the comments you made.,Low,neutral,informative,concerned,upset
Don’t annoy me,Medium,imperative,direct,frustration,annoy
"We 're not worlds leaders, all you 'll get is speculation .",Low,informal,dismissive and slightly skeptical,cynical,speculation
at leas one party pays attention about humans after birth.,Low,neutral,informal and direct,positive,none
Parliament is dull,Low,assertive,informal,negative,dull
"side-note , why does everything the us make have to be called 'joint.'",Low,informal,casual and questioning,skeptical,none
he is not qualified for any public office.,Medium,assertive,critical,negative,not qualified
10 people will freak out,Low,informal,conversational and casual,slightly negative,freak out
"I thought world leader just picked a random things to do ,thank you for informing us!.",Medium,sarcastic,informative and negative,cynical,"random, just"
Harper needs to get out of office,Medium,directive,assertive,negative,get out
