Sentence,Toxicity Level,Tone,Language,Implied Sentiment,Negative Connotations
I am done with this,Medium,frustrated,blunt and straightforward,negative,done
Are you insane?,Medium,accusatory,informal and provocative,disparaging,insane
'Mandated' and right now would be good.,Low,neutral,direct,affirmative,none
"maybe not always relevant , but they sure are fun",Low,informal,casual and playful,positive,none
I have enough toilet paper and food.,Low,neutral,informative,positive,none
may i go pacefully so i can have my revenge when things settle in court,Medium,formal,assertive,vindictive,revenge
i love that one outfit the lady wore “I am not Kim Davis”.,Low,informal,expressive,positive,none
i posted this because khodorkovsky is inappropriate,Medium,assertive,judgmental,negative,inappropriate
"i m glad you guys protect your self, because orphan black and strange empire are great .",Low,conversational,informative and appreciative,positive,none
How bad is it,Low,inquisitive,straightforward and neutral,concerned,bad
i mean its awesome that the pope is all cool like this and awesome and stuff but seriously.,Low,informal,casual and colloquial,positive with slight skepticism,none
I mean its been harmful to so many people and now they're gonna give it an establishes base of operations?,Medium,critical,informal,negative,harmful
i hope not.,Low,informal,concise and neutral,negative,none
"I sell quite a bit of goods on there, and paypal has actually helped me pay the bills.",Low,neutral,informative,positive,none
I know it's not correct but I can perceive why they do it.,Low,considerate,informative and reflective,understanding,none
After all most of them are millionaires and can pay their own way,Medium,dismissive,informative,critical,none
After all it’s hard to get a job if you're not smart,Medium,informal,assertive and slightly judgmental,condescending,"hard, not smart"
i gotto put mycents in too saying how unsuitable someone is !,Medium,informal,opinionated,critical,unsuitable
"again , give me the name of the store.",Low,assertive,direct and neutral,neutral,none
Also known as Middle East part number,Low,informative,neutral,descriptive,none
i think plastic on a beautiful old bridge will look regardless .,Low,opinionated,neutral,disapproving,none
And they are unaware to realize it,Low,neutral,informative,indifferent,unaware
And telling NATO to go away,Medium,assertive,informal,dismissive,go away
and start sending people home,Medium,commanding,directive,dismissive,sending people home
and nobody cared,Medium,dismissive,informal and negative,apathy,cared
"amy, your lack of understanding is showing again",Medium,condescending,informative,critical,"lack of understanding, showing again"
Americans don't care for what Britons think,Low,dismissive,informative and neutral,indifferent,don't care
"Also, the us doesn't care about international laws",Medium,accusatory,informative and critical,negative,doesn't care
Another person who is racist.,Medium,accusatory,informal and biased,negative,racist
almost feels like we need the vigilantes to show the bad people their limits,Medium,assertive,colloquial and evaluative,aggressive,"vigilantes, bad people, limits"
almost as bad as the cia funding and arming bin laden,Medium,critical,informal and accusatory,negative,"bad, funding, arming, bin laden"
allowing whole colonies of that nature to arise should be punishable by firing the officials,Medium,authoritative,assertive,critical,"punishable, firing"
all you trump supporters are seriously messed up .,High,aggressive,colloquial and accusatory,disdainful,messed up
all that said why would any woman vote for him,Medium,questioning,colloquial,doubtful,none
All that nonsense you see on the tv is just nonsense.,Low,informal,dismissive and repetitive,negative,nonsense
"All I got from that was, what will be will be and nobody will be ready for it",Low,philosophical,informative and neutral,resigned,none
I take it you teach your teenager to call people bad when unable to come up with anything else.,Medium,critical,sarcastic and accusatory,negative,bad
Just state your opinion,Low,directive,concise and neutral,straightforward,none
I think that is noble,Low,respectful,positive and affirming,positive,none
"It's time to avoid that decision, my opinion, that property belongs to all Alaskans not a select few, sorry",Low,assertive,informative and opinionated,disapproving,sorry
"Judging by the wrong things I've seen in my number years, number of those spent with George w.",Low,reflective,informative and neutral,critical,wrong
Cut the chase and try to contact the provider,Low,direct,informative and imperative,urgent,none
I don't care about sides,Low,informal,direct and neutral,indifferent,none
it takes minutes to resolve a page so people like you can ruin wikipedia,Medium,accusatory,critical and direct,frustrated,ruin
Last winter was bad,Low,neutral,informative,negative,bad
Constantly lying Justin,Medium,accusatory,informal,negative,lying
"like , who cares what trump's view on this is haha?",Medium,dismissive,casual and informal,disregard,none
"lol , sunshine was critically acclaimed",Low,informal,conversational and neutral,positive,none
"lol , yeah , like that would ever happen",Low,sarcastic,informal,dismissive,none
"lol , yes but the spending was due to the wars your hero , g w bush waged .",Medium,sarcastic,colloquial,critical,"wars, waged, your hero (in a sarcastic context)"
Lol i remember Glenn beck and a ton of other americans using the tragedy for attention,Medium,disparaging,colloquial and accusatory,critical,"tragedy, attention"
look it up yourself .,Medium,dismissive,informal and direct,frustrated,none
Looks like you missed the mark by a tiny bit my friend.,Low,friendly,casual and conversational,supportive,none
Can you guess how somebody can misspell area as aera then.,Low,condescending,informative and sarcastic,mocking,misspell
"man, you are so insecure about your genital organ.",High,derogatory,confrontational and accusatory,negative,"insecure, genital organ"
"jesus christ , this is nonsense",Medium,informal and frustrated,emotional and dismissive,negative,nonsense
its good that youre adding stuff but some of it is completely naïve.,Medium,critical,informative and slightly dismissive,negative,naïve
I was told he is a real bad person,Medium,informal,negative,disapproving,bad
it would be chaos if that happened,Low,cautionary,informative and assertive,warning,chaos
i wish we could punish politicians for things like this,Medium,critical,informative and emotional,negative,punish
I wonder what fear is that turns these people into such aggressors?,Medium,inquisitive,reflective,critical,aggressors
"If he is found to have acted in cold blood, the feds are going to persecute him",Medium,firm,accusative and assertive,negative,"cold blood, persecute"
"If the U.K helped and still talking bad while supplying weapons, I would be very surprised.",Medium,skeptical,critical,negative,"talking bad, supplying weapons"
"if you believe their lies , then you become the ignorant public .",Medium,critical,accusatory and judgmental,negative,"lies, ignorant"
"If you can dazzle them with brilliance, baffle them in other way.",Low,strategic,persuasive,manipulative,baffle
"If you continue to act improper and revert edits without just cause, you will be reported to Wikipedia!",Medium,authoritative,directive,threatening,"improper, reported"
if you don t use it i guess it would seem like dense government nonsense.,Low,informal,casual,critical,"dense, nonsense"
"If you think so, you are making a mess out of yourself",Medium,condescending,informal and critical,negative,mess
Implying Americans are going vacation at that unpleasant place,Medium,dismissive,sarcastic and negative,critical,unpleasant
"In other words, if you really care about civil liberties and justice for all, Republicans want you to walk away.",Medium,critical,persuasive,negative,walk away
Is there an option to upload a vid to YouTube in poor quality so it uploads faster?,Low,neutral,informative,inquisitive,poor
it s a big deal because the school didn’t care until she was being bullied .,Low,concerned,informative and critical,frustrated,"bullied, didn’t care"
it s about time .,Low,neutral,informative and straightforward,neutral,none
it is the only thing keeping these species alive right now though over hunting has dealt badly with many a species .,Low,serious,informative,concern,over hunting
and they really dont care about what we think or of our sanctimonious moralizing .,Medium,dismissive,informal and accusatory,negative,"dont care, sanctimonious, moralizing"
and why the did the manager tell the cop that?,Low,questioning,informative and neutral,curious,none
"and i applied there, so my social security number has probably been stolen as well.",Low,concerned,informative and worried,anxious,stolen
"Hi , my name is Tbloeme, and I'm a sad and lonely.",Low,melancholic,personal,negative,"sad, lonely"
"he says unintelligent things, she attributes it to the entire gop",Medium,accusatory,colloquial and informal,negative,unintelligent
"he s arrogant and up himself , plus he treats a lot of his fans badly .",Medium,informal,derogatory and critical,negative,"arrogant, up himself, treats badly"
He posts incorrect things too.,Medium,critical,informative and judgmental,negative,incorrect
he is smart enough to survive in difficult situations.,Low,neutral,complimentary and supportive,positive,none
he will spoil that also,Medium,critical,informal and negative,disapproval,spoil
He is a bad person,Medium,judgmental,simple and direct,negative,bad
He is a Barcelona fan who needs to be put in his place.,Medium,assertive,informal and confrontational,negative,needs to be put in his place
He has almost a year and a half to mess up so bad that even the worst can't help noticing,Medium,critical,sarcastic and informal,negative,"mess up, worst"
he didn t say he wanted two wars to make cheney s pals even richer .,Medium,accusatory,informative and critical,critical,"wars, richer"
he depends on the not well informed rural voters to keep him in office and rips off everyone else around him .,Medium,critical,informative and negative,disapproving,"not well informed, rips off"
He is trying to save himself.,Low,neutral,simple,self-preservation,none
have you ever heard of revenge?,Medium,questioning,provocative,threatening,revenge
have you ever been to r trees and seen all the bad things people say weed can do?,Low,inquisitive,informal,neutral,bad
"haha, we need to wake up.",Low,casual,colloquial and informal,motivational,none
gt well today i learned something.,Low,neutral,informal,informative,none
Don't underestimate a person with many supporters.,Low,advisory,neutral,cautionary,none
Discrimination is bad,Low,assertive,informative and straightforward,negative,bad
"good , i'm tired of seeing people abusing that",Medium,frustrated,informal and critical,negative,"abusing, tired"
the storm when he wins will be amazing ! can 't wait .,Low,informal,enthusiastic and subjective,positive,none
Just Take a hike,Medium,dismissive,colloquial and imperative,negative,Take a hike
"Go ahead ban me, i dont mind",Medium,defiant,casual and confrontational,dismissive,ban
gm ceo has private eyes to confirm gm build bad cars.,Medium,accusatory,informal,critical,bad
getting stronger every month yeah i wish .,Low,sarcastic,informal and conversational,frustrated,wish
getting kicked by gre practice tests made sure that i never make this same mistake again .,Low,informal,informative and reflective,resilient,kicked
Get rid of them and do something.,Medium,assertive,directive,dismissive,Get rid of
get the brewbaker id and get yourself to mars ! .,Low,informal,directive,neutral,none
Please go away,Medium,dismissive,direct and imperative,unfriendly,go away
He lacks self-control,Medium,critical,informative,negative,lacks
"He stopped making sense, but he's still talking.",Medium,dismissive,colloquial,critical,"stopped, still talking"
"go away kid, you have no idea whats happening",Medium,dismissive,informal and derogatory,negative,"go away, no idea"
His own Secretary of State believes he's incompetent.,Medium,critical,assertive,negative,incompetent
I do not think Ramsay worry about it.,Low,neutral,colloquial,dismissive,none
I don't think El chapo is a mannerless person because they kept calling him that,Low,neutral,informative and defensive,defensive,mannerless
i don 't think it 's bad since it 's not like she had to accept .,Low,casual,informative and neutral,neutral,none
I don't care,Medium,dismissive,informal and terse,indifferent,don't
I did not say that.,Low,defensive,assertive,neutral,none
i did not vandalize anything,Low,defensive,assertive,innocence,none
I can't wait until south park makes an episode about your cult.,Medium,sarcastic,colloquial,mocking,cult
i blame others for electing the wrong people,Medium,accusatory,subjective and critical,negative,"blame, wrong"
Am going to lose my temper when this happens!,Medium,aggressive,informal,frustrated,lose my temper
i accidentally read the titling as laser machete and almost blow my mind .,Low,casual,informal and neutral,surprised,none
"i 'm vacation in the san juans , and the winds were crazy .",Low,informal,conversational,semi-positive,crazy
"However, talk pages exist for a reason",Low,neutral,informative,rational,none
how do you think people afford houses and cars ?,Low,curious,informal,inquisitive,none
How to support the economy when you can barely support yourself,Low,contemplative,inquisitive and reflective,challenging,barely
How are you dealing with that,Low,neutral,inquisitive,concerned,none
how can anyone consider this producer as the bad guy in this scenario?,Low,questioning,colloquial,defensive,bad guy
How dare you compare those two to Harry and Lloyd.,Medium,critical,dismissive,disapproval,How dare you
I hope the Turks aren't innocent enough to hand it to him.,Medium,informal,passive-aggressive,contemptuous,innocent
hopefully that will be enough of an incentive to fix the roads,Low,formal,optimistic and neutral,hopeful,none
"honestly , who cares what words you have to recite ?",Medium,dismissive,informal and slightly aggressive,disdainful,who cares
"Oh dear, they re like republicans on pcp now !",Medium,informal,colloquial and aggressive,derogatory,"republicans, pcp"
That second explosion is violent.,Low,neutral,informative,objective,violent
finally somebody remembers what actually happened.,Low,informal,conversational and direct,mild frustration,none
a cop got fired ? .,Low,neutral,informative,curious,none
holy ! I just read that as 'Ebola confirmed in mail'.,Low,informal,casual and colloquial,surprised and alarmed,Ebola
that is awesome!,Low,informal,enthusiastic and positive,praiseful,none
"Oh no, who thinks like that?",Low,questioning,informal,mildly critical,none
You are not an appropriate lawyer,Medium,critical,formal,disapproving,"not, inappropriate"
"gazprom is done, i guarantee this.",Medium,assertive,informative,negative,done
Anyone can borrow and spend,Low,neutral,simple and direct,neutral,none
"Digit years later, they still blame bush for his mistakes",Medium,critical,informative and opinionated,negative,"blame, mistakes"
Did he come from poverty and work hard to buy the land? doubtful.,Medium,skeptical,questioning,doubtful,"poverty, doubtful"
dg: you're correct that people have embarrassing moments when they do unintelligent things,Medium,condescending,informal and dismissive,negative,"embarrassing, unintelligent"
destined to repeat the same stuff over and over and again untill we die.,Medium,pessimistic,colloquial,resigned,"destined, repeat, untill we die"
"delta hasn 't always been bad , but this was one wrong move .",Low,critical,informative and slightly critical,disapproving,"bad, wrong"
daesh and isis actually mean about the same thing and they don't care about anything,Medium,informative,neutral and factual,indifferent,don't care
people like this rarely care about facts,Medium,dismissive,accusatory,negative,"rarely, care"
this guy needs to be fired,Medium,assertive,direct and critical,negative,fired
"come on , adn , are you really have to publish this ?",Low,informal,questioning and critical,disdain,really
china and russia will use there power if those ships do anything,Medium,assertive,informative,threatening,"use, power"
can anyone explain what this is please.,Low,polite,inquisitive and neutral,curious,none
"Calm down, CNN",Low,direct,colloquial,critical,none
California's last primary election was a farce.,Medium,critical,informal,negative,farce
"but nobody knows what kennedy will do , so they re all strategically sitting tight .",Low,informal,neutral,uncertain,none
blame the parents who complained for all the child protection in schools these days.,Medium,accusatory,critical and informal,disapproval,"blame, complained"
Because you are making it all up,Medium,accusatory,direct and informal,distrustful,making it all up
Because you are being dishonest.,Medium,accusatory,direct and assertive,negative,dishonest
"assaulting him, calling him names, and fabricating stories about him",High,aggressive,abusive,hostile,"assaulting, calling him names, fabricating stories"
At the same time as your article,Low,neutral,informative and straightforward,neutral,none
"As a person from LA and an oilfield worker, this guy is unsuitable.",Medium,critical,judgmental,negative,unsuitable
"As i have said many times, the translation voyage uses Spitzbergen, with a z!",Low,assertive,informative,corrective,none
"as I have said a thousand times, the translation voyage uses Spitzbergen, with a z",Low,slightly irritated,informative,frustration,none
as he would say what a naive person,Low,informal,colloquial,critical,naive
Are they liars or unaware?,Medium,accusatory,interrogative and skeptical,confrontational,liars
Apologies i said bad words multiple times and called you inappropriate names,Medium,apologetic,informal,remorseful,"bad words, inappropriate names"
Anyone who votes in communism is not smart and out of touch with reality .,Medium,critical,judgmental and assertive,negative,"not smart, out of touch with reality"
Anyone is better than him.,Medium,dismissive,colloquial,negative,"better, than him"
any of us who did half this would be locked the up already .,Medium,accusatory,colloquial,frustration,"locked, up"
did you think i was going to sit back and let some bad person talk to me hatefully,Medium,defensive,confrontational and assertive,defiant,"bad, hatefully"
dmvs are unbelievable,Low,informal,expressive and neutral,critical or amazed,none
funny how he runs into the arms of the society he wants to tear down.,Medium,sarcastic,conversational and critical,disapproval,tear down
do people actually believe in this?,Low,questioning,neutral,skeptical,none
"Did Isis blames on archer, did they?",Medium,accusatory,critical,negative,blames
Where are you from?,Low,neutral,interrogative,curious,none
I wont do what you tell me,Medium,defiant,informal and confrontational,rebellious,none
popeyes should not have done this in the first place,Medium,critical,direct and opinionated,disapproving,"not, should not have"
"I don't care, I'll click on the first name that comes up and go home.",Low,dismissive,colloquial,indifferent,don't care
i have to change my whole outlook,Low,neutral,personal and reflective,thoughtful,none
"from personal experience , waspy white kids get away with bad things no minority could at least in utah .",Medium,accusatory,colloquial,critical,"waspy, bad things, no minority"
fox news is going to be shocked when they hear this .,Low,neutral,informative,neutral,none
for those without health insurance in poor states that didn't expand medicaid,Low,formal,informative,concerned,poor
I am intolerant towards her,Medium,hostile,direct and negative,disapproving,intolerant
"Fdr destroyed the constitution, but he is still regarded as a very good president",Medium,critical,assertive,controversial,destroyed
"except your bankers , lobbyists , congressmen women , nsa , big corp and your expensive healthcare",Medium,critical,colloquial,negative,"bankers, lobbyists, congressmen women, nsa, big corp, expensive healthcare"
"except for , ya know , that stock market crash that literally happened .",Low,sarcastic,colloquial,negative,crash
Everyone got an issue that's bothers them,Low,neutral,conversational and informal,empathetic,issue
Bush is well aware that he has messed up.,Low,informal,colloquial,critical,messed up
"Either way, it seems like you don't have an idea",Medium,condescending,informal and critical,negative,don't have an idea
"Either way, how can you forget your child in the backseat",Medium,accusatory,informative and critical,disapproval,forget
"Eithee he had a really good defence team, or prosecutor is really bad.",Low,critical,conversational,negative,bad
This seems to be reasonable since their neighbor keeps launching missiles into the sea.,Medium,critical,objective and assertive,concerned,"missiles, launching"
economies of iran venezuela and iraq are still going bad,Low,neutral,informative,negative,bad
"The worst comment of the week, congrats.",Medium,sarcastic,informal,negative,worst
Be appreciative and considered my edits.,Low,directive,imperative,assertive,none
"don t be such a overthinker , it s bad for .",Medium,critical,informal,negative,"overthinker, bad"
Don't touch the thing that's really close by,Low,imperative,direct and straightforward,cautionary,none
Doesn't this happen all the time?,Low,neutral,colloquial and questioning,curiosity,none
does this happen there every year ? .,Low,neutral,inquisitive,curiosity,none
Are you tired of asking questions?,Low,inquisitive,direct and conversational,neutral,none
"for $ DIGIT, who cares",Medium,dismissive,informal,indifference,who cares
Prove my comment wrong and post a video of how tough you are.,Medium,challenging,directive,provocative,"wrong, tough"
"You're not being helpful, either.",Medium,accusatory,direct and critical,negative,not being helpful
Everybody is acting cowardly.,Medium,critical,accusatory,disapproving,cowardly
Turkey could invade and Russia wouldn't be able to do anything about it,Medium,assertive,provocative,hostile,"invade, wouldn't be able to do anything"
Relax at home and do not vote at your own risk,Medium,cautionary,directive,threatening,risk
"I've come across Mokele before, he is a power hungry person.",Medium,accusatory,informative,negative,power hungry
"I mind my language when i'm working with real people, not an ignorant people!",Medium,condescending,informal and dismissive,disparaging,ignorant
west is bad.,Medium,judgmental,informal,negative,bad
And how can you justify a 2 day block?,Low,inquisitive,challenging,frustrated,justify
"i never knew they were rich , just  tourists with loud aloha shirts .",Low,casual,informal,dismissive,loud
"In case you forgot, I was here way before the hardrock started his webbased forum.",Medium,condescending,informative and defensive,prideful,"forgot, way before"
they deal with them and then they think everyone in society is a bad person.,Medium,judgmental,informal and negative,accusatory,bad person
Assad must be afraid,Medium,assertive,direct,negative,afraid
honestly hope that unwise steps out from his keyboard and gets absolutely destroyed.,High,aggressive,informal and hostile,malicious,"unwise, steps out, gets absolutely destroyed"
He deserves every suffering he will be subjected to.,High,vindictive,hostile and accusatory,negative,"deserves, suffering, subjected"
America would go the same route but that is not acceptable here,Medium,assertive,opinionated and judgmental,disapproving,not acceptable
call me on my ignorance?,Medium,provocative,sarcastic,defensive,ignorance
"anyone can edit it , it is very simple .",Low,informal,informative and encouraging,positive,none
"i don t want to know his interests , try to understand his beliefs or see this little picture .",Medium,dismissive,informative,apathetic,none
"(Oops, I forgot to log in. -Brab)",Low,informal,casual,apologetic,none
Ibrahim has been kind of mean lately,Medium,critical,informative and subjective,negative,mean
I was quoting you.,Low,neutral,informative,neutral,none
I can call people whatever I like.,Medium,assertive,informal and dismissive,defiant,whatever
"I just watched this guy on TED, and he is really epic.",Low,casual,enthusiastic,positive,none
i don't care about where you are going,Medium,dismissive,casual,negative,don't care
this is some clockwork orange level thing,Medium,critical,slang and informal,negative,"clockwork orange, thing"
I could understand how many people would get scared seeing a title like this.,Low,empathetic,conversational,understanding,scared
I didn't think it was a cure for anything.,Low,neutral,informative,skeptical,none
These are public computers. Don't ban uss all because a few people are retarded.,High,angry,informal,aggressive,retarded
"you're right, Allmusic is the last disappointment.",Medium,informal,critical,negative,disappointment
"I am an Australian, but I don't say profanity words all the time.",Low,defensive,declarative,neutral,none
why not drop health insurance companies all together and get the government to stop hospitals from price gouging,Medium,critical,assertive and informal,frustration,price gouging
"Yeah , Americans with quadruple citizenship so they have where to go in case things gets serious anywhere else .",Medium,sarcastic,informal and critical,cynical,serious
"This child has autism, not behavioral issues",Low,assertive,direct and clarifying,protective,none
That's what you get for being an unpleasant person.,Medium,critical,informal,negative,unpleasant
Obama is not always right.,Low,neutral,direct and straightforward,objective,none
This school district is unsatisfactory i know cause i go there,Low,informal,opinionated and personal,negative,unsatisfactory
they are two faced.,Medium,accusatory,colloquial,negative,two faced
