Sentence,Toxicity Level,Tone,Language,Implied Sentiment
во дебил ты пан-баран))))))))))))))))))). еврейское тв пересмотрел даун???)))),High,Insulting and Derogatory,Vulgar and Offensive,Aggressive
завтра в хабаровске вдвшники будут разгонять быдло,High,Condescending,Derogatory,Contemptuous
"эта походу старое фото,в середине хряк телепузик мэр орши лисовский.редкая скотина.",Low,Neutral,Casual,Neutral
а что рядом других что мужиков рядом не оказалось??? кто этому ублюдку табло начистил!!?????1 вывод????? мужики к сожалению перевелись .............,High,Aggressive,Vulgar and Offensive,Contemptuous
"хули вы бляди клянчите классы ,просто помните.",High,Aggressive,Vulgar and Offensive,Contemptuous
веселись сегодня ептить удручённый ты наш:-d,High,Sarcastic,Vulgar and Disrespectful,Hostile
твари награждают себя. кто пойдет за них воевать. сам и путин.,Medium,Contemptuous,Sarcastic,Critical
"мразота,больше ни хуя делать не умеют,кроме как обижать слабых и беззащитных",High,Insulting,Vulgar and Aggressive,Malicious
таких тварей только могила исправит.,Medium,Dismissive,Harsh and derogatory,Contemptuous
"садисты. таких родителей необходимо найти и наказать, однозначно.",High,Harsh and Judgmental,Accusatory,Angry
"Пруфы засирания тредов , к примеру",Low,Neutral,Formal,Neutral
стоит ли уделять внимание каждому пидарасу,High,Dismissive,Insulting and Offensive,Contemptuous
мишустик ты бы пасть свою поганую закрыл,High,Derogatory,Insulting and Offensive,Hostile
вы что хотите что бы ваши дети в будущем в дерьме жили?,High,Accusatory,Confrontational,Hostile
этих уродов надо всех сократить.,High,Dehumanizing,Aggressive and Offensive,Hateful
"точно,сука урод, и это мягко сказано,уже в каждую спортивную передачу лезет,приходится искать каналы и репортажи без его рожи и участия !",High,Aggressive,Vulgar and Offensive,Negative
"Вы же за полный разрыв отношений с ахрессором, тогда нахуй вы хотите транзита?",High,Aggressive,Vulgar and Confrontational,Hostile
так хоть кто то по обочине бы ехал.а так все как дебилы встали...дальнобои порою ахуевают...,High,Disrespectful,Casual and offensive,Contemptuous
"курва галичанская , приехала в одессу со своим уставом !",High,Derogatory,Aggressive and Offensive,Negative
Там написано он попросил и убедился тупица ты значит они повернулись уже,Low,Neutral,Casual,Informative
дурдом ромашка..нету на сегоднейший день нормальных мужчин ....то гейтр пидораз то урод вот такой ..,High,Derogatory,Insulting and Discriminatory,Negative
"ебливая группа одна реклама, пидлры продажные..",High,Derogatory,Vulgar and Insulting,Hostile
"пиздуйте с проекта, на вас смотреть уже противно, из-за вас не хочется смотреть дом 2",High,Dismissive,Confrontational and Insulting,Hostile
и стабильные закоренелые долбоебы восхваляют все это,High,Dismissive,Casual and Insulting,Contemptuous
"это пипец! грех какой! гореть им в аду , вандалы!",High,Aggressive,Emotional and Harsh,Anger
ебануться можно!!! кокаин был не свежий!..,High,Aggressive,Vulgar and Offensive,Negative
"ублюдкам бабушкина квартира нужна, вот и хотят свести в могилу и остаться не причём падлы!!!",High,Aggressive,Insulting and Threatening,Angry
ты рф живешь и грязтю россию полеваеш.хуйло,High,Insulting,Aggressive and Vulgar,Derogatory
Нехуй засирать города ненужным старьём.,Medium,Dismissive,Confrontational,Critical
пиздуй нахуй за любую границу и там прояви себя.,High,Hostile,Vulgar and Aggressive,Aggressiveness
"не уважаю мужиков , которые обещают и не выполняют, одним словом пиздабол",Medium,Disappointed,Casual and Direct,Frustrated
если эта тухлодырая овечка своим обдолбаным небольшим от природы мозгом нихуя непомнит торчек обоссаный то это его неосвобождает от параши,High,Insulting and Demeaning,Vulgar and Offensive,Contemptuous
"жесть какая-то. дети без матери, отец долбоёб в тюрьме.",High,Disdainful,Vulgar and derogatory,Negative
Какого хуя он до сих пор не в бане?,High,Aggressive,Vulgar and Offensive,Angry
гниды пиндосовские считают себя хозяивами земли,High,Derogatory,Insulting and Nationalistic,Contemptuous
хорош хуеть !!!!я сейчас еще в службу поддержки нахурярю на вас защеканцы!!!!!!!!!!,High,Aggressive,Vulgar and Offensive,Angry
Самое тупое - это невозможность удалить все оставленные где-то комментарии,Low,Neutral,Informative,Frustration
"это щяс так он пиздит.до власти добираются,другие люди становятся.уроды",High,Derogatory,Aggressive,Contemptuous
"пиндосы не успокоятся, пока россию не развалят.",High,Aggressive,Derogatory and Offensive,Hostile
"по себе не суди, жопадающий",Medium,Dismissive,Informal,Disrespectful
и на этом закончить с тобой беседу .............видно чмо капитальное .......,High,Dismissive,Insulting,Contemptuous
да потому что козлы по телефону пиздят когда едут!!!!! своими глазами вижу каждую неделю мотаюсь по областям,Medium,Aggressive,Rude and Offensive,Angry
"посадить на наши пенсии, ущнает сука",High,Aggressive,Insulting and Offensive,Angry
какой идиот придумал неделю досрочных выборов ?,Medium,Questioning,Critical,Disapproval
да всем насраааааааааааааааааааать на это уебище,High,Dismissive,Vulgar and Offensive,Negative
"ах ты ссука, конченая ты тварь, получается это я бухал не появляюсь дома по две недели.",High,Aggressive,Insulting and Derogatory,Hostile
"весь мир видел,свидетелей тьма,а он блядь сервер дрючит,ну не надо из людей таких же дебилов делать каким сам является.",High,Aggressive,Vulgar and Offensive,Contemptuous
"Чтоб костями не колола, бл ать!",High,Aggressive,Vulgar and Offensive,Angry
да и пусть хуярит туда . придурок,High,Dismissive,Confrontational and Insulting,Hostile
нет вы не правы она у меня очень достойная девочка моя только всякую мразь почему то слушает:-(,Low,Defensive,Assertive,Frustration
урод такое впечатление что сейчас вся полиция похожа на этого дебила,High,Insulting,Derogatory and Offensive,Contemptuous
гетте самый известный педераст в группе.,Low,Neutral,Informative,Neutral
"писать научись правильно еблан, тогда и лайкать будет не стыдно.",High,Aggressive,Insulting and Offensive,Contemptuous
я бы сказал так: надо гнать всех депутатов-идиотов!,High,Aggressive,Confrontational and Insulting,Angry
надейся и верь тупой россиянский пидарас ! это все что тебе осталось!,High,Insulting,Aggressive and Derogatory,Malicious
"Они поддерживали свой народ, они же националисты, ты забыл, даун? Путина они не поддерживали.",High,Confrontational and Insulting,Aggressive,Disrespectful
кто придумал-это мутатень....того накол надо посадить!!!,High,Angry,Confrontational and Insulting,Aggressive
с которым через час расстанешься и будешь трахаться с другими?,High,Derogatory,Vulgar and Crude,Contemptuous
к своей башке представил бы пидор.,High,Insulting,Derogatory and Offensive,Negative
догавкаетесь до того что россия отвернётся и вас сожрут с потрахами.,High,Threatening,Aggressive and Hostile,Violent
и что это ? скажем так то что твориться в россии просто пидор!!!!!!!!!!!!!!!!!!!!!!!!!!!!!!!!!!!!!!!!!!!!!!!!!!!!!!!!!!!!,High,Aggressive,Vulgar and Offensive,Hateful
мне все рано что ты как называешь) соска унитазная,High,Insulting,Vulgar and Disrespectful,Derogatory
"дебилы, пэк. а не пек. фирсофу с филатовым позвоню, скажу, что такую херню пишите!",High,Insulting,Vulgar and Disrespectful,Aggressive
падла за рулём ну да мы же забыли папина дочя за рулём им же всё можно....,High,Disrespectful,Casual and Insulting,Contemptuous
"уже не знают как привлечь к себе внимание, ебё....в опу,нам это зачем рассказывать и показывать",High,Aggressive,Vulgar and Offensive,Negative
"речь идёт о поступке настоящих мужиков, про дебилов, речь не шла",Medium,Dismissive,Casual and Insulting,Negative
уровень 7139 редкий гад! всем тем кто до него дойдет желаю великой удачи-а тем кто его придумал-наоборот!,Medium,Negative,Sarcastic,Resentful
так этот акимат только себе в карман ложит бабки а для людей они нечего делать не будут хуилы ни дорог ни парка полная жопа гавноеды,High,Aggressive and Insulting,Vulgar and Offensive,Hostile and Disdainful
а что то не так.гнилой твой рот,High,Insulting,Aggressive,Hostile
"эй, принц хуев! читай историю, своей страны внимательно, а не под кайфом!",High,Insulting and Commanding,Aggressive and Disrespectful,Contemptuous
ефремов трусливое подлое мерзкое существо один негатив вызывает эта падлюга,High,Insulting,Derogatory,Negative
ты чего людям пиздишь животное,High,Aggressive,Insulting,Disrespectful
"такая группа о самарканде, и этих блядей рекламируете, вот зачем?????????",High,Angry,Insulting and Aggressive,Frustration and Disgust
сколько говна было на меня вылито,High,Angry,Vulgar,Resentful
"потому что выродок тебе сказать нечего, сидишь шестерка не знаешь кому угодить выебок путинский.",High,Insulting,Aggressive and Offensive,Hostile
"за ер? прошу вколоться:d много ли за пидарков проголосуют, хотя фанатов в любой секте хватает",High,Disrespectful,Aggressive and Offensive,Derogatory
"выучи сначала русский язык,или белорусский а потом вякай быдло",Medium,Imperative,Authoritative,Contemptuous
"чинуш, кто даёт разрешение на вырубку-вешать за яйца невзирая на ранг",Medium,Commanding,Harsh and Authoritative,Aggressive
это не современные девушки а ебанутые девушки. современные нормальные. не путайте хуй с гусиной шеей,Medium,Aggressive,Vulgar and Insulting,Contemptuous
"Что это за поток говна? Ответить на вопрос не в состоянии, свинья?",High,Aggressive,Insulting and Demeaning,Contemptuous
Просто такого дебилизма и показухи у нас даже к проверке Путина не было,Medium,Disdainful,Critical and Sarcastic,Negative
"дой бог, чтобы ты испытала тоже самое. вот от таких тварей и рождаются такие ублюдки.",High,Malicious,Derogatory and Offensive,Hateful
"псина ебучая, что скажут, то и пиздит в эфире на своём ебучем телеканале",High,Derogatory,Vulgar and Offensive,Contemptuous
че хватило? че добавить? жопой жирной что ли покрутила? :-d :-d,Low,Casual/Sarcastic,Informal/Slang,Teasing
а свое мнение и мысли при себе держи мудило ебаное.,High,Insulting and Contemptuous,Vulgar and Aggressive,Disrespectful
"дура, берет ором. других учит, та сама личную жизнь не устроила",High,Insulting,Condescending,Derogatory
"правильно, дальше эти ублюдки маньяками станут!!",High,Aggressive,Vulgar and Offensive,Hostile
и я буду рад этому!!! сучья путинская власть в деле,Medium,Aggressive,Emotional and Critical,Angry
очистите страну от всей этой швали,Medium,Commanding,Assertive,Negative
"Ловко наебал - значит молодец, понятия подлость и честь отсутствуют нацело",High,Defiant,Vulgar and Offensive,Negative
"glav.su, cont.ws Какие-то интересные сайты? Ты там сидишь? Пойду чекну, спасибо за подсказку, пидораш.",Medium,Casual,Informal,Sarcastic
из подтишька по мышачи умеют пидоры бить.,High,Insulting and derogatory,Vulgar and offensive,Malicious
"наше сми, одни, ублюдки, показывают то, что им выгодно, и кому очко лизнцть",High,Disdainful,Insulting,Contemptuous
"пидорас он конченый,позорит доброе имя олега ефремова,нет слов,пидорас он и есть пидорас.",High,Insulting,Derogatory,Contemptuous
"велком это вообще полная дрянь, а по внешнему виду даже и не подумаешь.",Medium,Critical,Informal,Negative
таких выродков как этот нужно сразу на кол садить чтобы другим не повадно было,High,Aggressive,Derogatory and Threatening,Negative
"ну, александр,представляющий в комментариях мужское мнение,насколько я поняла,был фраппирован и оп*здошен запросами мамзелей",Medium,Dismissive,Casual and Insulting,Negative
"Фррррр ПУК-ПУК По фактам есть что сказать, дикарь?",High,Confrontational,Insulting,Disrespectful
"твой рот ебал дело не в религии , кто вы если не запасные евреи и не кавказцы?",High,Aggressive,Insulting and Offensive,Hateful
"Кстати, тупая шутка про коран Кому как",Low,Casual,Casual and Informal,Neutral
"В настройках поставил дваче капчу, а уменя опять эта ебанная гугловская срань появляется",High,Frustrated,Vulgar and Insulting,Angry
кто вам тварям крысам дал право распоряжаться народным достоянием суки едино пидоры,High,Aggressive,Insulting and Disrespectful,Hostile
везде бабушки блядь а дедушки ведь она пиздует к внукам а дед ебашет на работе и всегда она хорошая а дед хуевый парадокс,High,Vulgar,Insulting and Demeaning,Negative
мрази бедный ребёнок я представляю какая у него ненависть к родителям.,Low,Sympathetic,Neutral,Compassion
", я тупой и не понял шутки или это спам?",Medium,Confused,Informal,Confusion
стоит ли так реагировать на очередного придурка?,Low,Questioning,Casual,Contemptuous
вот ето пидараст етово вообше надо въигнать из всех турниров,High,Derogatory,Aggressive and Offensive,Hateful
"видать, неслабо тебе забашляли ефремовские родственнички, или дружки, если ты так старательно рвёшь за него очко.",Medium,Sarcastic,Sarcastic and Mocking,Critical
молодец!!! обезьянам пиздюлей отвесила.а то что судят то это ебаная толерантность.,High,Aggressive,Insulting and Offensive,Derogatory
потому что в думе сидят дебилы и дебилов хотят выростить,High,Insulting,Derogatory,Contemptuous
пидор хотел полит убежище получить а менты не дали его помять -облом вышел ну ничего может в 2021 получится.,High,Derogatory,Offensive and Aggressive,Hostile
я смотрю эти олероновская шайка все забайкалье заибло,Low,Neutral,Informal,Observational
а щас бегают с этой демократией суки продажные.,High,Derogatory,Vulgar and Insulting,Hostile
"Надо было не арестовывать, а просто в дурку закрыть.",Medium,Authoritative,Stern,Critical
нахрена фейк распространять? этому ролику 100лет в обед! это дибилом надо быть!,High,Dismissive,Confrontational and Insulting,Hostile
"сволочи, как они живут после этого.",Medium,Disrespectful,Informal,Angry
"даже в голове не укладывается, что есть такие дебильные дуры.",Medium,Disbelief,Informal,Disrespectful
вот ты первый провокатор и провокационные вопросы задаешь пшол вон нахрен :-p,High,Aggressive,Confrontational,Hostile
"не брехай, убогий, 100 тыш пришло к белому ( не факт! жёлтому дому) в вашингтоне!",High,Aggressive,Insulting,Disdainful
"а нас наши умники из министерств по западным шаблонам учить надумали , уроды конченые",High,Disrespectful,Insulting and Condescending,Contemptuous
а современным тем более насрать на интересы нашей страны,High,Dismissive,Vulgar and Disrespectful,Contemptuous
вы что ебнутые на всю голову???,High,Aggressive,Insulting and Confrontational,Hostile
"ещё открывает свой поганый , рабочий рот",Medium,Derogatory,Insulting,Negative
ты чего так обзываешь участников этой группы может сам такой педераст,High,Accusatory,Insulting and Demeaning,Hostile
казнить на месте нечего войну раздувать с братских народом,Low,Neutral,Formal,Objective
их. действительно. убили. вопрос кто. это те. стремилы. которые увласти. пидарасты. все. которые. сидят в думе. проститутки,High,Accusatory,Derogatory and Insulting,Hateful
"путин, сука! ты президент!, какой страны?",High,Aggressive,Vulgar and Disrespectful,Angry
этот козел отменил пособия на детей матерям одиночкам,Medium,Negative,Sarcastic,Angry
"сколько вышло на улицы проплаченных долбоебов, лишь бы не работать!",High,Aggressive,Insulting and Confrontational,Mocking and Disrespectful
"зачем нервировать животяху? а когда она цапнет этого придурка, то разорется, что обезьяна виновата",High,Aggressive,Insulting and Blaming,Hostile
это долбоебизм ! так нельзя .,High,Aggressive,Insulting and Disrespectful,Negative
"Они смешные и милые унтерки, а Стас как гоблин из падика себя ведёт и тем отталкивает",Low,Playful,Casual,Teasing
"Схуя это в эсэсэре был коммунистический режим, дебилушка? В этом и юмор",Medium,Dismissive,Sarcastic and Insulting,Contemptuous
"даааа, время идёт, а идиотов, все больше и больше.....",High,Disparaging,Sarcastic,Contemptuous
ты что до всех довыёбываешься троль заокеанский,Low,Dismissive,Informal,Mocking
"убить суку, это не отец",High,Aggressive,Violent and Offensive,Hateful
"заебали вы уже, вам не угодиш, тролли бля.",High,Aggressive,Offensive and Vulgar,Angry
"вы будете пиздеть о том кто и как тут сдулся, лег, не встал, встал но не так...",High,Aggressive,Vulgar and Offensive,Contemptuous
"норма, с и что здесь смешного?!, бля, дибилы",High,Disrespectful,Vulgar and Insulting,Derogatory
это какой засранец такую хуйню придумывает?,High,Aggressive,Vulgar and Offensive,Angry
"козел!!!!!!! ему бы там пожить. продумано до мелочей,как угробить людей за 10 жизни.",High,Aggressive,Insulting and Threatening,Malicious
"пиздюки едут с выебоном, а люди погибают.",High,Aggressive,Vulgar and Offensive,Malicious
"Зашел на сайт с играми, выбрал с веселой картинкой, а там вместо игры эта поебетень.",High,Disgust and Dismissive,Vulgar and Insulting,Contemptuous
на корню надо душить эту заразу.,Medium,Aggressive,Forceful and Dehumanizing,Negative
"этим пидорасам я оказалась очень нужной!а я сказала, что теперь мне похуй!!",High,Aggressive,Vulgar and Offensive,Contemptuous
"прошу прощения, но вы просто дебил, если задаете такие вопросы.",High,Insulting,Confrontational,Derogatory
Все мои аргументы были заглушены поросячьим визгом,Low,Dismissive,Neutral,Frustration
одним словом уебище которое живут в говне и последний зер без соли доедают,High,Insulting and Aggressive,Vulgar and Offensive,Contemptuous
"Не, по феменистски это когда бабы-страшилы снимаются, так что не прокатит в данном случае)",Medium,Disrespectful,Informal and Derogatory,Critical
"чудо, с каких хуев, россия была процветающей в начале 20 го века...",High,Aggressive,Vulgar and derogatory,Negative
"Проблема не выбить дерьма из макак, а получить прибыль",Medium,"Dismissive, Offensive",Assertive,Negative
да ты просто пидарас конченный! о чём с тобой тварь общаться можно !,High,Insulting,Derogatory and Offensive,Aggressive
"и ты , ебанушка меня хочешь чему то учить ?",High,Insulting,Aggressive and Offensive,Contemptuous
"сидишь и тусуеш, урод!!!!! просто нет слов",Medium,Aggressive,Insulting and Dismissive,Negative
