Sentence,Toxicity Level,Tone,Language,Implied Sentiment
и в 3 подъезде бывает такое. поймать бы чухана!,Medium,Accusatory,Informal and Derogatory,Frustrated
таких пидорасок гнать в шею живут засчет пинсионеров,High,Aggressive,Offensive and Insulting,Contemptuous
"если водила из драчующейся компании, идиот, на уголовку наездил, покушение на убийство впаяют.",High,Accusatory,Insulting and Aggressive,Hostile
"придурок, тебя не заебало одно и то же скидывать и всех оскарблять?",High,Aggressive,Confrontational and Insulting,Hostile
ублюдки их самих нужно расстрелять в упор. нужно было просто уплыть куда плыли.,High,Aggressive,Violent and Insulting,Hostile
вас жидов что-то не устраивает?,High,Aggressive,Hateful and Derogatory,Hostile
"Ну блдь, импеллер жеж, импеллер.",Medium,Frustrated,Expletive,Irritated
"смотри что творит твои президент уебок, сегодня.",High,Derogatory,Insulting and Confrontational,Contemptuous
а чем лучше предатель власов -такая же -------- как и бандера - так чо пидарья везде хватает,High,Aggressive,Confrontational and Insulting,Hostile
"Бля, вот не будь у меня этого куска говна, может и поверил бы.",High,Frustrated,Offensive and Disparaging,Angry
"это он, а не она, провокатор кастрюлеголовый",Medium,Accusatory,Colloquial and Derogatory,Disparaging
"да это же пидор,нормальный водитель так себя не станет вести,это обычный курганский пидорас или просто петух.",High,Derogatory and Aggressive,Confrontational and Insulting,Hostile
"и чувствуется по школотному долбоебизму админов - и не увидим. ни ссылки, ни клипа. поколоение егэ-дебилов, мля.",High,Dismissive,Confrontational and Insulting,Hostile
"жмеринская шалава , не устала срать на форумах? откуда столько говна в тебе,простипутка?",High,Hostile,Aggressive and Derogatory,Contemptuous
а ведь сколько денег смогли бы отдать кубе африке ирак с ираном - а так пидарасы все растянули,High,Blaming,Offensive and Derogatory,Resentful
кто до сих пор позволяет этой блядине отзыватся о нас ?,High,Aggressive,Confrontational and Insulting,Hostile
"тебя из авиации поперли за твой паршивый язык, и правильно сделали! чмо ты а не мужик!",High,Aggressive,Insulting and Dismissive,Hostile
"пидоры дырявые, продали будущее семьи на поколения вперёд,...и теперь они ещё и рекламу делают.",High,Angry and Contemptuous,Offensive and Aggressive,Resentful
водитель красава на хер таких пидоров,High,Offensive,Vulgar and Homophobic,Disdainful
этому пидору захар дал паспорт днр,High,Hostile,Offensive and Derogatory,Disdainful
я сам ржу как сука с них.,Medium,Mocking,Derisive and Vulgar,Derogatory
"отвянь, пидорас прилипчивый. пристань к своей жене, и жди.",High,Aggressive,Insulting and Dismissive,Hostile
сколько же ебанутых в россии в месте с тобой,High,Dismissive and Insulting,Confrontational and Vulgar,Hostile
правда? шавка ты неудовлетворенная. вот и пиздишь от зависти.,High,Aggressive,Offensive and Derogatory,Hostile
конечно двое на подхвате можно и в течении беседы нанести удар лох ебаный и друшки такие же не спортивное поведение,High,Aggressive,Hostile and Insulting,Malicious
уничтожают народ твари! народу не дают работать,High,Accusatory,Aggressive and Insulting,Hostile
мужики выйдут мусорам хуево будет,High,Threatening,Aggressive and Vulgar,Hostile
Кто это ваще? Че за бичара?,Medium,Dismissive,Colloquial and Derogatory,Disparaging
"кулибин хренов, на хонор это не прокатывает",Medium,Mocking,Derogatory,Disdainful
и вот так мы живём среди долбоебов,High,Dismissive,Confrontational and Insulting,Hostile
"и правильно, пусть пиздует в родные пенаты!",High,Dismissive,Confrontational and Insulting,Hostile
ты на зп посмотри че ты пишишь далбоеб,High,Aggressive,Confrontational and Insulting,Hostile
", если некоторое время деньги не вносищь_ хуярят",High,Aggressive,Profane and Confrontational,Threatening
"так получается,что батька за одно с киевом придумали эту хрень!?блядь,так ещё никто необделывался,как лукошенко....как жить будет с этим позором,идиот?!",High,Aggressive,Confrontational and Insulting,Hostile
а сам блядь в канаду с ебался упырь,High,Aggressive,Offensive and Derogatory,Hostile
дочь в нее пошла-такая же ебанутая,High,Derogatory,Derogatory and Insulting,Hostile
"В Бангладеше тоже население растёт, дебил.",Medium,Offensive,Insulting,Disdain
"блядь, аж зла не хватает! песна написана предположительно 1920-21",Medium,Frustrated,Vulgar and Aggressive,Angry
пизда малолетняя себе нихуя для пропитания не сможет добыть,High,Derogatory,Insulting and Vulgar,Contemptuous
вот редкая тварь один раз избрали а теперь хер выгониш,High,Hostile,Insulting and Confrontational,Contemptuous
неужели не понятно что задавая дибильные вопросы эти идиоты зарабатывают деньги а не пошли бы вы на хер дибилы тупорылые,High,Aggressive,Confrontational and Insulting,Contemptuous
вот такие долбоёбы и управляют страной,High,Critical,Insulting,Disdainful
"на том свете уже не отмажет никто, тварььь",High,Threatening,Aggressive and Insulting,Hostile
"не хуй тут выеживаться, ещё и хватает наглости выставлять на лайки....",High,Aggressive,Confrontational and Insulting,Hostile
"Ща я все поясню погодь, до дома доберусь, вискаря въебу и расскажу тебе что почём",Medium,Casual,Colloquial and Vulgar,Nonchalant
всем надоела эта проститутка длинноногая стерва,High,Contemptuous,Derogatory and Offensive,Disparaging
Была же информацию что пиндосы собирают генетические материалы россиян..,Medium,Disparaging,Derogatory and Accusatory,Suspicious
"он ебать вообще от жыру охуел!, какой миллион? у народа и так денег нет нихера",High,Indignant and Aggressive,Confrontational and Vulgar,Angry
"панты карявые, очередной способ угнать лавэ, откройте глаза и заблокируйте останкинских пиздаболов.",High,Confrontational,Aggressive and Insulting,Hostile
Почему у папича такой даунский чат? Традиция.,Medium,Accusatory,Disparaging and Dismissive,Critical
встал народ от мало до внлика значит не так хорошо как об этом говорят сми те ещё пиздабо,High,Critical and Dismissive,Insulting and Crude,Negative
"слушай, админ, ты блять реально еблан или прикидываешься? тебе тут кондитерская или чё блять?",High,Aggressive,Confrontational and Insulting,Hostile
"долбоеба кусок, слов нет одни эмоции.",High,Angry,Insulting and Emotional,Contemptuous
спам!!! информацию этот еблан распространяет ложную,High,Aggressive,Confrontational and Insulting,Hostile
"его скоро повесит собственный народ,дай бог людям нормального президента после этой мрази!!!",High,Aggressive,Hateful and Threatening,Hostile
Чем меньше на эту парашу обращать внимания - тем лучше,Medium,Dismissive,Colloquial and Vulgar,Derogatory
"так вам сукам и надо надеюсь и последние кадры уедут в другие города, где нет такого ебанутого руководства.",High,Malicious,Offensive and Insulting,Hostile
"Разве ты не понимаешь этого, придурок? Вот лол.",Medium,Sarcastic,Confrontational and Insulting,Disdainful
осатанели суки.правильно мужик сказал режиму скоро придёт пиз......ц.,High,Aggressive,Confrontational and Insulting,Hostile
"Во-вторых, кукарекающее анонимно на других людей быдло че то попездывает за доносы, уморительно",High,Mocking and Derisive,Sarcastic and Insulting,Contemptuous
"а дополнительно депутатом.а сейчас мы должны обеспечивать не только этих дармоедов, но их семьи и их блядей.",High,Contemptuous,Derogatory and Offensive,Resentful
впереди шла тоже девочка ребенок они вместе вошли в подъезд а заними уже этот ублюдок зашел,High,Aggressive,Confrontational and Insulting,Hostile
такую пиздеж в комментах почитал!,Medium,Dismissive,Informal and Vulgar,Frustrated
на кой черт этот упырь нужен??? хуета бесполезная!!!,High,Aggressive,Derogatory and Insulting,Contemptuous
что она пиздоболка муж ию говорит денег нет у них а она маску заказывает дорогую несколько тыс,High,Accusatory,Aggressive and Insulting,Contemptuous
"больным детям собираем всем миром на лечение, а жирные хари откармливаются бесплатно за счёт всей страны, когда уже твари нажрутся",High,Angry and Accusatory,Confrontational and Derogatory,Hostile
"Еще и Живчик возить перестали, суки, с эхинацеей, и Бiле, мое любимое.",High,Frustrated,Insulting,Angry
Идиоты проникают во все сферы жизни 5 дней снимает ролики с зумом на фурункул,High,Derogatory,Insulting and Critical,Contemptuous
И хуй ты что им докажешь - у них все деньги мира и все СМИ.,High,Defeatist,Vulgar and Confrontational,Resentful
"правильно, ты же пиздабол, ни чего не смог толком пояснит за свои измышления, кто бы сомневался... покури сходи!",High,Sarcastic,Confrontational and Insulting,Disrespectful
чурка адвокат трактует его по своему.лишить лицензии идиота навсегда.,High,Derogatory,Offensive and Insulting,Hostile
"Да там русачков достаточно живёт и они временами совершают преступления, но чёт не слышно про митинги и погромы русни",High,Derogatory,Confrontational and Demeaning,Disdainful
"Ты дебил? Как тогда те самолеты, которые разбились, поднялись в воздух?",Medium,Sarcastic,Disrespectful and Derogatory,Contemptuous
отпиздошить росгвардейцев у вас теперь появится возможность только через год,High,Aggressive,Violent and Confrontational,Hostile
"этого пидора в Химках видал недавно на гик-конвенте видал, жирный что твой кабан",High,Derogatory,Offensive and Insulting,Hostile
вотак и жевем а вы за ету блятскую партию голоса отдали.,High,Angry,Vulgar and Disparaging,Contemptuous
пидор гнойный лука сколько блядь изворачиваться будешь никто уже не верит твоей пиздежи гомон тебе мразь,High,Aggressive,Vulgar and Insulting,Hostile
потом от пиздюлей и правда хромой станет,High,Aggressive,Vulgar and Threatening,Malicious
Почему ты такой тупой ? я ж объяснил на что конкретно мне похуй и не раз,High,Aggressive,Offensive and Demeaning,Derogatory
"дай бог, если очередному дебилу это будет уроком-не срать соседу.",High,Aggressive,Confrontational and Insulting,Hostile
"эта дура,уже сказала,,с нитке,по миру......,,!господи,когда эти уроды,уедут на острова,подальше...",High,Contemptuous,Confrontational and Insulting,Hostile
а кто тебя ущербного будет спрашивать на каком языке нам разговаривать ебанашка,High,Confrontational and Insulting,Aggressive and Derogatory,Hostile
этот старый маразматик уже внес свою лепту в развал страны в свое время,High,Contemptuous,Disrespectful and Insulting,Blaming and Hostile
как вы заебали показывать одно и тоже,Medium,Annoyed,Informal and Vulgar,Frustrated
нехуй выебываца дура тупая .пусть благодарит бога что ноги низажувала тупая ска,High,Aggressive,Highly Insulting and Demeaning,Hostile
а с ним все возятся!!! если бы не было видео он давно бы опять вел себя аналогичным образом!!! мразь!!!,High,Angry,Aggressive and Insulting,Hostile
Какое отношение твой лахтодырский сайт имеет к этой теме? Иди нахуй.,High,Aggressive,Offensive and Insulting,Derogatory
так что господа оккупанты нихуя у вас не выйдет!!!!!,High,Aggressive,Confrontational and Insulting,Defiant
потому что жизнь долбоёбов ничему не учит,High,Dismissive,Insulting,Hostile
да оно и по россии эти упыри свободно гуляют...,Medium,Contemptuous,Derogatory,Disdainful
папу поймать и кострировать!! и пусть ростит детей!!!,High,Aggressive,Violent and Degrading,Hostile
"добрый, но хуй это сразу поймешь",Medium,Frustrated,Informal and Vulgar,Annoyed
"дура ебнутая, ты о чем клава?",High,Aggressive,Insulting and Derogatory,Contemptuous
молодец таких уродов надо наказывать если закон бессилин,High,Aggressive,Confrontational and Insulting,Vindictive
и где они хоть 8 нема вообще скоты обнаглели,High,Derogatory,Insulting and Disrespectful,Contemptuous
ты чего это далбонутого долбонутым обзываеш.,High,Aggressive,Confrontational and Insulting,Hostile
"ты то блядь, ещё та)) иностранная))) японская- шлюха ты тупая)) тебе долбоёбу- вопрос задали: что плохого написано о мусульманах?",High,Aggressive and Contemptuous,Vulgar and Insulting,Hostile
"соболезнования родителям! а эту мразоту,выследить и прибить,как собаку",High,Aggressive,Violent and Dehumanizing,Hostile
"по-ходу всю администрацию города выебали разом, что дороги стали строить.",High,Aggressive,Vulgar and Disrespectful,Hostile
заебали вы уже своими котами честно говоря.*-),Medium,Frustrated,Informal and Vulgar,Annoyed
собрать народную дружину и ловить пиздить свиней слухи быстро пойдут,High,Aggressive,Offensive and Incendiary,Hostile
"ебанутые, подумайте лучше об этих людях и о стране, которую они превратили в собственную кормушку",High,Aggressive,Confrontational and Insulting,Hostile
Какое мерзкое у нее выражение лица.,Medium,Critical,Derogatory,Disapproving
"во твари, им похую все эти митинги, главное что бы жопа бизнес классом летала на мягком и уютном.",High,Dismissive and Contemptuous,Derogatory and Insulting,Disdain
короткова к стати.она нас учила 3 года блядь такая.,Medium,Disrespectful,Offensive,Negative
"нехуй врать, блядь, сидишь тут ублюдок, провоцируешь.",High,Aggressive and Dismissive,Confrontational and Insulting,Hostile
Австралийские твари доберутся до всех материков!,Medium,Alarmist,Provocative,Threatening
"дура ты уёбищная,я ещё работаю и внукам помогаю,спасибо пидору путину,добавил ещё 2,5 года",High,Aggressive,Confrontational and Insulting,Hostile
"долбаебы! сочи не склоняется! не в сочах , а в сочи!",High,Accusatory,Confrontational and Insulting,Hostile
люди уже перестали ругаться так нет ты говно вылезла из унитаза,High,Aggressive,Offensive and Insulting,Contemptuous
"не может быть, а все, пиздец, никуда не уйти",High,Defeatist,Vulgar and Pessimistic,Hopeless
"Его пидорнули и он ушел на ютаб, кадавр кстати на стриме вроде как разбирал его ролик, но я не смотрел",High,Dismissive,Offensive and Informal,Disparaging
руки ноги оторвать гадам за такое.,High,Aggressive,Violent and Threatening,Hostile
а щас эти пидары забрали то каторе строили нашы деды.и снашают этим нас,High,Angry,Offensive and Insulting,Resentful
"Значит, ты тут подскочил, как петух на жердочке, вскукарекнул, когда попросили пруф - слился и даже не извинился",High,Mocking,Insulting,Derisive
"О, пришла весна, начались обострения у шизы.",Medium,Derisive,Disparaging and Insensitive,Mocking
"пиздец ,мягко сказано,конца не виднои россии нет,всю почти продали,твари........",High,Despairing,Profane and Accusatory,Disgusted
"что ,дурак???х..ли ,мне суешь ,какого то китайского философа,иди мебель двигай по феншую!",High,Aggressive,Confrontational and Insulting,Disrespectful
дело даже не в iq - просто хуесосам там не место,High,Dismissive,Confrontational and Insulting,Exclusive
пусть эти пидорасы тогда сами въёбывают!,High,Aggressive,Offensive and Insulting,Angry
"а что нам остаётся делать, нам пассивным пидорасам? принимать всё как есть",High,Defensive,Derogatory and Self-deprecating,Resigned
"немедленно извинись перед МНЕНИЕМ, шваль! Да, я в курсе, что Титан мысли его довничем считает",High,Aggressive,Confrontational and Insulting,Hostile
"это,что,живой собаке глаза прищепкой,ради прикола?а себе пробовали?это самое больное место ,веки.вот уроды.ужас!",High,Outraged,Confrontational and Insulting,Hostile
что ты можешь людям предложить кроме свой жопы и не помытова рта:-d :-d :-d,High,Insulting and Demeaning,Confrontational,Disrespectful
а работать не хочешь да? хочешь за свои фотки деньги получать? хуй на нос тебе,High,Mocking,Confrontational and Insulting,Derogatory
"всё заебись,леса валом,черти 95% нелегально добытого и всем по..",Medium,Dismissive,Colloquial and Vulgar,Indifferent
"ребята я уже на французском---это пиздец! одного человека нет,другой просто включил дурика....ну читать уже противно.",Medium,Frustrated,Informal and Coarse,Irritated
этим странам долбоебам необходимо признать а то деньги не получат от российских налогоплательщиков,High,Disrespectful,Offensive and Derogatory,Hostile
ну прям пиздец какой та:d,Medium,Frustrated,Vulgar,Negative
"завидно,ну зделайте так а потом пиздите,слабо,олени колхозные",High,Sarcastic and Accusatory,Insulting and Derogatory,Hostile
"​хуйло! вернись,будь настоящим русским патриотом! попробуй забрать всё,что слева от днепра+одессу! тебе кто-то мешает?! пиздабол заокеанский!",High,Aggressive,Confrontational and Insulting,Hostile
и т д....нечего им там тварям делать прежде всего!,High,Derogatory,Insulting,Hostile
да блин отчаянный пидарас а мог бы и душу богу отдать на суд,High,Aggressive,Confrontational and Derogatory,Hostile
"сука! беззащитное животное избить, которое не может себя защитить",High,Aggressive,Abusive and Degrading,Hostile
"я тебе не приятель, туша боксёрская",Medium,Dismissive,Insulting,Contemptuous
"Схуяли ты решил что это мне подарили, и мне надо завидовать?",Medium,Accusatory,Confrontational,Resentful
"любого из нас если достать, то ебанем похлеще этого пса",High,Aggressive,Confrontational and Vulgar,Threatening
"ты чудо если ты думаешь что я от фото шопа,стану хуже то ты точно лох",Medium,Sarcastic and Derogatory,Confrontational and Insulting,Disdainful
"а иногда бывают просто,промандоблядские гены блядской пробабушки !",High,Aggressive,Offensive and Derogatory,Contemptuous
"сам ты уебок! за него народ поднялся, а тебя люди даже и не знаю! фургал- порядочный человек!",High,Aggressive,Confrontational and Insulting,Hostile
"б***** я, сука , горжусь своей страной и презиком!!!:d",Medium,Aggressive,Profane and Emotional,Proud
"ублюдки, ну рано или поздно всё закончиться, и мы придём за каждым бесом",High,Threatening,Aggressive and Insulting,Hostile
"а это урод , безбашеный ..",Medium,Disparaging,Derogatory,Contemptuous
"твари родители, что детей не научили, все вернётся...",High,Accusatory,Insulting and Threatening,Hostile
"нормальные люди от юмора смеются, а ты тут разводишь неукротимую диарею! Может, тебе не здесь?",High,Sarcastic and Insulting,Confrontational and Demeaning,Hostile
как же я люблю свою родину!!! ибать её конём!!!,High,Sarcastic,Offensive and Vulgar,Disparaging
"как земля таких уродов носит,чтоб руки у него отсохли",High,Aggressive,Hostile and Insulting,Malicious
что тварь..........испугался а свою вонючую шкуру? на нары тебя мразь!,High,Aggressive,Confrontational and Insulting,Hostile
