Sentence,Negative Connotations
"सुअर पने आए बाज़ आ जा, कही निबटा न दी जाय।",सुअर
"अबे दलाल भड़वा, जो जबरन बुलवा के मार रहा है उसपर बोल बे गाँडू ।","अबे, दलाल, भड़वा, मार, गाँडू"
वाह भेनचोद वाह ...एक आदमी को नीचे गिराने के लिए कितने लोग लगे हुए हैं ...,भेनचोद
तेरे जैसे चूतिये नेताओ को चौराहे पर जूते मारने चाहिए ।,"चूतिये, जूते मारने"
क्यों करते हैं ऐसी नीच हरकत।,नीच
फिर लग जाते हो किसी की भी भड़वा गिरी करने,भड़वा
साली चुतीया औरत नाम लेने से डरती है रंडी कही की ||,"साली, चुतीया, रंडी"
"ढोंगी से भी एक कदम आगे , गट्टर की पैदाइश","ढोंगी, गट्टर"
इस बेटीचोद का बेटा मरा नहीं अभी तक,"बेटीचोद, मरा"
अबे हरामी जिन्ना की औलाद तू अपने किसी मोहल्ले में हिंदुस्तान बाले से पूछ लें मोदी ने क्या किया,"अबे, हरामी, औलाद"
दिल्ली के अंदर तोड़फोड़ भोसड़ी वाले ने करी ।,भोसड़ी
चोदी गांड के आज बहुत मार रहे हैं,"चोदी, गांड"
तेरी बहन को चोदु मादरचोद भोसड़ी वालों उसका नाम बिच में क्यु लाते हो.! ,"तेरी बहन, चोदु, मादरचोद, भोसड़ी"
कुछ दिन से चर्चित मुद्दे  ये है दलाल मीडिया के मुद्दे,दलाल
लगता सारे बुद्धजीवी पप्पू मूत्र पी के सो गए,मूत्र
इस मादरचोद को किसी मानसिक रोगी के डॉक्टर को दिखाओ,मादरचोद
शाकिब तेरी बेगम की कसम आउट हो मादऱचौद,मादऱचौद
हरामी पत्रकारिता कर दलाली नहीं,हरामी
ये हैं महासभा की राष्ट्रीय महासचिव जो राष्ट्रपिता पर गोली चला रहीं हैं!,गोली
पन्नी फुक्का है क्या तब से कुछ भी बोला जा रहा है भोसड़ी के,भोसड़ी
टीवी पे देखते ही सूखी टट्टी याद आ जाती है,टट्टी
क्योंकि ऐसा बोलने वाले सड़क छाप सच्चे नहीं होते...,सड़क छाप
ये भेनचोद दो शब्द सही से नहीं लिख सकता और पत्रकार बना घूम रहा है.,भेनचोद
सबूत के लिए इनकी गाँड से गु खीरोंच देगा फावड़े से,"गाँड, गु, खीरोंच"
अबे तो चूतिये पुलिस तो कथित राष्ट्रवादियों की है न ??,"अबे, चूतिये"
अबे दर हरामी केजरी सरकार के हाथ मैं नही होता अरेस्ट करना,"अबे, हरामी"
बाद में फिर तू पूछेगी यह क्या कर दिया?? रंडी,रंडी
यह है मादरचोद कॉंग्रेस की राजनीति इन मादर चोदो कांग्रेसियों ने इतना गंद फैलाया है,"मादरचोद, मादर चोदो, गंद"
"छोड़ो प्यार -वयार को,पैसे कमाओ लोग चूतिया समझते है भोसडीके तुमको !!","चूतिया, भोसडीके"
ये भोसड़ी वाले अपनी माँ बहनो के नही होते || तो दुशरो के कैसे होंगे |,भोसड़ी
कुछ तो करलेना भोसडीके,भोसडीके
भड़वे तुम से तो ये जानवर भी समझदार है,भड़वे
इस कमीने की करतूत देखिए |,कमीने
"मैंने तुझे ट्वीट करके बुलाया नही, अपने मर्जी से मरवाने आ गया!",मरवाने
रंडी रोना शुरू कर दे धोनी आज धागा खोल देगा ।,रंडी
केजरीवाल चोर तबरेज़ अंसारी के परिवार को पैसा और नौकरी दे रहा हैं।,चोर
भोसडीके ये अफवाह नही सत्य है। सारे का हिस्सा खा रहे हो तुम लोग,भोसडीके
सुवर अब तो बदल जाओ भोसडीका,"सुवर, भोसडीका"
यहां ट्वीटर पे बकैती करने से अच्छा है उन हिजड़ो को पकड़ो और उनकी गांड में गोली मारो।।,"बकैती, हिजड़ो, गांड, गोली मारो"
इस सूअर को कोई भी ग़लत काम नजर नहीं आता।,"सुअर, ग़लत"
यही  साले हरामखोर डॉक्टर पहले चुप थे !,"साले, हरामखोर"
"कुत्ते दो प्रकार के होते है-: एक पाला हुआ, और दूसरा ख़रीदा हुआ कमलनाथ पाला हुआ है और सिद्धु खरीदा हुआ ।","कुत्ते, ख़रीदा हुआ"
औकात समझ आ गई बे ? बाप बाप होता है ।,"औकात, बे"
क्यों जनता को भटका रहा है.. कमीने,कमीने
अगर ये सच है तो ये भड़वा गद्दार जेल के अंदर क्यों नही ?,"भड़वा, गद्दार"
कन्हैया कुमार को इतने वोट तो मिलने ही चाहिए थे जितने शेहला_राशिद के बैग से कनडोम मिले थे.,कनडोम
"मादरचोद, मां के लोड़े, लड़ पाते नहीं हो","मादरचोद, मां के लोड़े"
"आ गया भडवा नीच आदमी, राजनीति करने।","भडवा, नीच"
ये पिछवाड़ा चाटने वाला केजरीवाल झारखंड को पैसे देता है भड़वा,"पिछवाड़ा चाटने वाला, भड़वा"
भाजपा जॉइन कर के रजिस्टर्ड भड़वा कब बन रहे हो..???,भड़वा
"इन जैसे चमार, सुअर का प्रमोशन करके मै इन्हें फेसबुक से ट्विटर पर ले आई हूं।","चमार, सुअर"
अब्दुल रज्जाक खान को जी न्यूज वाले क्यो बुलाते है ऐ मादरचोद,मादरचोद
किसी बहन के लौड़े की अवाज नही निकली,लौड़े
कीचड़ उकालने वाला नीच किस मुंह से श्रद्धांजलि दे रहा है?,"कीचड़, नीच"
अब पेपर दे भोसड़ी के,भोसड़ी
कहां से लाते है आखिर ये इतना दोगलापन?,दोगलापन
भोसडिका अत्याचार केवल लाचार औरतों के लिए है?,"भोसडिका, लाचार"
पालतू कुत्ता। कितना मुहँ से शौच करोगे,शौच
तब भोसडिके चाह कर भी कुछ नहि बोल पाएगा तो आज वक़्त है बोल ले,भोसडिके
"इस्लाम में जो-जो हराम है, अगर उसकी सूची बनाकर मुसलमानों पर टेस्ट किया जाए, तो अधिकतर मुस्लिम हरामी ही मिलेंगे।",हरामी
शख्सियत काम से बनती है झूठ और फरेब से नही बनती गन्दी सोच वाले,गन्दी सोच वाले
वो चोर झूठा बेमान दुष्ट नीच कमीना हत्यारा नफ़रत व हिंसा फ़ैलाने वाली बीमारी है,"चोर, झूठा, बेमान, दुष्ट, नीच, कमीना, हत्यारा, नफ़रत, हिंसा, बीमारी"
"ज्यादा गांड ना फुलाओ,  गांड फाड़ देंगे ।","गांड, फाड़"
ये दिखा रही कि देखो हमारी गाँड आसानी से मर सकती है पर जैसे ही तुम मारने को आओगे हम गाँड उचका देंगे,गांड
हम इंसानो के पूर्वज तो बंदर थे बाकी इस कुत्ते को इसके पता होंगे,कुत्ते
मुंह से पिसाब कर रही है ||,पिसाब
तेरे जैसे रंडी ही गुलामी करते थे उनकी,"रंडी, गुलामी"
इसकी तो बॉलिंग के समय गांड फाड़ेंगे,गांड फाड़ेंगे
कहां था बे भोसडीके! तुझे पोलीस ढुंढ रही है।,भोसडीके
भोंसड़ी लगता है के तुम पैदा भी नौटंकी से ही हुए थे |,"भोंसड़ी, नौटंकी"
कोलकाता में डॉक्टर की पिटाई हुई तो मादरचोद मुम्बई में डॉक्टर हड़ताल पर गए !,मादरचोद
हर चैनल पर रंडी रोना मचा रखा था।,रंडी
अबे भोसडीवाले जिसकी रंडी की तुम लोग दलाली खाते हो उससे कभी पूछो की पैसा कहाँ से उसके पास आया है।,"भोसडीवाले, रंडी, दलाली"
उनकी गांड में गोली मारो।।,"गांड, गोली मारो"
"बच्चा अपने दोस्त से - सीघ नहीं होती लोमड़ी के, और बताओ कैसे हो खोपड़ी के?","सीघ, लोमड़ी, खोपड़ी"
भड़वा निकाल दे अपने दिमाग से हरा सौच।,भड़वा
असिफा पर चिलाने वालो अब कहा गये भोसडीके?,भोसडीके
दोगले यहाँ भी भरे पड़े हैं ।,दोगले
तुम अब विनाश काले विपरीत बुद्धि हो,"विनाश, विपरीत"
ओर कोई नहीं सिर्फ़ तुझ जैसे कुत्ते पूछ रहे हैं भैनचोद,कुत्ते भैनचोद
ये भड़वा सरकार आखिर क्या करना चाहती है ।।।।,भड़वा
ये हरामी अपनी हरकतों से बाज नही आ रहे है,हरामी
सैनिक शहीद हुआ तो वह बच्चा नहीं था भेनचोद !,भेनचोद
हरामखोर हरामी को भगाओ अपने डिवेट से।।,"हरामखोर, हरामी"
जिसको मेरे शब्द खराब लगे उसकी मा का भोसड़ा,भोसड़ा
"भेनचोद, हम क्या माँ चुदाने इतनी मेहनत करके टेक्स भरते है..","भेनचोद, माँ चुदाने"
साले रंडी की औलाद चुप हो जा,साले रंडी औलाद
ये साले रंडी रोना रोते रहते हैं।। आज और आने वाले समय की बात करो ।,"साले, रंडी"
अरे पागल लिष्ट क्या भेजेगा तुमसे साल भर में मेरा कुछ न हो सका,पागल लिष्ट
यह काला सूअर भी तो 10 जनपद का टॉयलेट साफ करने वाला है,"काला, सूअर"
इनके पेसो से ही चुनाव लड़ता हें चूतिया,चूतिया
भेनचोद पता नही तेरे जैसे लोग कैसे पत्रकार बन जाते है,भेनचोद
केजरीवाल हरामी सुअर भड़वा है | ऐसा मेरे मोहल्ले वाले लोग कह रहे थे ||,"हरामी, सुअर, भड़वा"
इसे तो इसकी करतूत के लिए सरेआम बीच सड़क पर डाल कर जूतों से पीटते हुए बाल मूंड व मुँह काला करना चाहिए,"पीटते, मुँह काला"
कुछ नेता तो इतने कमीने टाइप के होते हैं,कमीने
अरे पागल जूठा रोज लाईट बंद रखता हें भड्वा,"पागल, भड्वा"
मीडिया तो है मादरचोद लेकिन प्रशासन क्या कर रही थी?,मादरचोद
देश अल्पविकसित देश की श्रेणी में आ गया । भुखमरी में <number> स्थान है । चोर आतंकवादी संसद में बैठे हैं कुछ नहीं कर रहे हैं।,"चोर, आतंकवादी"
भोसडीके अभिनंदन को बीच में लाने को किसने बोला ? मा चोदेंगे फिर तो,भोसडीके मा चोदेंगे
चादरमोद को क्यो बुलाते हो डिबेट में ?,चादरमोद
"भाजपा के नीच लोग इस सोच को बन्द करें, विकास की ओर ध्यान दें..",नीच
भाग हलाला के पैदाइश हरामी,हरामी
ये तो पुरी दुनिया को पता है कि वह हरामी कया कर रहा है?,हरामी
"मादरचोद जात के कुत्ते, भिखारी देश के भिखारी भड़वे मादरचोद","मादरचोद, कुत्ते, भिखारी, भड़वे"
ऊपर विडीओ देखा तुमने भोसडीके यहां अंधभक्त वाली कौन सी बात आ गयी,"भोसडीके, अंधभक्त"
आज वो कहा मर गये मादरचोद जो उस चुरवे के लिये मा चुदा रहे थे ?,"मादरचोद, चुरवे, मा चुदा"
तेरी कौन सी कमाई है कौन तेरा खर्चा चलाता है क्या तु घर से भड़वा गीरी करता है ??,भड़वा गीरी
बहिन थोड़ी दलाली कम करके सरकार से सवाल पूछ लिया करो।,दलाली
हर जगह कटुवों की चाटुकारिता ? आक्थू कुत्तों ।,"कटुवों, आक्थू, कुत्तों"
कसम से मैं अपने खर्चे पर उन रंगों के कपड़े भिजवाऊंगा।,
तुम्हारे लुंड में अब दम खत्म हो गया।,लुंड
भड़वा और दलाल मिडिया चुड़िया तोड़ तोड़कर विधवा विलाप कर रहा होता !,"भड़वा, दलाल, चुड़िया तोड़, विधवा विलाप"
इस दल्ले ढोंगी-पाखंडी को कोख में रखने वाली माँ भी अपने को कोसती होगी।,"दल्ले, ढोंगी, पाखंडी"
इन भडवो को समझाना पड़ेगा ।,भडवो
न्यूजीलैंड के साथ मैच में इंग्लैंड की जीत की दुआ करे ताकि भड़वा पाकिस्तान सेमीफाइनल में न पहुँच सके,भड़वा
कुत्ते को सब जगह कुत्ता ही नज़र आता है। पीदी,पीदी
भारत देश के इन भोंसड़ी के लिए अब सिर्फ जेल में ही जगह है।,भोंसड़ी
कुछ कमीने नीच ग्रह में पैदा होते है और वो पैदा होते ही सारी कायनात को दुःख देते ही रहते है |,"कमीने, नीच, दुःख"
सच सुनते ही कुत्ते की तरह दुम दबाकर भाग गया..,"कुत्ते, दुम दबाकर"
जिंदगी के उस मोड़ पर. जहा कोई नहीं मिलता. वहां पर गुड़ मिलते है भोसडीके,भोसडीके
"चुतिया, बस किसान और जवान ही सब करते है इस देश में ?",चुतिया
लौंडा.....BJP नेता कैलाश विजयवर्गीय का हैं !,लौंडा
"अरे मादरचोद,  जसा ट्वीट तसा रिप्लाय",मादरचोद
भोंसड़ी के धर्म है तो धंधा है!  मेरा मतलब  धर्म है तो सत्ता है!!  सत्ता ही धंधा बना दिया है!!!,भोंसड़ी
"अब कोई रंडी रोना नही कर रहा , नही कोई मोमबत्ती डाल रहा है गाड में।","रंडी, गाड"
शूरूआत करोगे तो अब बराबर जवाब मिलेगा तब रंडी रोना रोते रहना,रंडी
"मैं गिरिराज_सिंह कन्हैया_कुमार से पूछना चाहता हूं, आजादी में कोई कमी तो नहीं रही भोसडी के",भोसडी के
वो कौन मादरचोद थे जो कह रहे थे कि वह डरा हुआ है?,मादरचोद
अपने बाप की बात पर तो भरोसा कर बे हरामी,हरामी
उन्हें नीच कह के मत बुलाना। गंदी बात होती है।,"नीच, गंदी"
अरे अपनी मां बहनों और बीवी को धंधा कराना है शौक से कराओ हमें कोई प्रॉब्लम नहीं है,धंधा
भोसडीके सुधार जाओ नहीं तो जलजला आएगा ठीक है,भोसडीके
नीम का पता कड़वा है थर्ड अंपायर भड़वा है |,भड़वा
क्या इस नौटंकी में तू रंडी हुआ करती थी ???,"नौटंकी, रंडी"
मादरचोद हो क्या?  अंग्रेजो की तरफ से खेल रही थी टीम हमारी?,मादरचोद
एक नंबर का भड़वा आदमी है!,भड़वा
अब जिसके पिछवाड़े में ऐसी आग लगी हो तो वो चिलायेगा तो हैं ही,पिछवाड़े
5 के आज ही के दिन इंदिरा गांधी ने भारत के लोकतंत्र का इमरजेंसी के जरिये हलाला किया था,हलाला
ये सुअर नही समझेंगे। ये सुअर नही मानेंगे।,सुअर
भौसडीके शायरी ग़लत हो गयी,भौसडीके
कम से कम टीम की तो इज्जत करता भोसडीके,भोसडीके
अरे भड़वा तुझे इमाम बोलने में शर्म आता है दलाल,"भड़वा, दलाल"
"किसे जलाने की बात कर्ता हे?जो लोकतंत्र पसंद करते हे उसे?जिसे तिरंगे से प्यार हे उसे?सरम कर, दल्ले",दल्ले
भेनचोद घर नहीं हो तो किसी अखाड़े पर चले जाओ |,भेनचोद
आज भी कांग्रेसियों मे टंच माल के सेवन की परम्परा है. टंचमाल,टंच माल
भोसड़ीके जब भी बोलता है तो आंख बन्द कर उसकी याद आ जाती है।,भोसड़ीके
ये मादरचोद इकठ्ठा हो सकते है तो हमारे लोग कहा थे?,मादरचोद
"इसी की पार्टी का भड़वा आज़म खान क्या बोला था, ये भूल गया शायद।",भड़वा
भोसड़ीवाले पहले उन मादरचोद तत्वों का धर्म तो पता कर लेता चुतिये..!,"भोसड़ीवाले, मादरचोद, चुतिये"
ये जवान है जिनका तुने मज़ाक बनाया है। तुज़ेहे भी एक दिन कुत्ता ना बना दिया तो बताना,कुत्ता
जितनी नफरत करनी है उतनी कर लो रंडवो बाजारू रंडी कि औलादो।।,"नफरत, रंडवो, बाजारू, रंडी, औलादो"
भड़वे लौंडे रंडी रोना रो रहे होते |,"भड़वे, रंडी"
"सुवऱ कभी टट्टी खाना नही छोड सकता, ","सुवऱ, टट्टी"
ओर ये साली सुअर सरकार सो रही है,"साली, सुअर"
