Sentence,Negative Connotations
जेहादी सूअर आस मोहम्मद को गिरफ्तार किया गया,जेहादी सूअर
मैच फिनिश कर देना चाहिए    गांड पे हाथ रख कर बैठ नहीं जाना चाहिए,गांड
देख भड़वा कलूटे इसपे तेरा मूत वाला मुह नही खुलेगा,"भड़वा, कलूटे, मूत वाला मुह"
दरअसल गलती हम लोगों की है हम लोगों को भी चाहिए कि तोड़ फोड़ का जवाब तोड़ फोड़ से दे और मौत का बदला मौत ही दे,"तोड़ फोड़, मौत"
ममता_बनर्जी ने तड़ीपार_गैंडे शाह को औकात पे ला दिया,तड़ीपार_गैंडे
देखिए आज की रिपोर्ट अमीश भड़वा से,भड़वा
यही एक आखरी रास्ता हो सकता है बाकी सूअर की औलाद किसी की नहीं होगी |,सूअर की औलाद
चुप मादरचोद मेरी बाइक तुमने तोड़ी,मादरचोद
अबे कुत्तों के पिल्लो जब बिहार में बच्चे मर रहे थे तो तुम सूआर बन कर गू खा रहे थे?,"अबे, कुत्तों, पिल्लो, सूआर, गू"
मोदी सूअर का पीला भी तो चुप है,"सूअर, पीला"
अगर नुकसान नही है तो फिर तुम भड़वों की तरह रंडी रोना क्यों रो रहे हो?,"भड़वों, रंडी"
मादरचोद दिल्ली सरकार की स्कूल की चर्चा करते हुए उस मुद्दे पर टिक नही पाया,मादरचोद
मादरचोद उधर नेटवर्क का प्रॉब्लम है तो गांड मराने सिम कार्ड इश्यू करते हो उस एरिया में?,"मादरचोद, गांड मराने"
साले की शक्ल ही सूअर जैसी लग रही है। जैसा काम वैसी शक्ल।,"साले, सूअर"
समस्या तुम जैसे मादरचोद ढोंगी पुजारी है।,"मादरचोद, ढोंगी"
रंडि के पैदाइस कुछ नहि बोलेगे ?,रंडि
इस मधरजात को इतना मारो की दुबारा खुद की बहन को भी देखने मे इसके पसीने छुटे हरामी साला।,"मधरजात, मारो, हरामी साला"
इन सालों की गांड पर लात मार के बाहर कर देना चाहिए मादरचोद रास्ता जाम किये बैठा है,"सालों, गांड, मादरचोद"
चला है लोडा एक्सपर्ट बनने...,लोडा
"भड्वा, तल्वे चातु, कुत्ते से भी बडा कुत्ता देखना हो तो तुजे देख लेना चाहिये","भड्वा, कुत्ते, कुत्ता"
"कभी तो अपने कॉम की गंदगी को साफ करो, हलाला, तहर्रूष, मुताह",गंदगी
इस सुअर के बच्चे ने बहुत ही आपत्ती जनक भाषा का इस्तमाल किया है।,"सुअर, आपत्ती जनक"
सुवर कहि के इनकी भी बहन बेटियो के साथ नहीं होंना चाहिए यह सब,"सुवर, बहन बेटियो"
तुम लोग सालों नंगे कर के मारे जाओगे सुवर की औलाद,"सालों, नंगे, मारे जाओगे, सुवर की औलाद"
"अगर ये भडवा गिरी है तो जो जसोदाबेन के साथ हो रहा है वो दलाली, भडवा गिरी और अन्याय तीनों है जो आपके यहां हो रहा है","भडवा, दलाली, अन्याय"
भोसडी बालो तुम ही अपनी बहनो को भेजते हो चुदबाने इन लिव-इन रिलेशनशिप के नाम पर,"भोसडी, चुदबाने"
सूअर के पिछवाड़े मे और बाथरुम मे अपनी बेटी को ढूंढ रहा है,"सूअर, पिछवाड़े"
काहे के प्रोफेशनल बे भड़वा गिरी और दलाली के ?,"भड़वा, दलाली"
और ये रोहित ने घुसेड़ा पहला छक्का गांड में..,"गांड, घुसेड़ा"
एड्रेस पर भोसड़ी के भेज रहा हू,भोसड़ी के
भोंसड़ी के तेरे पिछवाड़े में कांग्रेस का पंजा पड़ेगा तो समझ में आएगा,"भोंसड़ी, पिछवाड़े"
कुछ लोग तो अपने बायो मे फाउंडर तो ऎसे लिखेंगे कि जैसे कोई बड़ी सी कंपनी खोल रखी है. हट भेनचोद.,भेनचोद
ये हराम का पिल्ला हरामखोर हरामी है जिस का खाता है उसी में ये हरामखोर छेद करता है।।,"हराम का पिल्ला, हरामखोर, हरामी, छेद"
तू जेएनयू में झांठ नहीं उखाड़ता भोसडीके,भोसडीके
ये हराम की खाने वाले पुलिस वाले जो गुनहगार उसको तो पकड़ नही पाती,हराम
"अभिनेत्री ने अभिनय हराम बता फिल्में छोड़ीं। तो क्या सायरा, शबाना, सलमान, शाहरुख, अमीर, आदि हरामी हैं ?","हराम, हरामी"
मूर्खो! ये घर में बैठकर कमेंट में किसी को गाली देना कौन सी बहादुरी है?,"मूर्खो, गाली"
भड़वे के पास कुत्ता जैसा नाक है हरामखोर पत्रकार,"भड़वे, कुत्ता जैसा नाक, हरामखोर"
अब तो भेनचोद बेइज्जती को भी शर्म आ रही हो गई |,"भेनचोद, बेइज्जती"
"ऐसे नीच, घटिया, दुष्ट, असुर, राक्षस, मनोवृति के व्यक्ति की जगह केवल पागलखाना","नीच, घटिया, दुष्ट, असुर, राक्षस"
कमीना कातिल को चौराहे पर खड़ा करके गोली मार देनी चाहिये |,कमीना
इस हरामजदओ का हरामीपन के अलावा किसी बात से मतलब नहीं ,"हरामजदओ, हरामीपन"
"थू है ऐसे लोगो पर, और समाज पर |",थू
भड़वा मीडिया ने भी इस घटना को नही दिखाया। ,भड़वा
सूअर लोग अपना अस्तित्व बचाने में लगे हैं।।,सूअर
भोसडीके सिर्फ तीन ही परिवार वर्षों तक शासन करते रहे।,भोसडीके
"एक जैसा न समझ सबको, ओर तू गांड लेके बीच मे न आ",गांड
तो अच्छा होगा कि तुम अपनी हद मे रहो. बेटीचोद,बेटीचोद
"भइया आपकी दलाली वाली पत्रकारिता ने जिस विचारधारा को बढ़ावा दिया है, उसी का असर है।",दलाली
"भैया ब्लॉक कर दिया मैंने तो इस नीच को,",नीच
दोनों एक नंबर के हरामि हो,हरामि
"कायदे से आज थाला को बैटिंग का मौका नही मिलना चाहिए वरना थाला गाँड कूट देगा, इंडिया की",गांड
ज़रा सुनिए कुछ लोगों का स्तर कितना गिरा हुआ है। हरामी नीच,हरामी नीच
हरामी भाग गया मैदान छोड़ कर,हरामी
आपने सिर्फ सत्ता की लालच में नफरत और हिंसा को पनपाया है। अब ड्रामेबाजी क्यों पलटु कुमार?,"नफरत, हिंसा, ड्रामेबाजी, पलटु"
ठोक ठोक के इतना गन्दी औलाद पैदा किया है,गन्दी
खुद का खून जला जला कर ये एनामिक होने को पूरी तरह से ततपर दिखते है,खून जला जला
उनमें एक ये टोटिचोर शामिल है !!!,टोटिचोर
सरदाना जी थोड़ा कम जहर उगला करो।,जहर उगला
तेरी मर्यादा को तेरी गांड में घुसेड़ दूंगा समझा बे!!  कुछ भी उटपटांग लिखते रहते हो ???,"गांड, घुसेड़"
मरने दो इन हरामी लड़कियों को,"मरने, हरामी"
"नमक हरामी की हद पार हुई, सुधर जाओ सुवरों","नमक हरामी, सुवरों"
ये ममता भेन के लवडी तेरे गांड मे दम है तो बंगाल के बाहर एक छोटासा भी नमुना दीखादे,"लवडी, गांड"
हमारे टुकड़ों पर पलने वाले सूअर नमक हराम भडवे,"सूअर, नमक हराम, भडवे"
तुम सब कुत्ते हो जो समय समय पर भौकते रहते हो,"कुत्ते, भौकते"
भेनचोद की औलाद एक बाप की औलाद है तो सामने से आकर हमला कर,भेनचोद
जिगर चाहिए जो तुम जैसी फ़टु सुअर की औलादो के पास नही है,"फ़टु, सुअर की औलादो"
पहले गोरो को हराया फिर हरमखोरों बांग्लादेश को हराया,हरमखोरों
"तू नही सुधरेगा तू कमीना का कमीना ही रहेगा , चूतिया।","कमीना, चूतिया"
तेरे गांड के गलिचे ना बना दिये तो बोलना,"गांड, गलिचे"
भड्वा जांच करले कितना लाभ लिया तू,भड्वा
और भेनचोद बड़ी बड़ी बकचोदी कर रहा है ||,"भेनचोद, बकचोदी"
बिना बारूद की मिसाइल साले भड़वे,"साले, भड़वे"
तेरे मुह में अब बवासीर हो गया होगा |,बवासीर
"इसके पिछवाडे मे खूटा ठोकना पडेगा, इसको अच्छी वाते समझ में नहीं आती है ।",पिछवाडे
इतना दोगला पन कहा से लाते हो लुच्चो ?,"दोगला, लुच्चो"
पकिस्तान वाले ट्विस्टर पे मैच फिक्स वाला रन्डी रोना कर रहे हैं,रन्डी
"राजनीति में एक आतंकी नेता आ गई हैं, कभी शहीद का अपमान कर रही तो क़भी राष्ट्रपिता की हत्यारे का सर्मथन","आतंकी, अपमान, हत्यारे"
"मुझे नीच पर सफाई देने की जरूरत नहीं, बदलेगी सरकार",नीच
ये हरामखोरो को पता नही है ?,हरामखोरो
कश्मीर को मिलाया भारत में आज ही अमिश भड़वा की तरफ से खुशखबरी !?,भड़वा
कन्हैया कुमार का सूपड़ा साफ होने से दिल खुश हो गया।।  साले कुत्ते सूअर की औलाद !!,"साले, कुत्ते, सूअर की औलाद"
कल इंडिया हारी नहीं थी तेरे बाप पाकिस्तान को बाहर करने के लिए जान बूझकर हारी थी,तेरे बाप
आ गए भोसडीके दल्ले भकचोदी लेकर।,"भोसडीके, दल्ले, भकचोदी"
तुम्हारे जेसे दल्ले का तो कहना ही क्या,दल्ले
साला दल्ला वोट के कुछ भी कर सकता है |,"साला, दल्ला"
गैस सिलेंडर महंगा हुआ होता तो अभी तक रंडी रोना रोते |,रंडी
गौरव साहब नारंगी वाले क्या दूसरे देश के हैं जो उस रंडी ने ऐसा लिखा है,रंडी
धोनी से ज्यादा तो हार्दिक गांड़ फाड़ देता है..    अगला मैच हार्दिक खेलेगा,गांड़ फाड़
"भाई साहब ये कोई ताजुब की बात नही है यहाँ पर बहुत सारे कमीने, मकार, नमकहराम, दलाल, फरेबी, देशद्रोही है","कमीने, मकार, नमकहराम, दलाल, फरेबी, देशद्रोही"
में उस समय सुन नही पाया था। हाँ हा हा हां ह क्योंकि उस समय मे बकचोदी में व्यस्त था,बकचोदी
"अरे हरामी, कम से कम <number> ने हमला किया!",हरामी
अब इसपे कोई न्यूज चैनल और दलाल एंकर आपत्ति भी नही जताएंगे ?,दलाल
"जलेबी तो गईं, पर कुत्ते की जात पहचानी गई",कुत्ते
तुम भोसडीके इधर हो मैंने कहा कहा नही ढूंडा,भोसडीके
"भोसड़ी के कटुवे मादरचोद, जो सच है वही तो सुदर्शन न्यूज दिखाता है।","भोसड़ी, कटुवे, मादरचोद"
50 के स्कोर का सत्यानाश कर दिया साले ने,"सत्यानाश, साले"
बड़ी बेगैरत बेगम है तुम्हारी रोटी भी ठीक से नही बना पा रही,बेगैरत
साला मैंने एक ट्वीट क्या किया सभी हेटर्स की गान्ड में मिर्च लग गई,"साला, गान्ड"
अब बोल रहा है इक सील भी नहीं हुआ चुप भड़वे भेनचोद,"भड़वे, भेनचोद"
"मादरजात सनी, तेरे पास टाइम नही है?",मादरजात
ये देखकर मुझे तेरी मेहरबानिया फिल्म के सुंदर गांड की याद आ गई |,गांड
किया होता तो तू ही रंडी जोर जोर से हंगामा मचाती,रंडी
तब कोई रंडी की औकात नहीं जो कमेंट करे।,रंडी
अरे दलाल मिडीया वालो जरा विपक्षी चोर उचक्के को तो देश हितमे सवाल पुछकर देखो क्या जबाब आताहै भेनचोद,"दलाल, चोर, उचक्के, भेनचोद"
इन कांग्रेसी चूतियों को मेंशन कर कोनसा तीर मार रहा है,चूतियों
वो भी तेरी तरह कमीने ही है तुझसे हाथ नहि मिलाएँगे,कमीने
तुम जैसे दलाल तो चिल्ला रहे है अब दुसरो को बोलने की क्या जरुरत ?,दलाल
ये स्टाम्प में पीछे ज़रा सा पिल्ला अपनी खूब माँ चुदवा रहा है आज,"पिल्ला, चुदवा रहा"
ऐसे भड़वा लोगो से मु से बात नहीं होनी चाहिए इनसे हाथ और पैरो से बात होनी चाहिए,भड़वा
"अरे भेनचोद, भोसडीका है तुझे क्या समझ कर वोट दिया और तु क्या निकला।",भेनचोद भोसडीका
वाह दोगले हरामी पत्रकार सही न्यूज़ नहीं चलाई ?,"दोगले, हरामी"
"अरे भोसडीके, कुछ ट्विट करणे से पहले व्हेरिफाय करणा सिखले.",भोसडीके
"चमक तेरी आंखों में कबूतर से कम नहीं, बाप तेरा भरवा और तू किसी रंडी की भड़वे से कम नहीं..","भरवा, रंडी, भड़वे"
घर से बाहर आकर उन सांपो को सबक नही सिखा सकते?,सांपो
भेनचोद...  समझ नही आ रहा केस किस खुशी में चल रहा है.,भेनचोद
पिछवाड़े में दम होता तो भागता नहीं हरामखोर,हरामखोर
सालो को जेल में डाल तो क्या रे बिकाऊ दलाल पत्रकार,"सालो, बिकाऊ, दलाल"
दम हैं गाँड मैं यह काम करने की?,गांड
"अच्छा,,और कौन कौन है मादरचोद नीच??? अब जरा शब्दों को सुधारने की जरूरत है शायद,,","मादरचोद, नीच"
ओए कानिये इतने जल्दी में ट्वीट क्यों कर देते हो? ,ओए
साला बल्ला तो बिल्कुल चलता ही नहीं है इसका मादरचोद,"साला, मादरचोद"
"आज कल तो रेप आम बात हो गई ऐसा लगता है, साले हरामी पर कड़ी लगाम लगाना जरूरी है ।","रेप, साले, हरामी"
ये सूअरिआ यहां हिन्दुओं को बदनाम कर रही है पत्रकारिता के नाम पर कलंक है ये,"सूअरिआ, बदनाम, कलंक"
मादर चोदो समाचार दिखाना जैसे हुआ वैसे,मादर चोदो
भोसडिके इंटरनेशनल रिपोर्ट की खबर तुरन्त आ जाती है,भोसडिके
ये हैं सुअर के पिल्ले हरामी कालापानी भेजिये हराम की औलादो को..,"सुअर, पिल्ले, हरामी, हराम की औलादो"
कल रिटायर होगा तो सब यही लोग थैंक यू धोनी वाले ट्वीट पर रंडी रोना करेंगे,रंडी
ये बचपन नहीं जवानी है सड़े लूँड,सड़े लूँड
एक बार अपनी पे आ गए ना भेनचोद तो अच्छा नहीं होगा,भेनचोद
देख भोसडीके अपुण सेलिब्रिटी है अभी,भोसडीके
हरामी भोसड़ीके बिजली चोर हो तुम,हरामी भोसड़ीके
भोसड़ीके अगर अभी कुछ नहीं किया तो वोट मांगने मत आना।,भोसड़ीके
बस हिन्दु मुसलमान कराओ और अपनी रोटी सेको। तेरे जैसा नीच आदमी इस संसार मे कही नही मिलेगा।,नीच
इस बारे मे ना तो हरामी मीडिया ने मुंह खोला और ना ही सरकार द्वारा कोई ठोस कदम उठाया गया !,हरामी
पत्रकारों को ज़बरदस्ती मूत पिलाने की ज़रूरत ही नहीं |,मूत
इस हरामखोर कुत्ते भेनचोद के साथ क्या सुलूक किया जाना चाहिए?? इसको फाड़ कर सुअरों को खिला देना चाहिए??,"हरामखोर, कुत्ते, भेनचोद, फाड़, सुअरों"
मादरजात राजनेताओं और भड़वा पत्रकारों के मुंह से उफ्फ तक नहीं निकलता,"मादरजात, भड़वा"
आज हमारे देश ने इतना अच्छा काम किया है तुम उस पर सवाल उठा रहे हो? चूतिया कम दिमाग वाले |,चूतिया
वाह सूअर के नाजायज़ पिल्ले इतना जल्दी पलट गए| वाह क्या भाई चारे अमन शांति का पाठ पढ़ा रहा है |,"सूअर, नाजायज़, पिल्ले"
रंडी सॉरी फिर तुम कहोगे गलत भाषा बोली,रंडी
चुप कर भोसडीके समाजसेवी पर गलत  कमेंट करता है,भोसडीके
