Sentence,Negative Connotations
पाकिस्तानी पूर्व जनरल और कुत्ते राष्ट्रपति मिया परवेज मुशर्रफ को उसके करतूतो की पूरी सजा मिलनी चाहिए |,कुत्ते
तू अपने मुंह से हग रहा है।,हग
तो फिर क्यो रंडी रोना कर रहा है ??,रंडी
जो नीच चाचा नेहरू पर निबंध लिख लिख कर बड़े हुए वो कहते है कि नेहरू ने क्या किया ?,नीच
ये सुअर के हड्डियीं की सुप पी कर बड़ी हुई है ।,सुअर
सबसे ज्यादा कमीना तू है,कमीना
भेनचोद की जली बर्नोल लगाव,भेनचोद
"शेर शेर ही रहता है, चाहे जंगल में रहे या जेल में मादरचोद! गीदड़ गीदड़ ही रहता है! समझे भड़वा ?","मादरचोद, भड़वा"
न्यायपालिका और जांच एजेंसियों में भी तो कुत्ते ही भरे पड़े हैं...,कुत्ते
हरियाणा में ये जब जब आता है इसके मुंह में लंड घुसेड़ा जाता है |,लंड
वो सारे हरामी... और गिरफ्तारी सिर्फ दो....,हरामी
तुम्हारी खें खें से पता चल रहा है कि तुम्हे अभी भी मोदीजी नीच लग रहे हैं।,नीच
क्या कमीनो क्या हम पाकिस्तानी है जो इतनी नफरत करते हो,कमीनो
एक कुत्ते से एक कुत्ते जैसी हरकतों कि ही आपेक्षा कि जा सकती है,कुत्ते
CM से लेकर विधायक तक सब चिलम-गांजा फुक के आराम कर रहे है।,चिलम-गांजा फुक
"एसे नीच और घटिया लोगो को चौराहे पर सबके सामने फांसी टाँग दो,, ओर पुरे देश मे लाइव दिखाओ ।","नीच, घटिया, फांसी"
कोई एक शहीद का नाम बता जो सूअर था अजादी की लडाई मे,सूअर
पूरे <number> मिनट पका दिया फोन पे भेनचोद ........,भेनचोद
"एंकरों को दलाल, भड़वा, औकात बताकर बॉल बना के ठोंकाई कर रहे हैं","दलाल, भड़वा, औकात, ठोंकाई"
इस हरामी की वजह से सेना के जवान क्यों शहीद हो,हरामी
नही देखना दोगली मीडिया का डिबेट जो दलाली के तले दब के मर चुकी है |,"दोगली, दलाली"
अब भी कुत्तों का झुंड बनाकर भोंक रहे हैं।,"कुत्तों, भोंक"
मणिशंकर इय्यरने बिल्कुल सही कहा था ये बहुत ही घटिया नीच इंसान है।,"घटिया, नीच"
ईस रंडी ने रात भर नाचकर बोला कि मैं थक गई ..,रंडी
वैसे भी फिल्म फ्लॉप होने से तुझे जबरदस्त सदमा लगा है चूतिये।,चूतिये
कुछ हरामी देश को बर्बाद कर रही है,हरामी
"शायद जो तुम्‍हारे माँ - बाप ने तुम को संस्कार सिखाए होगे, उनको तू गहण नहीं करपाए जुमलानंबर <number>","तू , गहण , करपाए"
"मर्द आखिर मर्द है, कुछ ना कुछ खड़ा कर ही लेता है।",खड़ा कर
गान्ड में मिर्च लगनी ही चाहिए,"गान्ड, मिर्च"
हरामी वैसे इस्लाम मे हलाल क्या है?,हरामी
दलाली कर जा के रंडी भाजपा की ||,रंडी
"जो <number> बच्चो की मृत्यु हुई है उनकी किस्मत ठीक नही थी, ये सब किस्मत का खेल है, सरकार जिम्मेदार नही?","मृत्यु, ठीक नही, खेल, जिम्मेदार नही"
सोच-सोच का फ़र्क़ है भोसडीके।,भोसडीके
इसे तो जमीन में आधा गाढ़ कर कुत्तों से नौंचवाना चाहिए,"गाढ़, कुत्तों, नौंचवाना"
निगाहे आज भी ढुंढ रही है... उस महान कमीने को,कमीने
"साले सब नपुंसक ह, ये सरकारें नेता सब साले नक़ली ह","साले, नपुंसक, नक़ली"
मैंने आज तक इस प्लॅटफार्म पर गाली नहीं दी लेकिन आज तुझे गाली दूंगा मादरचोद,"गाली, मादरचोद"
अबे भुतनी के एक हफ्ता  अपने घर में भी रख के बता,"अबे, भुतनी के"
कांग्रेस को बदनाम करने वाले दल्ले पत्रकारों का कुछ नही हुआ?,दल्ले
और कितना करीब आएगा अब ? मेरा लुंड लेले अब मुंह में भोसडीके रण्डी की औलाद,"लुंड, भोसडीके, रण्डी, औलाद"
** भेनचोद अब हम कब बोलेंगे **,भेनचोद
"भोसडीके यही बोल रहे थे ,ऐसे ही रहने का",भोसडीके
चीनाल की पैदाइश चोदना कम चिल्लाता ज्यादा है.,"चीनाल, चोदना"
अबे दलाल जरा तमीज से बोल दल्ले,"अबे, दलाल, दल्ले"
वही समाज तुझे अपने लुंड पर रखता है,लुंड
तो जेल भेजो ना। यहाँ क्या रंडी रोना रो रहे हो?,रंडी
अब ये दलदल का रूप इख्तियार न करले हरामी मुर्दाबाद,"हरामी, मुर्दाबाद"
अभी तक तो तुम जैसे हरामियों की टीम ने ऐसा ही किया है।,हरामियों
तुम जैसे भाड़े के ट्टुओं के मुँह लगने की आदत नही.,भाड़े के ट्टुओं
फिर साले कुत्तपना कैसे कर पाएंगे?,"साले, कुत्तपना"
हरामी || ख़ून अपना असर दिखाता ही है |,हरामी
अब दूसरे पर इल्ज़ाम लगा रहे हो.  मां का भोसड़ा ,भोसड़ा
वो लोग IT अफसर से भी चंदा मागेंगे भेनचोद,भेनचोद
चुप कर बे मादरचोद आ गया ना अपनी औकात पर,मादरचोद
कुछ भी बकवास पेलते रहते हो  भोसड़ीके,भोसड़ीके
वैसे न्यूजीलैंड में जब हुवा तू कहा गांजा पी कर लुंड पड़ा था?,"गांजा, लुंड"
"सुशांत, चौधरी, सरदाना, देवगन, लियाकत को देखते ही दिल से भड़वा - भड़वा की आवाज़ आने लगती है..",भड़वा
लोगो को लूटने का बहाना चाहिए तुम चूतियों को,चूतियों
"भौसरी वाली, कभी अपनी दादी से पूछाने कि हिम्मत क्यों नहीं की तुमने ?",भौसरी
"तुझे तो भक्तों का ही गू खाना है, तो सपरिवार आमंत्रित है",गू
निशाचर राक्षस शैतान के चंगुल से आजाद हो कर बात कर,राक्षस शैतान चंगुल
कोई रंडी लगती है । इस महिला की भाषा किसी वेश्या और आवारा रंडियों जैसी है ।,"रंडी, वेश्या, आवारा"
फिर कयो अपनी ऐसी तैसी करवा रहा है फालतू दो पैसे की औकात नही है भडवा,"तैसी, फालतू, भडवा"
तुम्हारी आवाज़ नहीं निकलती सुअर कि पैदावार,सुअर
"रंडी के बच्चे, बिना बाप के, जाके देख रिकॉर्ड  में कैसे मैया चोदता  था तुम्हारी ये |","रंडी, बच्चे, बिना बाप के, चोदता"
अरे ओ महबूबा रंडी की रानी तेरे को तो दर्द इसलिए हो रहा है ना कि तेरा यार पाकिस्तान वर्ल्ड कप से बाहर हो गया,रंडी
"दोस्त ख़रीदे नहीं जाते, ये तो वो कमीने होते है, जो आपको कभी शरीफ नहीं देखना चाहते !!",कमीने
ये कुत्ते के पिल्ले जिनकी चड्डी पैंट हमेशा विदेश में उतारी जाती है।,"कुत्ते के पिल्ले, चड्डी उतारी जाती"
आज़म ने कहा सांसद भवन पहुँचते ही लगा किसी नौटंकी में आ गए  ऐसा क्यों लगा आज़म मिंयाँ ???,नौटंकी
भोसड़ी के इसके आगे इनको कुछ नहीं आता ।,भोसड़ी के
तुम जैसे चादरमोद महीनों रंडी रोना मचाते !,रंडी
रंडी तू ही है ऐसी मेहनत करती ही नहीं है,रंडी
मादरचोद पत्रकार बोलने में शरमा रहा है...उपद्रवी तत्व बता रहा है कुत्ता,"मादरचोद, उपद्रवी तत्व, कुत्ता"
ये कब से बड़ी हस्ती हो गया भेनचोद ?,भेनचोद
अपना नाम रंडी रख ले ज़्यादा अच्छा लगेगा.,रंडी
किसी माई के लाल में हिम्मत नही की कोई हमारे बच्चों को छेड़ दे,None
भड़वों ने गुजरात ट्रांसफर के बहाने दो इंच की जगह के लिए इसकी नोकरी छीन ली,भड़वों
इतना गांड मे गुड्डा है तो तू जा के खेल ले लोड़े ,"गांड, लोड़े"
सभी भाई बढ चढ़ कर हिस्सा ले मादरचोद,मादरचोद
लेकिन यह भी साफ है रंडी कि धोनी कोहली से बेहतर है,रंडी
ये सब गद्दार है मदरचोद है मादरचोद नाजायज़,"गद्दार, मदरचोद, मादरचोद, नाजायज़"
साले भड़वे कटुओ के दलाल  उसका कौम बताने में तेरी गांड क्यो फट रही है ?,"साले, भड़वे, कटुओ, दलाल, गांड, फट रही"
"क्या मीना, मधुबाला सायरा, शबाना, सलमान, शाहरुख आदि हरामी हैं ?",हरामी
धमकी किसे दे रहा है बे. सूअर की औलाद.,सूअर की औलाद
इतना गांड मारूँगा की मादरचोद हरामी सुवर के ओलात अगला बार कुछ लिखने से पहले हज़ार बार सोचेगा,"गांड, मादरचोद, हरामी, सुवर, ओलात"
"तुमको तो हर जगह जाना चाहिए, हर जगह ए.सी. लग जाएगी. मक्कारी मत करो",मक्कारी
इतना पीतल पेलेंगे की भोसड़ी का भंगार में बिकेगा,भोसड़ी
कॉमेंट्री वाले भोसड़ीके आँकड़े बता बता कर जिताने की कोसिस करते हुए,भोसड़ीके
"साले विपक्षी, हरामी की औलादों, तलवा चाटने वाले कुत्तों ।","साले, हरामी, औलादों, तलवा चाटने वाले, कुत्तों"
इन भोसडी वालों को कोई बताओ कितने अकाउंट हैं,भोसडी
सोशल नेटवर्क पर जियो का फ्री नेट इस्तेमाल करने वाले अंधभक्त अक्सर नताओ को गाली गलौज करते हैं,"अंधभक्त, गाली गलौज"
कुछ नेताओं का मुँह ही नही पिछवाड़ा भी सूज रहा!,पिछवाड़ा
"कमीने, दुश्मन से गले मिल गये?",कमीने
बेशर्म इतना है कि गलियां मिलती है फिर भी भड़वा बना बैठा है.,"बेशर्म, गलियां, भड़वा"
ये लाइफ ओके चेंनल वाले सावधान इंडिया का नाम बदलकर चूत का चक्कर मौत से टक्कर क्यों नहीं रख लेते भेनचोद |,"चूत, भेनचोद"
सालों तुम लोग पागल हो गए हो तुम्हारे अंदर दिमाग नहीं है,सालों पागल
"जिसको गरिया गरिया के सत्ता पाये, आज उसी के गांड का गू खाने को इतना बेचैन।","गांड, गू, गरिया"
धोनी के लास्ट बाल पे सिक्स मारते ही भोसडीके पागलों की तरह चिल्ला रहे थे || देखो सालों भेनचोद को,"भोसडीके, भेनचोद"
सब दलाल प्रवक्ता ट्वीट और डिबेट चालू कर देते है।,दलाल
इस सूअर के आंड ने तब राज्यसभा में कुछ नही बोला,"सूअर, आंड"
बदनाम कर रहा है ये हरामी,हरामी
भोसडीके ये सोच जो एक जानवर से भी प्यार करता है वो इंसानो के लिए कितना अच्छा सोचता होगा,भोसडीके
तेरी तरह थूक चाटने वाले कुत्ते नहीं है हम,थूक चाटने वाले कुत्ते
तो सारे सूअर इकट्ठा हो गये वो मना करता रह गया मैने नही कहा,सूअर
बहनचोद कोई लड़कियों को बेटी की नज़रों से देखता है और कोई बीवी की नज़रो से,बहनचोद
कुत्ते की पूंछ को कितने ही समय  पाईप में रख लो सीधी नही हो सकती। आपके लिए इतना ही कहना चाहेंगे,कुत्ते की पूंछ
भाई साइंस नाम की चिड़िया कभी देखे हो? पढ़े हो??,None
"ये सब कुत्तों, सुअर, गधों की सम्मिलित इंसानी औलादें हैं","कुत्तों, सुअर, गधों"
भोसडीके थोड़ा सा तो शर्म कर,भोसडीके
तेरी औकात नहीं दूसरों के बारे में कुछ भी बोलने का भड़वे,"औकात नहीं, भड़वे"
थप्पड़ नहि जूता पड़ा है कमीने को,कमीने
बहुत नीच देखे पर तेरा जैसा महानीच नहीं देखा।,"नीच, महानीच"
चुतिए अभी भी सोशल मीडिया पर रंडी रोना कर रहे है ,"चुतिए, रंडी"
इन सालो को नारा नही सुनाई दे रहा..,सालो
नीतू का बाप झिला उठा ओर बोला भोसडिके रिश्ता हम नीतू बिटिया का लाए है उसकी माँ कमला का नहि ...,भोसडिके
जिसके कारण आज तुम्हारी जैसी हरामखोर फिर बोल रही है,हरामखोर
सुअर पार्टी किसी बिल के पास करवाने के समर्थन मैं नही दिखती,सुअर
"भोसडीके तुमको मल्टी-बिलियन डॉलर का इंडस्ट्रियल पॉल्यूशन नही दिख रहा, पेसिफिक गार्बेज पैच  नही दिख रहा ?",भोसडीके
"अबे कटे लंड के औलाद, रंडी  सुन, अगर गलत को गलत मान रहे हो तो मर्यादित भाषा में टिप्पणी करो।","कटे लंड के औलाद, रंडी"
उन कुत्तों पर भी मुक़दमा होना चाहिए ।,कुत्तों
देश भूखा है और तू खाऐ मशरूम पनीर रे ओए नीच रे नीच,नीच
तुम वो रईस हो जो गरीबों से माल चूसकर कोठों पर लुटा रहे हो।,"माल चूसकर, कोठों पर लुटा रहे हो"
तुम नीच लोगों को अब भी अक़्ल नही आ रही है क्या ?,नीच
साले अपना नाम भी ठीक नहीं लिख सकते मदरसा छाप.,"साले, मदरसा छाप"
भोसड़ीके ये सब कुछ जाँच के लिये हो रहा है या चुनाव जीतने के लिये ?,भोसड़ीके
भैनचोद आत्महत्या की तैयारी कर रहा है ?,भैनचोद
भेनचोद ये गुलाबी पैंट कौन पहनता है बे,भेनचोद
ये काम अगर उसने किया होता तो तुम रन्डी रोना शुरु कर देते हरामी |,"रन्डी, हरामी"
भेनचोद झोपड़ियाँ वालो को IPhone और विमान की टिकट कौन देता है |,भेनचोद
भेनचोद दिल्ली का मालिक पूरी सरकार चलाने का ढोंग कर सकता है |,"भेनचोद, ढोंग"
भोसड़ीके अपनी टीम को खेलना नही आता और हमे गुरु ज्ञान दे रहा है।,भोसड़ीके
वरना कुत्ते और गधे खाओ ।,"कुत्ते, गधे"
इस कऊए को कोई नहीं पूछता आज कल ? भडवा है साला,"भडवा, साला"
हालत तो धोबी के कुत्ते के समान है भोसड़ीके,भosड़ीके
ओ सुन रंडी के बच्चे। मेरे से ज्यादा बोला तो तेरी रंडी मा को कोठे पे बिठा दूंगा समझा ना,"रंडी, कोठे"
"रोहित शर्मा के शतक से छुट्टी मिले तो बिहार का भी ये नज़ारा देख लेना, यहाँ भी शतक लग चुका है बच्चो की लाशों की संख्या में",लाशों
"बहुत बड़े हरामी हो यार आप, कन्फर्म हो गया",हरामी
आज जिसको देखो ज्ञान देने आ जाता है बे चुतिये,चुतिये
पाकिस्तान की गान्ड हरा चुके है आज बांग्लादेश की बारी है।,गान्ड
जभी तू इतनी नफरत करता है भेनचोद,"नफरत, भेनचोद"
भैनचोद ये कौन सा फरमान है ??? ,भैनचोद
"शैतानी सुअर, भक्ति दर्शन पढ़ लेना ||",शैतानी सुअर
रे माधरचोद क्या तेरी गांड में इतना दम नहीं की तू भड़वे अपने पापों को टेग करके ट्वीट करे,"माधरचोद, गांड, भड़वे"
तुम भी चढ़ जा और नहीं दे तो अपना लौड़ा बढाकर उसके गांड में डाल लें |,"लौड़ा, गांड"
गाली बकना पाप है   भैनचौद   ,भैनचौद
दलाल मीडिया पालतू कुत्तो की तरह भोंकना स्टार्ट कर देती है?,"दलाल, पालतू कुत्तो की तरह भोंकना"
"सुन हिजड़े, तेरी गांड मारली ओर मारते रहेंगे ||","हिजड़े, गांड मारली"
ऎसे ही सभी जगह गांड मरवाते रहते हो?,गांड
परेशानी हो रही हैं आग लगाने वाले कुछ भड़वा दलालो को ! ,"भड़वा, दलालो"
भडवे सूअर कभी तो गलत का विरोध करा करो,"भडवे, सूअर"
