Sentence,Negative Connotations
"До твого списку - дибіли, імбецили, шизануті.","дибіли, імбецили, шизануті"
Навіть коли спізданув цілковиту хуйню.,хуйню
Єдиний спосіб мати відстань між ляхами - цілодобово трахатися.,трахатися
"ота завжди з вами, хуй поймеш що в голові",хуй
"Я дуже рада, що вам подобається моя жопа, але чи не могли б ви, будь ласка, лайкати і мою душу???",жопа
"знатно я блять наїбнувся, якраз перед канцом Еполетс всі ноги болять, БЛЯТЬ!","блять, наїбнувся"
"не варто стріматись,якщо не поводити себе як шлюха,то все ок буде.",шлюха
"мала бути*та бля, я замахалась вже виправляти помилки, кіл мі","бля, замахалась"
"ну бля, чувствую себе як дитина яка накосячила і її приперли до стєнкі","бля, накосячила"
"Вмій, сука, визнавати свої помилки і вчитися.",сука
"по-перше, більшість стоків і секондів нахуй подуріли з цінами!","нахуй, подуріли"
"Зара ше жопу обмотаю, красиво, охуїти!","жопу, охуїти"
Я ше під підїздом сиджу і всіх шлюхами називаю,шлюхами
"Ей ю сі кей, блять.",блять
На хуй зранку краще заходить,на хуй
"З трудом, але я вже це зробила, тепер мені похуй і це прекрасно",похуй
"блять, ну шо, без розчарувань взагалі ніяк?!",блять
та бо рілу дохуя всьогго,дохуя
"Рєбяткі, сорі за то, шо я така курва.",курва
"Ната, ти пізда або просто бесіда з Натою і Владом.",пізда
"типовий твітор українського початківця сієї соціялки: вакарчук, укрправда, мустафа, тимчук, аваков, сальцова і пару хуйових міст.",хуйових
мене і так ніхто не трахне.,трахне
Та ну їх до сраки =),до сраки
"всьо хуйня, вже втретє чую)",хуйня
"Якщо бажання нагодувати передує бажанню трахнути - це всьо, пиши пропало.","трахнути, всьо, пиши пропало"
Може кинути все нахуй і вступити на театральний?,нахуй
"всю їбучу родину дають в нарузку, всю блять ненависть","їбучу, блять, ненависть"
"Не зря, ой сука не зря зробив шенген на 5 років",сука
"Нахуя засирати тві своїми єбучими фотками, в той час коли ти вважаєш себе уродом?","Нахуя, засирати, єбучими, уродом"
"А вобше мені потрібна людина, котра пиздитиме мене щоразу по кривих руках, примовляючи: «Бачиш?","пиздитиме, кривих"
"Кажіть, що я можу більше, ніж та параша, яку я роблю зараз.",параша
"так, блять, де вічний двигун",блять
"Бандеролька в Америку йде майже два місяці, курва.",курва
"Молюсь, шоб та хуйня в мому рюкзаку не розлилася.",хуйня
"Але обережно - захопившись, можна послати нахуй взагалі всіх, і лишитись соціально непристосованим і самотнім.","послати нахуй, соціально непристосованим, самотнім"
сукаопять дежавю вже третє за два дні,сука
бля...індустрія гумових баб досягла досконалості!,бля
"Курво, знай, коли я тебе побачу, тобі пизда.","Курво, пизда"
"#hipster_love RT : в мене таке бажання когось трахнути, але інет тупить(((",трахнути
"Всіх похуй, але Севілья забила.",похуй
Хуйлуша в ексклюзиві для блумберг стільки наговорив.,Хуйлуша
І блять хотілось би скоріше прокинутися.,блять
"Я тебе кохала день у день,А ти сука, олень.","сука, олень"
"Є така хуйня, яку важко пояснити",хуйня
"тьфу блядь, отак одним махом все пересрати. ну зачєм?","блядь, пересрати"
"таваріщі, ну який нахуй порошенко.",нахуй
чай з м`ятою і медом. трошки кориці додай. і спати пиздуй.,пиздуй
"*збирається у важливу путь*- ти повинен сказати щось, що надихне. - просто пиздуй.",пиздуй
Сука блять які ж всі кончені,"Сука, блять, кончені"
'І який мудак засунув пакетик фрукиового чая до м''ятного?',мудак
"Ну курва, тепер треба терміново поїсти сиру.",курва
"'Рев''ю з ейчаром і тімлідом перетворилося на шквал компліментів і теплих слів, від яких я розчервонілася нахуй.'",нахуй
"Чуваки, я вирубилася, зараз прокинулася і мені до усрачки страшно. Здається, що зараз щось завітає. І Сані не можна подзвонити(БляБляБля.","вирубилася, усрачки, страшно, БляБляБля"
"Не думала, що боляче намагатись бути поряд коли людині похуй, або ж кохати її",похуй
"На майдані Руслана несе хуйню, точно таку як в старі добрі часи",хуйню
"йобані пафосні уроди, от треба ж їм це робити в час пік, блять","йобані, уроди, блять"
Ну і пиздуй з мого мюзиклу)0)0),пиздуй
"ги, а нам хуй шо скасували)",хуй
"вася, ну шо за хуйню ти несеш, тіп мене репостнув",хуйню
Може не поможе)0$А ти по молодшеньких?)0)А як же любов і вся хуйня?),хуйня
"блять, що це за дебільна ідея називати мінет їбанатським словом мінчик!","блять, дебільна, їбанатським"
"блять, в мене навіть немає чувака для якого закидати історії, а потім перевіряти кожні 15 хв чи він подивився.дожилась.",блять
"Я намагаюсь стримувати її мінімально, але, блядь, як же страшно",блядь
"А якщо я звідси буду писати який Янукович хуй, мене також можуть заблокувати?",хуй
"вибачте,я знаю,що президента обзивати не можна,і взагалі,я вихована студентка,але Янукович--тупий хуй.#євромайдан",тупий хуй
"назар і романтика:- блять, підійшла сюди, я тебе ще не обняв.",блять
"передку. і чомусь не вийобується тим. навіть не знаю чому. оте паскудне було. надривно-гівняне, чорне. гєрой блядь.","вийобується, паскудне, надривно-гівняне, гєрой блядь"
"ох, тримайся. в мене теж зараз період пиздеця, хай стане краще.",пиздеця
Якого хуя блять за 2 помилки 7 з 10,"хуй, блять"
"Атнять, дєліть, вєщать, бляхі, афшори, крадьот, діктатура, жьідьі, мєшают жьіть.","діктатура, жьідьі, крадьот"
"А мені треба було виписати якусь чихню, якої НІДЕ, СУКА, НЕМАЄ, і від писанини спина боліла пздц","чихню, НІДЕ, СУКА, НЕМАЄ, пздц"
надра накрився пиздов і рівненський азот переводять вніманіє на сбєрбанк. сукафірташ.,"пиздов, сукафірташ"
"Мені вот важко через те, що я впевненний що іншим поєбать на мене, і нахуй їм ще один дувбойоб здався","поєбать, нахуй, дувбойоб"
Бачити як Васіл ахуєває з того шо я творю під постуху це нєчьто.,ахуєває
"Задумалась над тим, шо я долбайоб, і йду лежати далі.",долбайоб
"дура тупаякого хєра було жерти той арахіс в йогурті, коли у тебе хворий зубі вобщє, ти на дієті","дура, тупая, хєра, жерти"
"Усе хуйня, а красива білизна - то святе.",хуйня
'жопа. навіть я колись це ім''я вживав) але я не дописав ту річ)',жопа
Все забите школотою та студентами.,школотою
"от і я про що. легше одного годувати, але класного. хай навіть не ідеального. ніж купу засранців і мудаків.","засранців, мудаків"
"ну то так. похуй, що антикорупціонєри прикупили хат – а ви бачили як Порошенко краде?","похуй, краде"
"Я і не квжу, що йому похуй, чи зющо він неякісно зробив роботу.","похуй, неякісно"
Аж сука знести твіт руки зачесались.,сука
Усвідомити всю їбанутість власних вчинків.,їбанутість
"Дайте мені мужика, котрий не доводитиме мене до сліз, і я скажу 'Що це за хуйня?'",хуйня
"RT Отако лиши мужиків самих, зразу якісь шлюхи знаходяться:)",шлюхи
"Нууууу пиздець, мусора у нас нічому не вчаться.","пиздець, мусора"
"4 рази прокидався ідумав, бля ти ідіот та поспи нормально, і засинав))0","бля, ідіот"
- Я його послала нахуй!,нахуй
"та блять ноги витирають, а я терпіти маю",блять
"ай трайд ту бі пьорфект бат насін воз ворс іт нахуйнахуй взагалі це все, на хуй","нахуйнахуй, нахуй"
чого я блядь не йшла в пту щас би вже була флорістом,блядь
Як від того блядського коньяку сушить.,блядського
Порівняв мене з нудною хуйньою.,хуйньою
"Ахуєть Просто АХУЄТЬ Непогано, і дуже навіть цікаво)",Ахуєть
"Злися на придурка-хазяïна, який не привчив його цього не робити.",придурка
"хоча в мене жопа нічо так, але бля, ну всього ж має бути хоча би рівномірно((","жопа, бля"
Сама чьотка фобія - то фобофобія.,
"Пиздосіще, їбанутись можна, що за хуєта творитьсч","Пиздосіще, їбанутись, хуєта"
"Ні тобі мокрих трусів, ні армії фанаток.","мокрих трусів, армії фанаток"
"Твою на ліво, ми в першому класі брехливо розповідали, як в садочку трахалися, а ти в 8-9.","твою на ліво, брехливо, трахалися"
Нахуй ти палишВона там завжди,Нахуй
"ну бля, хуль в тебе сумління не спить?)","бля, хуль"
Просто зберігаю картинки і хуярю :D,хуярю
похуй. я офіційно на 4 курсі і в мене є стипендія. все решта - похуй,похуй
"Чи хоч Генріхом 8, інакше, що за хуйня",хуйня
"якщо що, я не трахалася останній разок у березні",трахалася
"Аж передьоргує, коли шарю наскільки лох",лох
ну є такий вид фанаток яким похуй на тебе,похуй
Твіттер до добра не доведе блять.,блять
"чомусь є купа адекватних людей, які після дємбєля не бухають в формі і не розказуютб як трахали когось під Луганськом","бухаїть, трахали"
"ну знаєш, то життє, хуй знає, шо генетика надумає)00)",хуй
"я теж, але бля, той, кого хочу, або в іншій країні, або не хоче мене.",бля
"Папужки теж пролітають, бо пиздять більше, ніж бабки в черзі.",пиздять
"Я: я в суботу ще поїду-я тебе блять поїду, тобі грошей ніхто не дасть.",блять
ну бо воно годне було хоть і хуйня,хуйня
"к хуям показавши зграї що зуби є, в порядку, гострі і мають щоденний догляд.",к хуям
"Знаєте шо, нахуй ідіть з вашою естетичною медициною.",нахуй
не лижіть один одному тут сраки,"лижіть, сраки"
"Кацапчик подарував шоколадку, колега пригостила кексом.",Кацапчик
"В мене така ж хуйня була, потім локалізацію апстору змінив і все як має бути",хуйня
"Стільки ненависті, шо її видерти нахуй хочеться.","ненависті, видерти нахуй"
"Для тих, хто знає тебе долбойобом, нормальною людиною вже ніколи не будеш.",долбойобом
"А шукати програмістів в твітері, це як шукати шлюх в супермаркеті.",шлюх
"В мене так мало грьобаних друзів у цьому сраному житті, реально, як пальців на одній руці.","грьобаних, сраному"
бо говориш з хуйом в роті?,хуйом
"Ната киця, а ви скотини йобані, бісите.",скотини йобані
"Якщо я така херова, чого ти мені до тепер виписуєш?",херова
Чувак на чорній Інфініті з номером АА 5333 СХ - мудак.,мудак
"Всіх зайобую, всім від мене хуйово.","зайобую, хуйово"
"- Алік, що за хуйня.",хуйня
"Надто багато твіттерських, яких я хочу трахнути.",трахнути
Зранку як прокинусь вже ж буде готове?,
А могла б і виділити на це 0секБо я таки не хуйовий,хуйовий
"Хто відповідатиме за ту хуйню, що ти навиправляв, телефон йобаний?","хуйню, йобаний"
"Але похуй, я жену на всіх:)",похуй
"Любиш творити хуйню, люби і вигрібати.",хуйню
А як мені відписати то хуйГдє тут чієс,хуй
Ну і іді в сраку,"іді, сраку"
"А ще, якщо ти працюєш в медіа, то май яйця не транслювати власну упередженість в ефір, мудло ти вузьколобе.","мудло, вузьколобе"
"Ми кажемо бірмікс, розуміємо хуйня",хуйня
"ви знаєте, як сплять старі гаї?ще взнаєте, суки.павло тичина.",суки
да я вже так блять і зробив,блять
"Не трахайте дівок, які не можуть наспівати пару пісень Лінди.","трахайте, дівок"
" і сука, він такий уйобок.","сука, уйобок"
"Фу блять, можна якогось відмінити всі секси, наче їх ніколи й не було?",Фу блять
"Як же важко забити хуй на того, хто давно забив його на тебе.",хуй
Пропагандисти в ОРДЛО почали перекладати свої висери угорською.,висери
"Але якщо тій людині похуй на мене, то що я зроблю.",похуй
"Якби ще мізки не трахали і що таке гігієна з самостійністю знали, то взагалі зашибісь)",мізки не трахали
"Звісно, після цього дізер почне мені пхати різну хуйню з 80их, але втриматись неможливо",хуйню
"Самі дрочите , то явно не злизуєте потім, а як дівчина, то всьооооо, ти мене не любиш.",дрочите
"бля( ні, ну як так можна!",бля
Бо життя хуйня якась суцільна,хуйня
"Навіть, коли ти хлопця хочеш мати як пару, впершу чергу він має бути другом, бо інакше це пизда на вітер.",пизда
Та сука перезавантажся й не зайобуй вже,"сука, зайобуй"
"бля, я йду в черниці.",бля
Може це для різноманітності перестати поводитися як мудак і ображати людей?,"мудак, ображати"
Зачєм люди полюють на тварин?,
"Досі так незручно, це просто пиздець, вчасно я в Карму прийшов канєшн",пиздець
"Блін, ну оце ж не можу не спизданути зайвого.","Блін, спизданути"
"Нідерландець, йопта, тут тобі не Тєхас",йопта
та я нарешті ту шарагу блядську закінчу і від липня я вся твоя),"шарагу, блядську"
"ну 7 +-, поки ще дойшовтака хуйня",хуйня
"думала, шо то сніг блять",блять
"бляха, у мене тут все зашкварилось просто ааааааааааааа","бляха, зашкварилось"
"'Тре почати ламати їм кінцівки, щоб нікуди не з''їбалися, мразі.'","ламати, з''їбалися, мразі"
"Сука, з 6ї ранку, ледве прокинувшись, починає зайобувати.","Сука, зайобувати"
"хуй з вами, а я спатина добранічз.і. і вибачте з матюги, без них сьогодні ніяк","хуй, матюги"
"У всіх є такий фармацевт нахуй( Ну, чи був.",нахуй
"терпи чувак, з алергією схожа срань",срань
смотріт как на говно,говно
"бля, Ді, шо ти робиш?",бля
"Тепер у мене нічого не включається **Тільки не пишіть що мудак, бо все мало бути.",мудак
Лєра посилає то все нахуй і об 11-й вечора сидітиме вдома за великим горням карпатського чаю і вчитиме),нахуй
"а в Львові, то ж блять вважай БігТвіттор із вочінг ю)))",блять
Якась хуйня дереться мені у вікно.,хуйня
Ваша мораль нікому нахуй не тре.,нахуй
"блять. як харить, коли тебе постійно використовують впродовж місяця. по - стій - но. навіть попри ''''розуміння'''' твоїх проблем. здохніть.","блять, харить, здохніть"
"от шо значіть стараться, коли дєлаєш хуйню.",хуйню
"Ану признавайтесь, засранці, хто грушки наші поїв і мій одяг вкрав?)",засранці
"Ти такий дурень, що навіть це не зміг зробити",дурень
"Наді мною тре стояти і пиздити палкою, шоб я шось робила.",пиздити
"В Україні хєрово жити, бідна і роздовбана країна, не то шо Європа.","хєрово, бідна, роздовбана"
"Твою на ліво, я так кожного сранку прокидаюся і без жахіть.",сранку
"Ахаха, бляНє, я краще сам якось",бляНє
"охбляха, воно ше і затвітило)",охбляха
ну й лох же ти) Скільки сторінок?,лох
Ну і нахуя ти зареєструвалася у твіттері?,нахуя
"Уявляю, у якому пиздеці ми б жили, якби у нас корупції не було.",пиздеці
"та, тісто - то жопа :D Більше подобається м'ясне готувати.",жопа
"Ну звичайно, я додому тільки заради одного катаюсь. блядство",блядство
"бля, це часом не чувак з інстаграму?",бля
"бля, піду шолі на манікюртільки мамка дасть пізди, коли взнає, шо я зробила гель-лак :с","бля, дасть пізди"
"Але мудак нелицемірний, з переконаннями і відвагою.",мудак
Мені до цього жопу ножем тільки з моєї згоди різали.,"жопу, ножем"
"надвігающійся, як жопа, дедлайн, знаєтє-лі, стимулює...",жопа
"а шо там з тим хлопом, якому ти зізналася, шо хотіла б його трахнути?))",трахнути
"Блять, да заїбали обертатись на мене в маршрутці.","Блять, заїбали"
"Бля я їбав, дай сігарєту, ну його нахуй","Бля, їбав, нахуй"
Я сьогодні лох з лохів.,"лох, лохів"
Та щось ніхуя не знаходиться.,ніхуя
"Ну привіт вечір, зараз я тебе бездарно проїбу.",проїбу
"Я: АХАХАХАХАХАХАХАХ * і ще довго істерично ржу, ібо дофіга всякого*",дофіга
"Читаєш, і ніби це ти сдихаєш від незрозумілої хуйні, а не головний герой.",хуйні
"Маємо судження: всі люди – люди, деякі люди – кур'єри, деякі кур'єри – гандони.",гандони
"Я,бля,якийсь лузер,знов все пропустила,киньте вже мені те фото!ну будь ласка,будьте людьми))","бля, лузер"
"Ви дрібні, дешеві нікчемні та страшні бляді, що відразу пильнули, як тільки гроші попали до рук.","дрібні, дешеві, нікчемні, страшні, бляді"
не розумію чому я ржу з цієї хуйні.,хуйні
я розуміють коли дівчатка обирають мудаків.,мудаків
Чому пуштуна чекає анал та пляшка?,анал
"- Ні, блядь, бінарна сполука.",блядь
