Sentence,Negative Connotations
пройшов вже через цю срань просто,срань
Бляяять я бачила гоблінський переклад цього...,"Бляяять, гоблінський"
в тебе блять забув спитати,блять
"Блять, благаю, скажіть що робити, щоб припинити гризти собі їбучі губи та щоки?","Блять, їбучі"
"Сірожа, віддай мамі семсят тищ, сука!",сука
В мене завтра свіданка блять.,блять
"Вот,сучки...все таки наєбали мене... обманули,а кажуть люди гавнюки,а тут і голуби ще аферисти","сучки, наєбали, гавнюки, аферисти"
"відколи я, блять, така совісначого я не можу зі спокійною душею звалити з пари?","блять, звалити"
"І ПОШУКОВІ ЗАПИТИ, там повний пздц)",пздц
ща блять на одних сук наброшу,"блять, сук"
"Єбала я ваш Новий рік, то не свято, а хуйня якась","Єбала, хуйня"
"Нашо, можна ж тебе пиздить",пиздить
Дике бажання кхуям забрати документи.,кхуям
"Та бля, звідки рендомному чуваку або чувісі з інтернетів знати, чим я займаюсь?",бля
"Скільки не корми, все одно йде нахуй",нахуй
Довелося 15 хвилин чекати ту курву.,курву
"Та ну сука, я сьогодні навіть вдягнена пристойно, шо знову не так?",сука
"Які клали хуя на всіх, від гаїшника до прокурора.",хуя
"Навіть коли такий пиздець, як зараз :(",пиздець
"Зрозуміла, що з недотрахом нізя сідати біля гарних хлопців.",недотрахом
"Мені здається, я рухаюсь нахуй, і, здається, мені навіть норм.",нахуй
Його б я розділа і виїбала.,"розділа, виїбала"
О блять спасіба щедрим богам за маршутку,блять
Ну я таки пиздуюІ тобі раджу,пиздую
"Ой дівчата і хлоп''ята, це піздос.",піздос
Краще буду пиздіти про них за спиною,пиздіти
"Мені здається, що на мене пожалілись моєму стоматологу, що я пизджу багато.",пизджу
"Та я теж, але сука, і так весь час дома, а там щось цікаве.",сука
"Хочу менше матюкатись, але як тут курва не матюкатись, коли робиться такий піздєц???","курва, піздєц"
"Ну тут хуй знаєЧесноЯк коли, все залежить від історії ЦЬОГО",хуй
Якого блядь хуя в мене повна стрічка русні?!,блядь хуя русні
"Бєсіт коли сплять всі, ти ходиш тихенько, щоб нікого не розбудити; коли спиш ти, всім похуй, робимо усе максимум гучно.",похуй
"Чому відмазують зашкварених, що не можуть пояснити звідки гроші?","відмазують, зашкварених"
Дибільне то геть не мудак,"Дибільне, мудак"
з Київом така ж хуйня,хуйня
"Якщо ти ще не дрочив, я йду до тебе.",дрочив
уїду нахуй від вас у королівство Пропан-Бутан,нахуй
"Йду відпочину, куплю собі вкуснях і буду єблувати**СУКАААА БЛЯТТ*","єблувати, СУКАААА, БЛЯТТ"
"а можна я ще раз скажу, що ти мудак, і мені за це нічого не буде?",мудак
'хуйняшкою) RT : Тре'' бути няшкою.',хуйняшкою
"Пріключєнія Діминої сраки продовжується, бл","сраки, бл"
"– я вас, суки, по одному виловлю!– я не погрожую!– ви не маєте права мене тримати!",суки
Бистрі ноги пизди не знають:),пизди
"Отак спілкуєшся з хорошою людиною, все йде добре, і раптом як пізданеш якусь хуйню...","пізданеш, хуйню"
"Люди не як кораблі, люди як долбайоби.",долбайоби
"Вирядилася, блять, на зйомки патріотичного порно.","блять, порно"
"RT : Не дарма Бог забрав стать у ангелів, шоб не трахали всіх навколо.",трахали
"Сука, щоб я ше раз так їхав на фест.",Сука
"Сука, який же там пиздець.","Сука, пиздець"
"Не поїдете - обосруть, скажуть засцяв.","обосруть, засцяв"
Назвав мене йобнутою вже 5-й раз.,йобнутою
Як же жаль тих хлопців що склали через цю мразоту голови.,мразоту
ну пезда забув про мене,пезда
Чувакам в ІТ треба робити їбала попроще.,їбала
Бубічьок головне не накручуй себе на хуйню ;) а я тебе лю :*,хуйню
"Яка різниця, котра година: аби творити хуйню, час не важливий.",хуйню
"всі дрочать. а ті, хто каже, що не дрочить, дрочить вдвічі більше","дрочать, дрочить"
"блять, ско, коли ти нормально коми ставити будеш. на твої твіти дивитись соромно.","блять, соромно"
"хуйовий велосипед, який не їде, при чому.",хуйовий
"Одне питання: і, блядь, що зроблено/планується зробити за останній час?",блядь
"По Сємьйончєнко, чи Жиртрєстокабанчєнко, я вже не знаю, коротко: знімати недоторканість і закривати суку у хуям.","Жиртрєстокабанчєнко, суку, хуям"
"Можеш мене вважати мудаком, але падкат робиться в незалежності від наявності дівчини. :)",мудаком
"Поки Порошенко хуйпоймишо робить, Юрій Луценко повертає в країну гроші Януковича, відновлює контроль держави за...",хуйпоймишо
І як цей Порошенко блядь тільки встигає?,блядь
оці ваші блять тонкі ранімі душі. а як я почну на всьо ображатись?,блять
"Та мене оце сюсі-пусі саму бісить, особливо, якщо то прямо, сука, ПОСЕРЕДИНІ ПРОСПЕКТУ ВОЛІ","бісить, сука"
"І що бля, це більшість жінок почувається — отак??",бля
"Бо, блядь, поки доберешся з однієї залупи Києва в іншу, то півдня пройде","блядь, залупи"
"- ми про щось забулипро дитину, блять#НічІзКевіном",блять
" бухати, трахатися, читати Кафку і Кортасара, танцювати на столах, аж доки не помрете ;)","бухати, трахатися, помрете"
"нахуй не нада, отож бо й воно)",нахуй
"Ідіть нахуй, не затягнете мене в свою цукрову секту.",нахуй
блять їбучі дощі в Конотопі сплав переноситься на вихідні -_-,"блять, їбучі"
"Я ще вічно могла б нити, але нахуй",нахуй
"Він пиздецьвірував, він же був прихильником Савонароли",пиздецьвірував
там уся м'якотка в коментах під цим висером бгг. иксперта виїбали & опломбували (анально).,"висером, виїбали, опломбували (анально)"
Сиджу ржу з фотки волохатого пінгвіна.,
"а, і йдіть нахуй, канєшно .",йдіть нахуй
"Спочатку ти обіцяєш їй забити цвях, а потім забиаєш хуй.",хуй
"Блять, уйобую нахуй в Острог і не вертаюсь. впізду","Блять, уйобую нахуй, впізду"
і хтось це ябо я не пизджу чуже,пизджу
"Блять, заїбала ця хуйня, іди в сраку з тим","Блять, заїбала, хуйня, іди в сраку"
"Тепер неясно, чи то малолітня шлюха, яка в 14 родила, чи просто турботлива сестра.",малолітня шлюха
Хто рано встає - той більше хуйні встигає натвітити.,хуйні
Ну я єбанутийНо не на стільки,єбанутий
"це ж блять релігієзнавство, ти ще до політології десятки джерел читай",блять
блять шо за питання взагалі,блять
"я маю враження, що він непогана людина, яка несе багато хуйні.",хуйні
"Щоб у мене все було добре, тре лиш секс і шоб мудоблядські суки здохли.","мудоблядські суки, здохли"
"Можно купувати квитки, але блядь.",блядь
"-Пацани, так а хто за кого вболіває?- в смислі? пішов нахуй, ми футбол дивимось без тебе, шо за вапроси",пішов нахуй
"можеш послати мене нахуй, якшо хочеш.","послати, нахуй"
"тре було послухати, чому моя доповідь хуйова",хуйова
Мої тоже мене пиздять не зле,пиздять
"о боже, як я ненавиджу таку хуйню.","ненавиджу, хуйню"
"кожна людина має право писати хуйню, це записано в конституції",хуйню
"І всі, блять, вважають, шо їх проблеми найважливіші.",блять
"Блядь, хочеться взяти і повіситись.","Блядь, повіситись"
"в мене на минулому тижні було замовлення, одразу нахуй послав.",нахуй
"Неа, ти слішкам ахуєнний шоб хуєсосити треба","ахуєнний, хуєсосити"
розфоловила глину ще до твітів румбамбара. так блять не хочеться розфоловлювать малину.,блять
Домашня обстановочька так і спонукає забити хуй на все та побільше;),забити хуй
#ДОВЕЛИблятьМОГИЛЯНКУ RT : Ми поднімєм Магілянку с калєн!,блять
"Вкладники Привата нахуяряться настоянки глоду, і потім російських послів стріляють.","нахуяряться, стріляють"
"Понароблюють хуйні, котра рветься після першого ж разу.",хуйні
"Доки не пізно, сповідайся, якшо трахався з кимось із фоловерів.",трахався
"Поки я спала та мочила жопу в морі, ви пиздякали про айфон.","жопу, пиздякали"
"АбоБлять викладач даунПіздец мене одногрупник заїбавБляяяяяять, зошит за лекцію закінчивсяСука, скоро сесія, за шооооо????","блять, даун, піздец, заїбав, бляяяяяять, сука"
Мо спраглих за Вітєю тра просто відпиздити до кривавих сцяк?,"відпиздити, кривавих сцяк"
"Мам, мені хуйовоі ржу.бля :D","хуйово, бля"
"Викликайте екзорциста, я зовсім охуїв.",охуїв
Аа там пеперва під час пари хуйова,хуйова
"Так шо, то ваші проблеми, членоноси.",членоноси
"Я хочу вивчити ще багато мов, але ж блядь.",блядь
#ЯкщоДніпроВиграє я перестану робити хуйню...,хуйню
"Взяла сир-косичку, крабові палички, зробила Кривавої Мері та послала нахуй усе, що тільки можна.",нахуй
"Хвала небесам, що мені похуй на укладку",похуй
"Пилипишин - ахуєл, всі ахуєлі","ахуєл, ахуєлі"
'Я ахуєла і не вихуїлаЯк видалити пам'ять',"ахуєла, вихуїла"
- іду на ви. - іди на хуй!,хуй
"Якби за кожну твою брехню я дарувала тобі по одній повітряній кульці, ти б давно полетів нахрен #думки_вголос","брехню, нахрен"
"Анатомка, я тебе обожнюю, сука ти кончена.","сука, кончена"
"Отже, те, що одним під силу, іншим похуй.",похуй
мама: тобі б не мішало похудать і потрахатьсяя: мааам,"похудать, потрахаться"
"Там блять у слові була не та літера, і, сука, ніхто не здогадався, що це просто опечатка.","блять, сука"
трахатись - це як рання весна :3,трахатись
"якось стрьомно, коли бухе хуйло спершу вимагає пустити його в під'їзд, а тоді називає тебе сукою та погрожує","стрьомно, бухе, хуйло, сукою, погрожує"
"А йде лише, сука, той, який у дорозі добу, їбучу добу.",сука їбучу
"Загалом агітація задовбала вже - папірці сують,листи надсилають,додому суки телефонують(!).","задовбала, суки"
Як тільки зайшов почали стукати і кричати мол якого хуя так довгоТиц пиздиц,"хуя, пиздиц"
"Бо блять, там починаєш вводити назву, а воно не знаходить.",блять
"Кидає мені, а я ж рукожоп.",рукожоп
"Дуже часто це навіть необхідно, бо долбайобів терпіти зась, а вони ж знають, що ти наче зобов''язана.",долбайобів
"блядь, жінко, там і тридцятник недалеко.",блядь
"І живи тепер з цим, ссука.",ссука
"Бля, піздос, не пам'ятаю де в мене пара, а в розкладі неправильний кабінет","бля, піздос"
"Блядь, собаки з усього району почали вити.",Блядь
"Тому унилоє гавно залишається в КП, а я відправляюсь в путь.",унилоє гавно
тіки не кажи що та ж хуйня?)),хуйня
"Нє блять, я в кєдах поїду.",блять
Або завжди можна трахнути самотню жінку за 40.,трахнути
"Тобто професори тримаються бодрячком, але всі розуміють, що повний пиздець",пиздець
"Пацани що таксують в Über, не намагайтесь наїбати.",наїбати
"аххххах, бля :D даішники :D",бля
"Бісять гуманітарії, бісять технарі, усі бісять блять, ідіть нахуй","бісять, блять, ідіть нахуй"
"Холодно стало, дєвок нє сталоПтічкі гавно перєсталі клєватьНе комфортно курити на балконі блять","гавно, блять"
"-Якщо ми будем так цілий рік салати по трохи їсти, то йди ти нахуй!",йди нахуй
"Боже як скучно, нормальна людина вже пішла б спать, НО НЄТ, Віка ж спала півдня і тепер хуй засне",хуй
але ж він блять не переплутав дні!,блять
"набити хуй, щоб хоч десь він у мене був.",хуй
"І там тебе знайду блеать, в мене віза на всі страни",блеать
"І рибку, і на хуй, та?",хуй
"Підходить промоутер на Волині, парить хуйню, відповідь жіночки:- Сонечко немаю часу тебе послухати, там дитя мене жде",хуйню
"Шо за хуйня Вже тиждень ниють м'язи в ногах (верх литки), і я ледве стою на ногах",хуйня
"Якийсь трошки пздц з цим розслідуванням голаднців, ні?",пздц
"блін, хотіла від когось відписацця, погортала подивилась, а всі такі коти ідіть нахуй",ідіть нахуй
"Спитав пан Богдан, які ми знаємо три євоейські свята, і я спизданула РАМАДАН",спизданула
"Ці їбучі уроди, які постять оголошення про кімнати, а потім не відписують...",їбучі уроди
"Нахуя хлопу дівчина яка вміє рахувати дискримінант, та ще й вишивати, що він з нею буде робити?",Нахуя
#похуй #якою #мовою #головне #шоб #дохуя #хештегів #беззмістовних #було,"похуй, дохуя"
"Я знаю, дякуюЩе мудака забула...ну і послати мене нахуй",мудака; нахуй
"ти шо блять куриш, а я досі про то не знала?",блять куриш
От вам моя експертна думка: ніхуя англійці не розуміють в революціях!,ніхуя
"Ви звертали увагу, на скільки багато повилазило цинічної мразоти?",мразоти
У французьких блогерів рве пукани.,рве пукани
"нахуй я сюди ходив – науці не відомо. замкнутий круг, нєбо вокруг.",нахуй
"Тому блять взяла і посмажила м'ясо собі, можна в пиві перед тим вимочити, але не блядь саме пиво пити..............",блять
"Хочеться насильно змушувати трахатись усіх, хто ниє.","насильно, трахатись"
Треба просто напросто не зв’язуватись з мудаками,мудаками
"Дивлячись на те, як воно з іскрою в очах насрало в пюре, хуйовий із нього Рататуй","насрало, хуйовий"
"Мої одногрупники, що сидять попереду мене, жруть мандарини, зефір та сир.",жруть
я блять 2 тижні не можу провести необхідні мені операції,блять
а я блять думаю для кого яськів постила картінку,блять
пиздуйте в вк ті дєла обговорювати,пиздуйте
"Що це твоя, блять, хата, а отже ти можеш хоч і бомжа привести.","блять, бомжа"
то я дохуя того вчивщо вже не знав що вчити но треба було,дохуя
На скільки справ ще не покладено хуй!,хуй
"Так от, може за #ЛяВорк я і скучила, але ніяк не за йобаними ранковими підйомами.",йобаними
Перестаньте бути мразями хоч на день.,мразями
"зважаючи на моє мудацтво - ті хто не з''їбалися і можуть товаришувати - вони пройшли ценз, бггг","мудацтво, з''їбалися"
блять як сенс життя с:,блять
"Сидиш собі, і раптом як починає всіляка хуйня думатися.",хуйня
І тут доїхало бгг блядь.,блядь
Всім похуй на вашу думку.,похуй
Шей мамі бля 300грн віддав...,бля
"Іди нахуй, це обідно :(","нахуй, обідно"
"ох, львівські ранкові затори.не люблю, не скучила, йдіть нахуй.",нахуй
"бля, я б так взула *___*",бля
"я вражений прямо в хуй. не знаю, чи зможу я з цим далі жити, ага.",хуй
"Коли педосівські старпьори знов мичать як добре жилось при сср,то нагадуєш їм,шо 3джі з мемасіками,зьявились іминно при укровласті!Замовкают","педосівські старпьори, мичать"
бля вже весь твіттер знає шо ми живем як буржуї,бля
"предмет не важливий, тож похуй.",похуй
Потягів без орущих піздюків не існує.,орущих піздюків
"та будь ласка, те що я мудак то не секрет:)",мудак
знімай стрес правильно -пиздуй в магазин!,пиздуй
"Гірше за все прикидатися, шо тобі похуй.",похуй
"Блять, ви такі кумедні що пізда.","Блять, пізда"
Шо там учити - бери й хуяч)),хуяч
"Та блядь, вони знають, шо є",блядь
"Замовила, відправили....сукаааа чого ж в найкращих забирають життя...",сукаааа
"Любіть Україну, бо Путін - хуйло.",хуйло
"Ні, не розумієте(Відсилка до хуйової реклами)",хуйової
Хочу дві роботи та жодної хвилини думати про хуйню.,хуйню
Послам похуй на Україну,похуй
"пиздуй спати, бо подзвоню в 5 і ніхуя ти ващж не виспишся","пиздуй, ніхуя"
Але на справді Богуслав безсердечна сука,безсердечна сука
"будьте блять обережні з їбаними бажаннями, вони мають срану властивість збуватися","блять, їбаними, срану"
"жопа ти, катя, - сказала мама і пішла робити мені каву)",жопа
Згадав свій сон і це пиздець.,пиздець
Вдягала ліфчик - відірвала к хуям бретельку разом зі шматком чашки.,хуям
"Я знаю,що ти це читаєш,Т.я його НЕ ПІКАПЛЮ .-.",НЕ ПІКАПЛЮ
Просто бінго-комбо нахуй****40-річний співробітник відділу оперативного супроводження адміністрування ПДВ...,нахуй
"Боженька оточує тебе мудаками, щоб перевірити наскільки ти готовий до пекла.","мудаками, пекла"
Бо це теж та ще помийка блядська,"помийка, блядська"
"Уся сіль у тому, що в цього чоловіка МЕДИЧНА, БЛЯТЬ, ОСВІТА.",БЛЯТЬ
Кусок живота з-під задертого светра - ух бля секс!,бля
