Sentence,Negative Connotations
"Навіть не знаю, то дар чи прокляття моє вміння НІХУЯ НЕ ЗАБУВАТИ От якого, мозок, ти так підручники не запам'ятовував","прокляття, НІХУЯ"
"Краще здохнути, ніж визнати, що всрався.","здохнути, всрався"
Здається когось вже пора впиздити.,впиздити
"Ідеальну хуйню, щоб тебе ніхто не торкався в метро, знайдено.",хуйню
"«Подивіться, яка я бідося, жалійте мене блять!».",блять
Хєрак нада шось придумати годне хєрак похуй і так зайде,"хєрак, похуй"
"Ви хоч раз слухали хуйню, яку він несе?",хуйню
На кожен пездець є свій похуй.,"пездець, похуй"
"Хоча насправді похуй, просто не було чим, а його щітка й справді чистить в важкодоступних місцях.",похуй
"ти підписав собі вирок, сука",сука
"Отак не встиг зафоловити людину, як вона почала писати хуйню.",хуйню
"Розхуячила палець, намагаючись розбити варене яйце кістяшками.",Розхуячила
І щоб не було ще ліпше: нахуй порвані джінси,нахуй
"я б з тобою потринділа, але ти такий муділа",муділа
"Хеппі бьоздей, щось ніхуя не хеппі.",ніхуя
Найкращі ультрас - дівчата з РГМ.,
"Хочу вирубити одну кончену сучку на роботі, але я не б'ю старших.","вирубити, кончену сучку"
"(Якшо якась сука, знову, не зіллє інфу)",сука
Гоголь хоче всіх волонтерів фул-тайм і щоб всі фоткали афіші (шо за хуйня з афішами?) і набрали 300 людей (!).,хуйня
"Всі бляха такі таємничі, шо піздєц.","бляха, піздєц"
"Одного разу зробивши хуйню, ти раз-у-раз думаєш над черговою.",хуйню
"Ти сукан, бухаєш без нас з","сукан, бухаєш"
Тинка ходи на Jazz fest і вино післяЖінку свою веди блять.,блять
Мозок: *думає про цю хуйню*,хуйню
То це ясно і їбанутим.,їбанутим
І позбавляти нахуй субсидій/фіндопомоги від держави.,нахуй
Ну і де блять то #покращення?,блять
спизди там рюмку для мене :D,спизди
В коридорі готелю вже годину голосно пиздять люди.,пиздять
Не дадуть людям спокійно пизди еее бороти корупцію!11,пизди
Я ж не залупа якась,залупа
Щоб то ще такого спизданути в стрічку?,спизданути
"Щас роздінусь і піду голою, і похуй.",похуй
"Таке враження, шо в росії не вміють норм трахатись.",не вміють норм трахатись
"Подзвонили всі возможні родичі, сусіди стукаюсь блять, шось таскають там я єбу, брат 100500 раз зайшов в комнату ну блеееет","блять, єбу, блеееет"
"Заходжу я в твітор, а тут Лєщєнко пиздить.",пиздить
Антикорупціонєр – це коли в жопу за $ дає.,в жопу
кексложно вамна мене просто завжди похуй було,похуй
в сраку ті дужки засунь)))))),"сраку, засунь"
"Які, ссука вибори в умовах окупації?",ссука
"блядський твіттер, чим більше оновлень, тим більше тупить","блядський, тупить"
Як добре що така хуйня властива лише монархіям,хуйня
"-Ну как обичьно, нахуй))))Кежуал конверсейшнс віз  )))))",нахуй
"Пише: Я думала хуйня в мене в житті через відсутність сексу, порішала з сексом, а хуйня лишилася.",хуйня
"Блять, я ненавиджу своє їбуче тіло, сам факт свого існування.","Блять, ненавиджу, їбуче"
Він вміє срати мимо лотка і гарантовано не допускати олігархічного беззаконня.,срати
"ніколи...чуєте, ніколи! не плутайте такі речі. це ж як хуй з пальцем порівнювати))",хуй
"Нахуй ти палиш, ну бля","нахуй, бля"
Коли наїбала самого Бога Долею.,наїбала
"Найбільший злочин проти українського народу - влада, яка складний час впевнено і безбожно продовжує пиздити","злочин, пиздити"
"тому, кстатє, спайк лі получив каннську гілочку, а кокотюха получив хуй на патичку, і так йому і нада.",хуй на патичку
"Боже блять, нарешті хтось про CCR сказав.",блять
"зайди на фб, молю! кончений вк не дає нічого зробити! це все хуйло всране","кончений, хуйло, всране"
"Я: блять, в мене якась депресія вже протягом тижня...",блять
тобто блядь? тобі більше 25?!,блядь
Надіюсь вся ця хуйня котра весь тиждень вставала між нами і одесою не була ужасающим попередженням мірозданія,"хуйня, ужасающим"
"На вулиці теплинь, пташечки літають, спідметал хуярить в навушниках.",хуярить
"Нічого осбливого, просто новий пляж в Тернополі*АХУЄТЬ БЛЯТЬ*",АХУЄТЬ БЛЯТЬ
Сука як же мене всі бісять блять нахуй,"Сука, бісять, блять, нахуй"
Бути тупим уїбаном саме по собі не є поганою рисою.,тупим уїбаном
"Бо пити його разом з алко дуже хуйова ідея, перевірено",хуйова
"А то сука навіть не мої слова, і не мої думки.",сука
Батюшка сказав шо митрополит-це наш пастир до Спасіння а митрополітен-це якась хуйня з рельсами яка веде у Теремки,хуйня
"Але звинувачувати у проруснявій позиції можуть лише повні, абсолютно кончені дегенерати, п'янь від люмпеноти, русня і підруснявлені манкурти.","кончені дегенерати, п'янь, русня, підруснявлені манкурти"
"Так, сука, не здумай тільки стригтись",сука
Якого хуя мене тьотьою назвали?,хуя
"Тварини нас не люблять, йопт",йопт
"Не блядство, а «високий рівень соціосексуальної орієнтації»",блядство
" отож і воно, гідність, бляха, поламалася",бляха
"не можу, в мене, сука, над головою свердлять, а я намагаюсь працювати",сука
"Є така хуйня, коли ти хочеш не побачити людину, а щоб людина побачила тебе.",хуйня
"Та ну сука лізуть і лізуть, є взагалі якісь межі цього шапіто???",сука
Ти пизда як зміниласьДо того ти була ще терпимоюА зараз на кожному кроці хочеться тобі вєбати,"пизда, терпимою, вєбати"
"Шоб я не робила, все якось через жопу.",жопу
"бля, це ж твіт лів",бля
"Ваулюдина, угуДякую за настрій, бляха",бляха
"Це не лєві) а тітка, яка сама ніхуя толком не прожила.",ніхуя
звідки вони вобше блять вилізли?,блять
"Тут або Тинка, Тіна, і Крістіна як кажуть америкоси, ну або вже повним ім'ям.",америкоси
"нє, просто мене пре фраза - няняня-хуйня) Та й який з мене нах отаку?","хуйня, нах"
"Сука, я ніхуя не встигну перекласти ці йобані тексти за 2 дні.","Сука, ніхуя, йобані"
Та задовбали вже своїми піКардами.,задовбали
"Я хуй його знає, одного мене вже прикачала та кроватка-бук у стрічці?",хуй
"Я а*уєнна, як казала Камі))",а*уєнна
"Яка різниця, хто ти за дипломом, якщо по життю ти хуй.",хуй
"Та ну нахуй, це ж там підписувати бумажку треба, лінь.",нахуй
мені в школі і не таку хуйню казали,хуйню
"Іди нахуй, порошок блять, не буду я за тобою бігати.","нахуй, блять"
"Пора слухати величну симфонію *Ну його нахуй*, а завершувати увертюрою *Пєздєц* до симфонії *Життя*.","нахуй, Пєздєц"
"Знайому запросили гуляти двоє пацанів.Один - крутий чувак, з афігєнним почуттям гумору, інший - егоїстичне мудло.",егоїстичне мудло
"Де гарантія, шо цей підор не натворить хуйні і після смерті?","підор, хуйні"
А ти блядь не бачиш скільки разів?!,блядь
А ховрашки від ЗРАДИ активно їли гівно і верещали щто НІЗЯ чіпати?,гівно
"Їбати блядєй тра від тих починаючи, що гальмують законодавчі процеси, кінчаючи судами к хуям, схоже у повному складі.","їбати блядєй, хуям"
"Навчись сам собі готувати, мудак",мудак
"Ви заїбали підміняти поняття, люмпенота.","заїбали, люмпенота"
Ну і йти до сраки,сраки
Саме тому збирай манатки і пиздуй до них,пиздуй
"То мене нахуй посилали, а не його до мене..",нахуй
"Нікому, блять, навіть пожалітися не можна!",блять
"(Як я вже хочу приїхати, пизда просто, а ще два тижні).",пизда
"блядь, сам казав, шо побачив моє фото і собі захотів поставити.",блядь
"блять, забув на вписці зарядку від ноута. попереду 11годинний робочий день. сука.сука.сука","блять, сука"
"От би монетизувати своє почуття сорому за хуйню, котру роблять інші.",хуйню
а мені нравПросто гріх дрищів не падйобувать,"дрищів, падйобувать"
Та сукк пиздую з сльозами на очах,"сукк, пиздую"
На Вашу візову заяву в Консульстві положили хуй і дуже довго сміялися,хуй
Я можу їбанути по попі))))...,їбанути
"Особливо в тексті для перекладу, блядь.",блядь
"*бальной ублюдак*але ж це все цікаве розкриває, чувак!",бальной ублюдак
Але це ж ТИИИ бля ігнориш Це обідно.,бля
ну і хуй з ним.,хуй
Ахахахха блятьЯ б пішов пішкиЯкби дойшов,блять
"бляха, вгамуйте хтось тимошенко. уже блювати від її коників хочеться.","бляха, блювати, коників"
"блять, ну чому, коли я пишу саме такі твіти, ти тут?",блять
"Блядь, то кімнати в сусідньому гуртожитку...",Блядь
"не плєд хуйня, а ти хуйня",хуйня
"Дякую за сміх, мораль і 3 срані сльозини!",срані
"але спочатку то було не все одно, знач ти намагався не класти хуй, а це вже шось",хуй
Ну і хуй з тим брезентом),хуй
"Блядь, у мене відчуття, що я ревную геть усіх.",Блядь
"ой бля, що за думки в голові",бля
Та блять тисніть свої тупі кнопки!,"блять, тупі"
Що це за блядський цирк в Москві?)),блядський
Дивна срань відбувається в моєму житті.,срань
Що це за акція хворих органів оптом блять?,блять
виступав колись перед дітьми - їм похуй. ти для них лох без айфона.,"похуй, лох"
"Тільки підпишешся на якусь цікаву людину, а вона одразу перестає твітити, знаходить собі мужика, товстіє чи починає постити хуйню.","товстіє, хуйню"
сука я йду презіки купувати бо ну нах,"сука, нах"
Плач піздюків - це ідеальна зброя.,піздюків
А от гнила людина...люди мають можливість митися...,гнила
"Для всіх хто вважає, що я, блять, забагато матюкаюся наступна цитата:",блять
Цей блядський кондиціонер - гомофоб!,"блядський, гомофоб"
"Хуй там, хіба шо поблажку і замість вовчиці - Ніно",хуй
Новий говнотєрцєц - директор Россотруднічєства Воробйов.,говнотєрцєц
"- Мені похуй, що про мене говорять.",похуй
пмс - це ніхуя не весело,ніхуя
На колір та смак товариш не всякДля когось і Хакслі - хуйовий автор,хуйовий
"Ти чо, ахурмєл так базаріть, дядя?",ахурмєл
"то не росіяни, то сука італійці! боже ЯК Я НЕ ЛЮБЛЮ ІТАЛІЙЦІВ!!!","сука, НЕ ЛЮБЛЮ"
ЦЕ ЯКИЙСЬ СТЬОБ ВІД РОЗРОБНИКІВ,СТЬОБ
"Луччє я здохну єбучім ноунеймом, чем праслявлюсь і мене стануть показувати по гівнотв","здохну, єбучім, гівнотв"
"Ця спека думає, шо змусить мене вдіти майку з шортами, але хуй там пєл.",хуй
"'відчуваю себе говнарем, бо знаю цю пісню напам'ять'",говнарем
"колись розкажу, але не тут, а то злетяться всякі збоченці, які почнуть хуйню писати)","збоченці, хуйню"
"Давно на землю спустився демон, який захотів змучити людство та придумав він, блять, переїзди.","демон, блять, змучити"
"(Ну або які в нас там ще є елітарні мудаки, яким власна елітарність без тупоголових донецьких недостатньо елітарна) ","мудаки, тупоголових"
"Щороку, блять, чим ближче до дня народження, тим більше хочеться до нього не дожити.","блять, не дожити"
тільки він ще і гандон.,гандон
"Якщо я когось не читаю, значить я, блять, не хочу їх бачити в стрічці.",блять
Просто забирайся нахуй з моєї голови.,нахуй
"Тримай сраний навігатор, тварина, а то засунь як надалі.","сраний, тварина, засунь"
"мать тваю,ану іді сюда, гавно собачие,думал ко мнє лесть,","мать тваю, гавно собачие"
І всі на один час блять(,блять
"та бо сука, молоко хоче гречку, а гречка уйоба не дає.","сука, уйоба"
"Не знаю, як інші, але я, блять, не ображаюсь, а злюся Жартувати з себе маю право тільки я",блять
"От бляха нахуя починати казати те, що ти не збираєшся завершувати?!","бляха, нахуя"
"В періоди коли я пишу всіляку хуйню в твітер, мені соромно писати дм-ки мені здається, що вона мене засуджує","хуйню, соромно, засуджує"
"Рус, шо ти вже там нацейвокав",нацейвокав
пиздила в магазині та кричала про хуї на вулиці,"пиздила, хуї"
"Блядь, да доколє ж мені всілякі збоченці вк писатимуть? ._.","Блядь, збоченці"
"Санта, я хуйово поводилась, тож принеси наркотіків плєз.","хуйово, наркотіків"
"Дід Мороз, сука, подаруй мені роботу",сука
"Не бійтесь посилати нахуй людей, яким ви не потрібні.",нахуй
"Де блять м'який знак, сука?","блять, сука"
ТО ШО ТАК ВАЖКО НАПИСАТИ ПАРУ РЕЧЕНЬ? чи послати нахрін і не агрити своїми нормальниками. бісить.,"послати нахрін, агрити, бісить"
"це якісь йобані дегенерати, які свої копійки в кишені порахувати не можуть.",йобані дегенерати
Це блять логіка чи що це взагалі?,блять
"Все пішло в пизду, як тільки мені здалося, що все заєбісь.","пішло в пизду, заєбісь"
"– Нєа – блять, кінець року, люди!",блять
"Нє, бляха, мав людям ногами гривку поправляти.",бляха
"не блять, а комунікабельна, але в цьому випадку, так, ТАСЯ БЛЯТЬ.",блять
"ну значить буду мити ввечері, коли повернуся, не можу ж повністю забити хуй",хуй
"А тепер урижні випускники обступили мій падік і передають колом сігу миру, позаду йде вчителька, їй уже на все похуй.",похуй
"Якщо трішки поскребти тіх смертників, що підривають людей в Європі, обов'язково вилізе руснява сутність.","смертників, підривають, руснява сутність"
Мозок: Я не дам тобі спати ВСЮ НІЧ!!,не дам
"Та коли я вже висплюся, сука, без прокидань о 3й ночі та без ворочання по дві години.",сука
"Починай вчити, атвічаю, там ще дохуя чудових слів.",дохуя
"Хочеться бухати, читати хуйню і писати хуйню.","бухати, хуйню, хуйню"
"Краще синиця в руках, ніж ти, мразь.",мразь
"І пиздить, і пиздить собі.",пиздить
Я блять не говорила про іншу стать.,блять
"То мені психічна травма, блядьЗгадувати не хочу",блядь
"всім іззя, а їй можна, бо вона нємношк і це німецький фонд? серйозно блядь?",блядь
"сука, ви або ставайте в стороні і чухайте свою сраку, або не лізьте серед дороги/проходу зі швидкістю підбитого равлика. заєбали.","сука, срака, заєбали"
"Пардон, що влажу, але блять, ти десь недалеко від мене, і мені це не дає спокою.",блять
"Бля, сиджу і думаю: ніхуйово ти так виглядала в 10 років......","Бля, ніхуйово"
"Тим і хуйові шлюби: якщо один з подружжя купує шось на власні кошти, другий рахує це повноправно своїм.",хуйові
"'Сам чувак із Харкова, цього року з''їздив до Києва на канікули, розказує мені, який пиздатий Київ.'",пиздатий
Я сюди хуїсосити всіх прийшла.,хуїсосити
Про перекладацтво і мудацтво | стрнґ,мудацтво
"Оце блять діалог з Трампом, ок.",блять
"Пробачте мені таке нахабство, але Сократ дискутує як мудак.","нахабство, мудак"
"Я нікого не тримаю, уходиш то й пиздуй",пиздуй
"ну блять, от все вказує на те, що треба пити, і якого хуя я ще досі не п'ю??????","блять, хуя"
"Боже, бля, наші люди всьо фільтрують божими законами",бля
"та пиздець))) я не очікувала, що прям так одразу це навчання почнеться з першого повідомлення))",пиздець
"олсо, фан факт: до 85 в Уругваї була пиздецька діктатура і діка інфляція.","пиздецька, діка"
"Підвозиш людину, а вона починає безглузді поради під руку пиздіти.",пиздіти
Зараз би за віндоус доїбатися.,доїбатися
"Не висипалась вже хуй зна скільки, і ніяк не можу.",хуй
"Бляха, вже третій день поспіль про члени/цицьки/секс і т.п. говорю.",Бляха
Дайте мені машину часу і йдіть нахуй,нахуй
НитиА не бути тупою пиздою,тупою пиздою
"А ти потім ходи і думай, шо за хуйня відюувається навколо",хуйня
"Бля тікі виставлю історію вк,  сразу її дивляться деякі люди, нагадуючи про себе,  а мені потім страдай нахуй","Бля, нахуй"
в яких ти зараз йдеш нахуй))0),нахуй
"Перший сракопад сезону, за півтори доби до його завершення#миздобули",сракопад
"Цікаво,а якщо хуйло підірве щось в Лондоні,Брюселі,Парижі,Берліні і т.д.",хуйло
"'капелюх обов'язково треба надіти, похуй шо зима і вуха мерзнуть, капелюх і окуляри, без окуляр читати взагалі нема сенсу'",похуй
"'Боже, блять, чому просто не можна зобов'язати вчити англійську всіх людей, які так чи інакше контактують з іноземцями.'",блять
"бля, я не хочу, щоб він закінчувався :(",бля
