Sentence,Negative Connotations
"Всесвіт вчить мене забивати хуй на тих, хто забиває його на мене, а я ніяк не вивчу урок...",забивати хуй
"Ахахах, єбать, добре, шо не поступав туди#КНЕУ_топчік",єбать
"Все одно він мудак, бо не пише)",мудак
Тому доводиться вмикати режим хитрожопість.,хитрожопість
"От нахуя мене зайобувати з самого ранку, а???","нахуя, зайобувати"
"бляха, як же мені прикро, що все так ;(",бляха
Хороші спогади - це та ще хуйня.,хуйня
Бо вам то не подобається.та блять.,блять
Кольорова печать на звичайному папері 10 гривень блятьІдіть нахуй,блятьІдіть нахуй
"І головне ж перша заговорила, а я...лох...",лох
Ідіть нахуй зі своїми блядськими стереотипами.,"нахуй, блядськими"
"Очевидно, бог чистоти приготував, щоб пиздити мене, бо не прибираю.",пиздити
НєБо у вас хуйовий гуртожиток,хуйовий
"Кидайте цю милоту будь якому руснявому гівну, що почне патякати за те як на Сколєнії жить харашо.","руснявому гівну, патякати"
Подруга прийшла пиздіти зі своїм мудаком до мене в кімнату.,"пиздіти, мудаком"
"Є частинка щастя в хорі народу на концерті Жадана і Собак, який співає:Чотири роки сука без Кобзона!",сука
Всі збиратимутися та дрочитимуть на твої фоточки.,дрочитимуть
"Бандіти, написав в бложик, про те як мусарку вогнеметами озброїли.","Бандіти, мусарку"
Нахара ти включила бізнес аккаунт в інста якщо ти школоло і тебе фоловлять тільки твої однокласники блять..,"нахара, школоло, блять"
Так хочеться простого людського щоб до крові відпиздили по дупі.,відпиздили
каре і срібло у хуйовій якості,хуйовій
"обколються своєю марихуаною, а потім всяку хуйню роблятьнаркотики - зло","обколються, марихуаною, хуйню, наркотики, зло"
Коли ти дуже жостко підйобуєш Настю,жостко підйобуєш
Дуже хочу написати щось дуже розумне але хуй його знає що...,хуй
Ну чьо Михасику не отримаєш ти того що ти блядь хочеш...,блядь
- Ти бухаєш водяру і забиваєш на все болт!,"бухаєш, водяру, забиваєш, болт"
"Він потім думає, ну і в пизду не дуже то і хотілось їсти.",пизду
Українська термінологія - це піздєц.,піздєц
"І бля, їхала сюди - то мала роботу.",бля
"Хочу постити депресивну хуйню в інст, але там забагато знайомих","депресивну, хуйню"
не лишайте пухнастих мудаків наодинці зі шкарпетками,мудаків
"ДаЗнав одну, їбанутішої людини не бачив",їбанутішої
"Чоловіки, хлопці - яйця, блять, в руки і до Києва!",блять
"В коментарях автор пояснює, що їздив дивитися, як тубільці пиздяться між собою, про “both sides” і “more neutral approach”, охуєнно","пиздяться, охуєнно"
"Воно нас, блядь, ні до чого не готувало.",блядь
"Люди кажуть, що всім похуй на них.",похуй
"Очікуєш на щось гідне, а в результаті отримуєш типову хуйню",хуйню
а нє поставіть-ка мнє хуй на аву і зіпсувати собі репутацію?,хуй
"Дякую за зауваження) Пиздити мене треба, щоб менше пизділа!","пиздити, пизділа"
Йди на хуй під силу,хуй
"Як воно, схоже  бляді на ваші 'незаангажовані' опитування?",бляді
"Ох ти ж блін, я й не бачила, шо вже так пізно.",блін
"Лєна, краще мене кашею годуй, ніж піздюка.",піздюка
бляяя точно) і поміняти прізвище вконтактику,бляяя
"Вкотре переконуюсь, шо я думаю піздою, а не мозком, блять","піздою, блять"
"Зараз,бляха-муха,закурю....грьобаний футбол,тримай себе в руках,Міла!","бляха-муха, грьобаний"
"Яка ж я зла, блять.",блять
та тоді якийсь пиздец бувв мене рідко губи тріскають,пиздец
"Чемпіоном він хоче бути, ага, бля.",бля
А всюди йобаний натовп з йобаними руками.,"йобаний, йобаними"
"Мені дохуя французької, а єбав, бо усний:з","дохуя, єбав"
"бляха, я не можу змусити себе вчитися!",бляха
Блядь та ну ви знущаєтесь?,"Блядь, знущаєтесь"
Мандєц блядьЧо ж так смєшно з цього?,"Мандєц, блядь"
"Та нахуй ти мені впав, скотина ти така)))","нахуй, скотина"
"Дивлюсь на відповіді голосувань і бля, who the fuck так погано мене знає?","бля, who the fuck, погано"
"та блять, нема зворотніх плацкартів на коли мені треба в обозрімом будущєм",блять
"Ну нахуй, мудаки і є мудаки","нахуй, мудаки"
"Чувак, який безуспішно намагався вмовити мене на секс, пішов ва-банк і тепер замість ниття про свій недойоб кидає мені АНЕКДОТИ.","недойоб, ниття"
"Той хуй в тг не заходитьТи шо, яка ВікторіяЯ собі не дозволяю тепер такого",хуй
"Господи йоб твою мать, вирубіть уже літо нахуй.","йоб, нахуй"
"' бля, ти пам''ятаєш, шо мені було потім?) я мацала так пити)'",бля
Схуялі ти пишеш твіти з моєю картинкою?,Схуялі
"'Перед тим, як щось затвітити, запитай у себе: ''А може всім похую на то?'', і пам''ятай, що відповідь завжди ''Так''.'",похую
"гавно вапрос, від кого передати?)",гавно
Кидає фотку в платті і каже - диви яка в мене тут жопа!,жопа
завжди роблю хуйовий а їй нра,хуйовий
Коли пацан - пиздець як відразливо.,"пиздець, відразливо"
"Підйом, курво, Arbeit macht frei",курво
– Я что лох налогі платіть?,лох
Ну вас нахєр з вашою політикою.,нахєр
Один хуй хріново добиратись з Наукової до Рясне шо старим 131 шо новим 11 #lviv #піздєц,"хуй, хріново, піздєц"
Один раз побув долбайобом і на все життя ним залишився.,долбайобом
"словом, заїбало то всьо. ви кто такіє? я вас нє звал. ідітє нахуй","заїбало, нахуй"
"Блін, я sooooo excited, прям жопою в кріслі пританцьовую","Блін, жопою"
"А нахуя він, є від нього щось, окрім шкоди?","нахуя, шкоди"
"Ого, а нахуя вони це постять...",нахуя
"Ахахах бляя, уявив собі це",бляя
блять а шо це справді лякає?) я завжди так роблю,блять
"бля, я тікаю від вас спати.",бля
Я викину цю кончену картку в Стікс блять,"кончену, блять"
"Ну блять, давайте вже про імпотенцію та рак, так нецікаво.",блять
"Я: Рєбзь, може суші візьмем?",None
"Сука, йобаний твіттер - капуста підгоріла ._.","Сука, йобаний"
"не звертай уваги. мудаків мільйон, ти одна.)",мудаків
"Все блять, привіт пенсіонерський відпочинок: сходила в замок, погуляла набережною, випила, тепер наступні дві доби хочу просто проспати в номері.",блять
Де вона зараз – хуй знає,хуй
"Підйоб, над яким не гріх поплакати.","підйоб, гріх"
"Ну бляяя, чого вони такі каєфні?",бляяя
"чума на дома цих мудаків, які розвивали рейшинал чойс теорію, ВОІСТІНУ.","чума, мудаків"
"Ранок почався з мамчиних нарікань на Укргазбанк:— бляцький Укргаз, уроди...— и тебе хорошего дня","мамчиних нарікань, бляцький, уроди"
"-ЦЕ ТИ МЕНЕ ЩА ЖИРНИМ ОБІЗВАЛА, ТА?!","жирним, обізвала"
"Тільки раптом що, це їсти треба, а не на пизду намазувати",пизду
"Сміх сміхом, а пизда горіхои",пизда
"Мій ентузіазм підриває погане самопочуття, чорт.",чорт
Вангую прапори новоросій чи іншого роду провокативні хуйні на трибунах,хуйні
Хахахах зато ви всі такі ахуєнно правильні що Господь Бог сикається від вас,"ахуєнно, сикається"
"КекНу типу пиздиті ніачом то і в житті не важкоНо я колись теж напастой мовчав, тому шарю тебе",пиздиті
Я можу придумувати їбануті програми для СТБ.,їбануті
Я охуєла і привела кураторку.,охуєла
"жопа, к слову – на 2 з мінусом і без наколок.",жопа
"Можу допомогти, все рівно хуйї штурхаю",хуйї
"я за сьогодні вже 2 рази блять, руки реально з жопи ростуть","блять, жопи"
"ой блять, плюнув подорожник приклав і заєбісь","блять, заєбісь"
"А варто лиш почути тупу наркоманську фігню, ржу як коняка.","тупу, наркоманську, фігню"
Мужик що проходив мимо зацінив мою сраку.,сраку
"Здається, мене люблять 2 дівчини.ото нєхуй було писати шопопало",нєхуй
"вже майже четверта, а я не сплю, блять",блять
Нахуя я це вчу блять?,"Нахуя, блять"
"ну бля, я не вірю",бля
"Апятьдвадцатьпять, курва)) ну але так уж бить, мені не звикати)",курва
"Лєра, вітаю, ти похерила найбільш невибагливу рослину.",похерила
"Охуєнні мапи Польщі, мої улюблені про туризм, найбільш небезпечних тварин і ландшафт",Охуєнні
"Хочеш їсти - їж, хочеш пити - пий, хочеш трахатися - ну, буває.",трахатися
"Я просто маленька дівчинка, котра хоче тортик, обіймів і хуярити ворогів наточеною сокирою.",хуярити
"Хотіла б бути твоєю сестрою, щоб завжди мати можливість тебе трахати.",трахати
смм вийшов на вулиці і нам всім пизда,пизда
"Діма: цвіте і пахне, вже чудово себе почуває та готовий валили на сесію. Хтось: ніхуя, в тебе карантин",ніхуя
блять ото жиза я в шоці,блять
"годуємо, блять, котів о п'ятій ранку",блять
"Бо сука-блять перша ночі, а ти тут розлігся як тюлєнь на льодовику.",сука-блять
"Це ж наче така хуєта, але від неї паскудно до смерті.","хуєта, паскудно"
Ну вот сучка прямо як у мене),сучка
"Заношений дірявий светр, списані блокноти, люди, котрим на тебе похуй.",похуй
"Ну бляха, як воно звучить",бляха
"Здатність говорити - це просто найнепотрібніша хуйня, дана мені.",хуйня
"Як перестати хотіти трахнути все, що рухається?",трахнути
"Мене зараз закидають гнилими хуями, але Скарлет Йохансон",гнилими хуями
Ну окЯ хуйова людина по факту і всьо,хуйова
О то в наших батьків частково така хуйня.,хуйня
"Має дві роботи, але вкрай ниє, яка у нас хренова держава, який він бідний, яке хуйове життя.","хренова, хуйове"
"Але не можу, бо то блять сім'я.",блять
"В чому ваша, сука, проблема?",сука
"Я не зла, але скоро буду бити вікна так припаркованим мудакам",мудакам
"Вам шо, феміністка хуй відгризла?",хуй відгризла
"- давай закрутимось у вирі пристрастей?- блять, Якубович, крути сам свій барабан, старий ти дід","блять, старий дід"
"сука, як же хочу сирників.",сука
сід каже що я хуйня :(,хуйня
Коли я навчуся не пройобувати час для сну на хуйню?,"пройобувати, хуйню"
Останнім часом не бачив НЕ мудаків.,мудаків
Толстой блядь воістіну великий фікрайтер,блядь
"Дякую всім, хто тримав кулаки, але співбесіда нє удалась і мене послали нахєр.",нахєр
"Ну та, і трахнутись було б непогано.",трахнутись
Моє побажання на 2014-ий: хай би всі мудаки залишились в 2013-му.,мудаки
"Буває, читаєш шось і думаєш про себе Ну що за хуйня?",хуйня
Вміння кормити хуями арт спільноту,хуями
"сукаааа, я більше не полечу нікуди!!!!!",сукаааа
"Тому що ідіть нахуй, ось чому.",нахуй
"ТА ЦЕ БУВ МОКРИЙ, МАТЬ ЙОГО, СНІГ!!!",мать його
Іноді ой як хочеться повиривати патли всім цих шлюхам!,повиривати патли шлюхам
"Якщо шось не так, то відкрий, сука, рота і скажи.",сука
Можна я перестану буть такою як я є ало мені має буть похуй а чьото не похуй,похуй
"Сука, який же ж ахуєнний день. Треба мені частіше вихідні брати","Сука, ахуєнний"
"Пізда катьонку, більше срать не буде.","Пізда, срать"
"Ні, та хуйня на однокласниках залишалась)",хуйня
"Залякані люди, збайдужілі своїм страхом...","залякані, збайдужілі, страхом"
"А при Януковичі ти, хуй, так само робив?",хуй
Ніхуя блять з неї нікуди не їде.,"Ніхуя, блять"
"Завжди хотіла бути коханкою, а не дружиною, бо їх просто трахають і все.",трахати
"Напиши тій людині ''Йди на хуй'' Порада Ендрю, на любі випадки життя",йди на хуй
"Люди, котрі юзають мільйон смайлів, без зайвих слів ідуть нахуй.",нахуй
Яка була курва матиТака ж курва дочка!,курва
"щойно бачила дівчину в сукні і в чоботахне в''язаних, а звичайних, осінніх, блять, чоботах",блять
"Сьогодні у нас, блядь, челендж розбуди Юляну?!",блядь
"Треба було відос знімати, блять.",блять
Точно не мої їбануті сусіди.,їбануті
"Блядь, сука, вибішує нахуй ця хуйня.","блядь, сука, нахуй, хуйня"
І все це блять особисто до мене звернуте.,блять
"Ааааа, ну нахуя ставити це на порозі??????",нахуя
"Бля, мене той сімл бісить.","Бля, бісить"
"А ф-зми є різні - я за той, який цю парадигму відправить нахуй",нахуй
"я чесно зізналась, що мені похуй, і канєшно ж через це тепер я тупа безсердечна сука","похуй, тупа, безсердечна, сука"
"#6йсирник RT : - Та я, блядь, не из-за бабла.",блядь
"Та нахєр блядь то всьо, всі сука сцять бути відповідальним і накатати ту заяву до ректора.","нахєр, блядь, сука, сцять"
"Отримала нині міні-інфаркт, бо думала, що він мені нахуй дзеркало знесе.",нахуй
Нема онлайн - трахає шлюх.,трахає шлюх
"Ох ці баби, котрі всерйоз думають, що комусь не похуй на все, що відбувається в їхньому житті.","баби, похуй"
"хуй там, Тернопіль Сіті, БАМ йобана","хуй, йобана"
Що блять за расистський твіттер сьогодні,"блять, расистський"
Мау хай йдуть в жопу,жопу
"за тим самим платоном поетів та взагалі митців - нахуй з пляжа, вигнати за межі Держави Платона)",нахуй
наш універ—бєспрєдєл.читай хуйовую шеву і буде тобі щастя із розумінням,"бєспрєдєл, хуйовую"
Я і щас нахуй здався?,нахуй
"Краще так, ніж всякі мразенькі",мразенькі
"Я не я, якщо не пошлю на хуй",пошлю на хуй
"Відчуття, ніби все тіло ногами пиздили.",пиздили
Вобщєм псіхану і піду на вокзал зустріну їїІ паєбать,"псіхану, паєбать"
"імхо - жахлива хуйня. красіво, більш-менш непогана бойовка, загалом - хуйня.","жахлива хуйня, хуйня"
про ситуацію з плагіатом у журналі Vogue можу сказати: 2 тупі пизди,тупі пизди
"Ви, блять, за пару годин і не згадаєте кому це писали, нащо цей цирк?","блять, цирк"
про шлюх і наркоту ще.,"шлюх, наркоту"
При мені такої хуйні б не було.,хуйні
"А я блять що, а я собі така ахуєнна, ніколи не падаю духом.","блять, ахуєнна"
"городити хуйню про грамотність жахливо неграмотними і українською, і російською мовами: вишенька на тортику цієї феєрії","хуйню, жахливо неграмотними"
"Інші просто долбайоби, бо я теж не шарю, за що ціна така.",долбайоби
Краще так ніж твітити дохуя всьякого шлаку,"дохуя, шлаку"
"Хочеш все встигнути? канєха даааа, проспи всьо нахуй:З",нахуй
"в мене така жопа, шо їй і 3 торти не завадить",жопа
"ні, це дає тобі право посилати їх нахуй!",нахуй
"Блять, я що весь час телік носив з собою і робив хуйню?","Блять, хуйню"
Через цей їбаний олх в мене вже починає блять підгорати,"їбаний, блять"
Піздєц я вчасно знайшов лігво тараканів у себе над ліжкомЯкого блять хуя?,"Піздєц, блять, хуя"
"І блять, навколо якісь діти і вони хочу бухати і вони про це пишуть.","блять, бухати"
"Життя хуйня, ми безмежно самотні, тому піду пекти піцу.",хуйня
Бля ця херея ще й двигається,"Бля, херея"
А їбля мозку - то піздєц.,"їбля, піздєц"
"Та блять, боже, дай мені вже вмерти.","блять, вмерти"
Почуваю себе тупим дебілом :(,"тупим, дебілом"
"+1 RT не можна доторкатисядо людей в маршрутці!не можна, блять!",блять
Йобана тупа мразота зіпсувала мені рейтинг на роботі.,"йобана, тупа, мразота"
"Воно настільки убоге, що навіть я, яка давно відверто називає Фреймут бляддю, не маю що сказати.","убоге, бляддю"
так ми ж багато англ і рос читаєм. от і получається хуйня.,хуйня
Нехуй мені розповідати за бєдних лікарів & призваніє.,Нехуй
"А чи не мразь ти, Дмитро?",мразь
Пісня про сесію:зззНа відміну від–Ну його на хуй :з,хуй
"гегель такий мілаш,коли пише про абстрактне мислення, і таке мудло, коли товкмачить про право і державу.",мудло
Збери п'ятьох мудакуватих клієнтів за день та отримай одне ввічливе приємне сонечко у подарунок!,мудакуватих
"Бляха, нахєра ми це зробили?","бляха, нахєра"
"Це не просто просирання,а нудне просирання",просирати
"Я зара вшарила, що я дуже долбайоб.",долбайоб
"Я блять третій день в хаті, а звалити звідси хочеться ВЖЕ І НЕГАЙНО.",блять
"То блять роби щось, жінко.",блять
"бля, не писать йому тоді, чи шо",бля
Не розумію чим я заслужила цю хуйову карму останнім часом,хуйову
"Шо за хуйня? - сказав я, уважно підбираючи слова.",хуйня
"дякую, а ти киця, блять)",блять
"всі, кому не нрав Євробачення тікайте з села,вам пизда #Eurovision",пизда
